vllm/distributed/device_communicators/quantized_allreduce/configs/dtype=int8,device_name=NVIDIA_H100_80GB_HBM3,world_size=8,gs128.json
{
  "world_size": 8,
  "dtype": "int8",
  "device_name": "NVIDIA_H100_80GB_HBM3",
  "group_size": 128,
  "params": {
    "1048576": {
      "BLOCK_SIZE": 4096,
      "num_warps": 32,
      "use_p2p": false,
      "time_us": 31.5
    },
    "2097152": {
      "BLOCK_SIZE": 8192,
      "num_warps": 32,
      "use_p2p": false,
      "time_us": 42.6
    },
    "4194304": {
      "BLOCK_SIZE": 8192,
      "num_warps": 32,
      "use_p2p": false,
      "time_us": 65.5
    },
    "8388608": {
      "BLOCK_SIZE": 4096,
      "num_warps": 16,
      "use_p2p": false,
      "time_us": 106.4
    },
    "16777216": {
      "BLOCK_SIZE": 8192,
      "num_warps": 8,
      "use_p2p": true,
      "time_us": 173.2
    },
    "33554432": {
      "BLOCK_SIZE": 8192,
      "num_warps": 8,
      "use_p2p": true,
      "time_us": 287.7
    },
    "67108864": {
      "BLOCK_SIZE": 8192,
      "num_warps": 8,
      "use_p2p": true,
      "time_us": 523.5
    },
    "134217728": {
      "BLOCK_SIZE": 16384,
      "num_warps": 16,
      "use_p2p": true,
      "time_us": 980.2
    },
    "268435456": {
      "BLOCK_SIZE": 16384,
      "num_warps": 16,
      "use_p2p": true,
      "time_us": 1860.7
    },
    "536870912": {
      "BLOCK_SIZE": 16384,
      "num_warps": 16,
      "use_p2p": true,
      "time_us": 3661.8
    }
  }
}