vllm/distributed/device_communicators/quantized_allreduce/configs/dtype=int8,device_name=NVIDIA_H100_80GB_HBM3,world_size=4,gs128.json
{
  "world_size": 4,
  "dtype": "int8",
  "device_name": "NVIDIA_H100_80GB_HBM3",
  "group_size": 128,
  "params": {
    "1048576": {
      "BLOCK_SIZE": 8192,
      "num_warps": 32,
      "use_p2p": false,
      "time_us": 27.0
    },
    "2097152": {
      "BLOCK_SIZE": 16384,
      "num_warps": 16,
      "use_p2p": false,
      "time_us": 37.8
    },
    "4194304": {
      "BLOCK_SIZE": 16384,
      "num_warps": 8,
      "use_p2p": false,
      "time_us": 56.5
    },
    "8388608": {
      "BLOCK_SIZE": 8192,
      "num_warps": 16,
      "use_p2p": false,
      "time_us": 91.3
    },
    "16777216": {
      "BLOCK_SIZE": 16384,
      "num_warps": 32,
      "use_p2p": true,
      "time_us": 140.3
    },
    "33554432": {
      "BLOCK_SIZE": 16384,
      "num_warps": 32,
      "use_p2p": true,
      "time_us": 244.7
    },
    "67108864": {
      "BLOCK_SIZE": 16384,
      "num_warps": 16,
      "use_p2p": true,
      "time_us": 446.9
    },
    "134217728": {
      "BLOCK_SIZE": 16384,
      "num_warps": 32,
      "use_p2p": true,
      "time_us": 834.5
    },
    "268435456": {
      "BLOCK_SIZE": 16384,
      "num_warps": 32,
      "use_p2p": true,
      "time_us": 1626.3
    },
    "536870912": {
      "BLOCK_SIZE": 16384,
      "num_warps": 32,
      "use_p2p": true,
      "time_us": 3195.9
    }
  }
}