vllm/distributed/device_communicators/quantized_allreduce/configs/dtype=fp8,device_name=NVIDIA_H200,world_size=8,gs128.json
{
  "world_size": 8,
  "dtype": "fp8",
  "device_name": "NVIDIA_H200",
  "group_size": 128,
  "params": {
    "1048576": {
      "BLOCK_SIZE": 1024,
      "num_warps": 4,
      "use_p2p": false,
      "time_us": 19.2
    },
    "2097152": {
      "BLOCK_SIZE": 2048,
      "num_warps": 8,
      "use_p2p": false,
      "time_us": 27.6
    },
    "4194304": {
      "BLOCK_SIZE": 4096,
      "num_warps": 32,
      "use_p2p": false,
      "time_us": 42.9
    },
    "8388608": {
      "BLOCK_SIZE": 4096,
      "num_warps": 16,
      "use_p2p": false,
      "time_us": 77.6
    },
    "16777216": {
      "BLOCK_SIZE": 4096,
      "num_warps": 16,
      "use_p2p": true,
      "time_us": 147.8
    },
    "33554432": {
      "BLOCK_SIZE": 4096,
      "num_warps": 16,
      "use_p2p": true,
      "time_us": 271.4
    },
    "67108864": {
      "BLOCK_SIZE": 4096,
      "num_warps": 16,
      "use_p2p": true,
      "time_us": 519.4
    },
    "134217728": {
      "BLOCK_SIZE": 16384,
      "num_warps": 16,
      "use_p2p": true,
      "time_us": 1003.1
    },
    "268435456": {
      "BLOCK_SIZE": 16384,
      "num_warps": 16,
      "use_p2p": true,
      "time_us": 1948.6
    },
    "536870912": {
      "BLOCK_SIZE": 16384,
      "num_warps": 16,
      "use_p2p": true,
      "time_us": 3874.4
    }
  }
}