vllm/distributed/device_communicators/quantized_allreduce/configs/dtype=int8,device_name=NVIDIA_H200,world_size=8,gs256.json
{
  "world_size": 8,
  "dtype": "int8",
  "device_name": "NVIDIA_H200",
  "group_size": 256,
  "params": {
    "1048576": {
      "BLOCK_SIZE": 1024,
      "num_warps": 4,
      "use_p2p": false,
      "time_us": 20.2
    },
    "2097152": {
      "BLOCK_SIZE": 2048,
      "num_warps": 8,
      "use_p2p": false,
      "time_us": 27.9
    },
    "4194304": {
      "BLOCK_SIZE": 2048,
      "num_warps": 8,
      "use_p2p": false,
      "time_us": 46.0
    },
    "8388608": {
      "BLOCK_SIZE": 4096,
      "num_warps": 16,
      "use_p2p": false,
      "time_us": 77.5
    },
    "16777216": {
      "BLOCK_SIZE": 8192,
      "num_warps": 32,
      "use_p2p": true,
      "time_us": 144.0
    },
    "33554432": {
      "BLOCK_SIZE": 8192,
      "num_warps": 16,
      "use_p2p": true,
      "time_us": 264.9
    },
    "67108864": {
      "BLOCK_SIZE": 16384,
      "num_warps": 16,
      "use_p2p": true,
      "time_us": 490.4
    },
    "134217728": {
      "BLOCK_SIZE": 16384,
      "num_warps": 16,
      "use_p2p": true,
      "time_us": 926.1
    },
    "268435456": {
      "BLOCK_SIZE": 16384,
      "num_warps": 16,
      "use_p2p": true,
      "time_us": 1791.7
    },
    "536870912": {
      "BLOCK_SIZE": 16384,
      "num_warps": 32,
      "use_p2p": true,
      "time_us": 3549.6
    }
  }
}