vllm/distributed/device_communicators/quantized_allreduce/configs/dtype=int8,device_name=NVIDIA_H200,world_size=4,gs256.json
{
  "world_size": 4,
  "dtype": "int8",
  "device_name": "NVIDIA_H200",
  "group_size": 256,
  "params": {
    "1048576": {
      "BLOCK_SIZE": 2048,
      "num_warps": 8,
      "time_us": 15.1
    },
    "2097152": {
      "BLOCK_SIZE": 4096,
      "num_warps": 16,
      "time_us": 21.5
    },
    "4194304": {
      "BLOCK_SIZE": 8192,
      "num_warps": 32,
      "time_us": 34.2
    },
    "8388608": {
      "BLOCK_SIZE": 8192,
      "num_warps": 32,
      "time_us": 61.3
    },
    "16777216": {
      "BLOCK_SIZE": 8192,
      "num_warps": 16,
      "time_us": 119.2
    },
    "33554432": {
      "BLOCK_SIZE": 16384,
      "num_warps": 16,
      "time_us": 214.3
    },
    "67108864": {
      "BLOCK_SIZE": 16384,
      "num_warps": 16,
      "time_us": 409.2
    },
    "134217728": {
      "BLOCK_SIZE": 16384,
      "num_warps": 32,
      "time_us": 786.8
    },
    "268435456": {
      "BLOCK_SIZE": 16384,
      "num_warps": 32,
      "time_us": 1553.4
    },
    "536870912": {
      "BLOCK_SIZE": 16384,
      "num_warps": 32,
      "time_us": 3066.4
    }
  }
}