vllm/distributed/device_communicators/quantized_allreduce/configs/dtype=fp8,device_name=NVIDIA_H100_80GB_HBM3,world_size=8,gs128.json
{
  "world_size": 8,
  "dtype": "fp8",
  "device_name": "NVIDIA_H100_80GB_HBM3",
  "group_size": 128,
  "params": {
    "1048576": {
      "BLOCK_SIZE": 4096,
      "num_warps": 16,
      "time_us": 29.6
    },
    "2097152": {
      "BLOCK_SIZE": 8192,
      "num_warps": 32,
      "time_us": 42.1
    },
    "4194304": {
      "BLOCK_SIZE": 8192,
      "num_warps": 8,
      "time_us": 62.0
    },
    "8388608": {
      "BLOCK_SIZE": 16384,
      "num_warps": 16,
      "time_us": 103.9
    },
    "16777216": {
      "BLOCK_SIZE": 4096,
      "num_warps": 16,
      "time_us": 176.4
    },
    "33554432": {
      "BLOCK_SIZE": 4096,
      "num_warps": 16,
      "time_us": 293.5
    },
    "67108864": {
      "BLOCK_SIZE": 4096,
      "num_warps": 16,
      "time_us": 536.3
    },
    "134217728": {
      "BLOCK_SIZE": 4096,
      "num_warps": 32,
      "time_us": 1036.5
    },
    "268435456": {
      "BLOCK_SIZE": 16384,
      "num_warps": 16,
      "time_us": 1998.3
    },
    "536870912": {
      "BLOCK_SIZE": 16384,
      "num_warps": 32,
      "time_us": 3944.0
    }
  }
}