vllm/distributed/device_communicators/quantized_allreduce/configs/dtype=fp8,device_name=NVIDIA_H100_80GB_HBM3,world_size=4,gs256.json
{
  "world_size": 4,
  "dtype": "fp8",
  "device_name": "NVIDIA_H100_80GB_HBM3",
  "group_size": 256,
  "params": {
    "1048576": {
      "BLOCK_SIZE": 8192,
      "num_warps": 32,
      "use_p2p": false,
      "time_us": 25.2
    },
    "2097152": {
      "BLOCK_SIZE": 16384,
      "num_warps": 8,
      "use_p2p": false,
      "time_us": 35.0
    },
    "4194304": {
      "BLOCK_SIZE": 16384,
      "num_warps": 8,
      "use_p2p": false,
      "time_us": 51.9
    },
    "8388608": {
      "BLOCK_SIZE": 8192,
      "num_warps": 32,
      "use_p2p": false,
      "time_us": 84.7
    },
    "16777216": {
      "BLOCK_SIZE": 8192,
      "num_warps": 32,
      "use_p2p": true,
      "time_us": 143.3
    },
    "33554432": {
      "BLOCK_SIZE": 8192,
      "num_warps": 32,
      "use_p2p": true,
      "time_us": 248.1
    },
    "67108864": {
      "BLOCK_SIZE": 8192,
      "num_warps": 32,
      "use_p2p": true,
      "time_us": 447.8
    },
    "134217728": {
      "BLOCK_SIZE": 16384,
      "num_warps": 16,
      "use_p2p": true,
      "time_us": 828.4
    },
    "268435456": {
      "BLOCK_SIZE": 16384,
      "num_warps": 32,
      "use_p2p": true,
      "time_us": 1605.8
    },
    "536870912": {
      "BLOCK_SIZE": 16384,
      "num_warps": 32,
      "use_p2p": true,
      "time_us": 3145.0
    }
  }
}