vllm/distributed/device_communicators/quantized_allreduce/configs/dtype=int8,device_name=NVIDIA_H100_80GB_HBM3,world_size=4,gs256.json
{
  "world_size": 4,
  "dtype": "int8",
  "device_name": "NVIDIA_H100_80GB_HBM3",
  "group_size": 256,
  "params": {
    "1048576": {
      "BLOCK_SIZE": 8192,
      "num_warps": 32,
      "use_p2p": false,
      "time_us": 25.9
    },
    "2097152": {
      "BLOCK_SIZE": 16384,
      "num_warps": 16,
      "use_p2p": false,
      "time_us": 38.2
    },
    "4194304": {
      "BLOCK_SIZE": 16384,
      "num_warps": 32,
      "use_p2p": false,
      "time_us": 55.8
    },
    "8388608": {
      "BLOCK_SIZE": 8192,
      "num_warps": 32,
      "use_p2p": false,
      "time_us": 90.0
    },
    "16777216": {
      "BLOCK_SIZE": 16384,
      "num_warps": 16,
      "use_p2p": true,
      "time_us": 139.3
    },
    "33554432": {
      "BLOCK_SIZE": 16384,
      "num_warps": 32,
      "use_p2p": true,
      "time_us": 242.5
    },
    "67108864": {
      "BLOCK_SIZE": 16384,
      "num_warps": 16,
      "use_p2p": true,
      "time_us": 440.0
    },
    "134217728": {
      "BLOCK_SIZE": 16384,
      "num_warps": 32,
      "use_p2p": true,
      "time_us": 819.1
    },
    "268435456": {
      "BLOCK_SIZE": 16384,
      "num_warps": 32,
      "use_p2p": true,
      "time_us": 1590.8
    },
    "536870912": {
      "BLOCK_SIZE": 16384,
      "num_warps": 32,
      "use_p2p": true,
      "time_us": 3124.3
    }
  }
}