vllm/distributed/device_communicators/quantized_allreduce/configs/dtype=int8,device_name=NVIDIA_H100_80GB_HBM3,world_size=8,gs256.json
{
  "world_size": 8,
  "dtype": "int8",
  "device_name": "NVIDIA_H100_80GB_HBM3",
  "group_size": 256,
  "params": {
    "1048576": {
      "BLOCK_SIZE": 8192,
      "num_warps": 32,
      "time_us": 31.6
    },
    "2097152": {
      "BLOCK_SIZE": 8192,
      "num_warps": 32,
      "time_us": 41.7
    },
    "4194304": {
      "BLOCK_SIZE": 8192,
      "num_warps": 32,
      "time_us": 66.2
    },
    "8388608": {
      "BLOCK_SIZE": 4096,
      "num_warps": 16,
      "time_us": 106.2
    },
    "16777216": {
      "BLOCK_SIZE": 8192,
      "num_warps": 32,
      "time_us": 170.7
    },
    "33554432": {
      "BLOCK_SIZE": 8192,
      "num_warps": 8,
      "time_us": 289.0
    },
    "67108864": {
      "BLOCK_SIZE": 8192,
      "num_warps": 16,
      "time_us": 515.9
    },
    "134217728": {
      "BLOCK_SIZE": 16384,
      "num_warps": 16,
      "time_us": 963.3
    },
    "268435456": {
      "BLOCK_SIZE": 16384,
      "num_warps": 16,
      "time_us": 1828.9
    },
    "536870912": {
      "BLOCK_SIZE": 16384,
      "num_warps": 16,
      "time_us": 3595.8
    }
  }
}