vllm/distributed/device_communicators/quantized_allreduce/configs/dtype=int8,device_name=NVIDIA_H100_80GB_HBM3,world_size=4,gs128.json
{
  "world_size": 4,
  "dtype": "int8",
  "device_name": "NVIDIA_H100_80GB_HBM3",
  "group_size": 128,
  "params": {
    "1048576": {
      "BLOCK_SIZE": 8192,
      "num_warps": 32,
      "time_us": 26.6
    },
    "2097152": {
      "BLOCK_SIZE": 16384,
      "num_warps": 16,
      "time_us": 38.2
    },
    "4194304": {
      "BLOCK_SIZE": 16384,
      "num_warps": 16,
      "time_us": 55.7
    },
    "8388608": {
      "BLOCK_SIZE": 8192,
      "num_warps": 32,
      "time_us": 88.8
    },
    "16777216": {
      "BLOCK_SIZE": 16384,
      "num_warps": 16,
      "time_us": 142.9
    },
    "33554432": {
      "BLOCK_SIZE": 16384,
      "num_warps": 32,
      "time_us": 245.6
    },
    "67108864": {
      "BLOCK_SIZE": 16384,
      "num_warps": 32,
      "time_us": 444.3
    },
    "134217728": {
      "BLOCK_SIZE": 16384,
      "num_warps": 32,
      "time_us": 833.5
    },
    "268435456": {
      "BLOCK_SIZE": 16384,
      "num_warps": 32,
      "time_us": 1624.6
    },
    "536870912": {
      "BLOCK_SIZE": 16384,
      "num_warps": 32,
      "time_us": 3195.3
    }
  }
}