vllm/distributed/device_communicators/quantized_allreduce/configs/dtype=fp8,device_name=NVIDIA_H200,world_size=4,gs256.json
{
  "world_size": 4,
  "dtype": "fp8",
  "device_name": "NVIDIA_H200",
  "group_size": 256,
  "params": {
    "1048576": {
      "BLOCK_SIZE": 2048,
      "num_warps": 8,
      "time_us": 15.1
    },
    "2097152": {
      "BLOCK_SIZE": 4096,
      "num_warps": 16,
      "time_us": 20.8
    },
    "4194304": {
      "BLOCK_SIZE": 4096,
      "num_warps": 16,
      "time_us": 34.0
    },
    "8388608": {
      "BLOCK_SIZE": 8192,
      "num_warps": 32,
      "time_us": 61.2
    },
    "16777216": {
      "BLOCK_SIZE": 8192,
      "num_warps": 32,
      "time_us": 118.7
    },
    "33554432": {
      "BLOCK_SIZE": 16384,
      "num_warps": 32,
      "time_us": 220.2
    },
    "67108864": {
      "BLOCK_SIZE": 16384,
      "num_warps": 16,
      "time_us": 410.7
    },
    "134217728": {
      "BLOCK_SIZE": 16384,
      "num_warps": 16,
      "time_us": 789.5
    },
    "268435456": {
      "BLOCK_SIZE": 16384,
      "num_warps": 16,
      "time_us": 1559.3
    },
    "536870912": {
      "BLOCK_SIZE": 16384,
      "num_warps": 16,
      "time_us": 3079.8
    }
  }
}