vllm/distributed/device_communicators/quantized_allreduce/configs/dtype=fp8,device_name=NVIDIA_H200,world_size=8,gs256.json
{
  "world_size": 8,
  "dtype": "fp8",
  "device_name": "NVIDIA_H200",
  "group_size": 256,
  "params": {
    "1048576": {
      "BLOCK_SIZE": 1024,
      "num_warps": 8,
      "use_p2p": false,
      "time_us": 20.4
    },
    "2097152": {
      "BLOCK_SIZE": 2048,
      "num_warps": 8,
      "use_p2p": false,
      "time_us": 26.9
    },
    "4194304": {
      "BLOCK_SIZE": 4096,
      "num_warps": 16,
      "use_p2p": false,
      "time_us": 42.4
    },
    "8388608": {
      "BLOCK_SIZE": 4096,
      "num_warps": 16,
      "use_p2p": false,
      "time_us": 76.8
    },
    "16777216": {
      "BLOCK_SIZE": 8192,
      "num_warps": 32,
      "use_p2p": true,
      "time_us": 143.7
    },
    "33554432": {
      "BLOCK_SIZE": 4096,
      "num_warps": 16,
      "use_p2p": true,
      "time_us": 267.0
    },
    "67108864": {
      "BLOCK_SIZE": 4096,
      "num_warps": 16,
      "use_p2p": true,
      "time_us": 508.6
    },
    "134217728": {
      "BLOCK_SIZE": 16384,
      "num_warps": 16,
      "use_p2p": true,
      "time_us": 976.2
    },
    "268435456": {
      "BLOCK_SIZE": 16384,
      "num_warps": 16,
      "use_p2p": true,
      "time_us": 1879.2
    },
    "536870912": {
      "BLOCK_SIZE": 16384,
      "num_warps": 16,
      "use_p2p": true,
      "time_us": 3778.0
    }
  }
}