tunableop_results3.csv
Validator,PT_VERSION,2.3.0
Validator,ROCM_VERSION,6.0.0.0-91-08e5094
Validator,HIPBLASLT_VERSION,0.6.0-592518e7
Validator,GCN_ARCH_NAME,gfx942:sramecc+:xnack-
Validator,ROCBLAS_VERSION,4.0.0-88df9726-dirty
GemmTunableOp_Half_TN,tn_14336_2048_8192,Gemm_Hipblaslt_TN_21908,0.965463
GemmTunableOp_Half_TN,tn_8192_96_4096,Gemm_Hipblaslt_TN_21647,0.0358275
GemmTunableOp_Half_TN,tn_10240_232_8192,Gemm_Hipblaslt_TN_22140,0.101732
GemmTunableOp_Half_TN,tn_5120_32768_8192,Gemm_Hipblaslt_TN_22051,4.55725
GemmTunableOp_Half_TN,tn_8192_240_28672,Gemm_Hipblaslt_TN_22087,0.307821
GemmTunableOp_Half_TN,tn_8192_104_8192,Gemm_Hipblaslt_TN_22062,0.0573243
GemmTunableOp_Half_TN,tn_8192_232_14336,Gemm_Hipblaslt_TN_22087,0.157222
GemmTunableOp_Half_TN,tn_10240_216_8192,Gemm_Hipblaslt_TN_22173,0.0943097
GemmTunableOp_Half_TN,tn_28672_240_8192,Gemm_Hipblaslt_TN_21797,0.300892
GemmTunableOp_Half_TN,tn_14336_32768_8192,Gemm_Hipblaslt_TN_22051,13.6188
GemmTunableOp_Half_TN,tn_57344_256_8192,Gemm_Hipblaslt_TN_22029,0.590088
GemmTunableOp_Half_TN,tn_8192_16384_7168,Gemm_Hipblaslt_TN_22029,3.84105
GemmTunableOp_Half_TN,tn_8192_216_4096,Gemm_Hipblaslt_TN_22197,0.0513445
GemmTunableOp_Half_TN,tn_5120_248_8192,Gemm_Hipblaslt_TN_22172,0.0684963
GemmTunableOp_Half_TN,tn_8192_240_14336,Gemm_Hipblaslt_TN_22087,0.157585
GemmTunableOp_Half_TN,tn_8192_192_4096,Gemm_Hipblaslt_TN_21949,0.0486632
GemmTunableOp_Half_TN,tn_5120_216_8192,Gemm_Hipblaslt_TN_22137,0.0593367
GemmTunableOp_Half_TN,tn_8192_216_8192,Gemm_Hipblaslt_TN_22197,0.0787818
GemmTunableOp_Half_TN,tn_8192_232_28672,Gemm_Hipblaslt_TN_22339,0.302836
GemmTunableOp_Half_TN,tn_8192_8_14336,Gemm_Hipblaslt_TN_23386,0.0526188
GemmTunableOp_Half_TN,tn_28672_192_8192,Gemm_Hipblaslt_TN_21951,0.232552
GemmTunableOp_Half_TN,tn_5120_176_8192,Gemm_Hipblaslt_TN_22060,0.0537381
GemmTunableOp_Half_TN,tn_10240_48_8192,Gemm_Hipblaslt_TN_21602,0.0530972
GemmTunableOp_Half_TN,tn_5120_72_8192,Gemm_Hipblaslt_TN_22133,0.0385725
GemmTunableOp_Half_TN,tn_8192_144_4096,Gemm_Hipblaslt_TN_22386,0.0434085
GemmTunableOp_Half_TN,tn_28672_8_8192,Gemm_Hipblaslt_TN_23388,0.136968
GemmTunableOp_Half_TN,tn_8192_48_4096,Gemm_Hipblaslt_TN_23388,0.028459
GemmTunableOp_Half_TN,tn_8192_88_28672,Gemm_Hipblaslt_TN_21667,0.155924
GemmTunableOp_Half_TN,tn_8192_152_2048,Gemm_Hipblaslt_TN_12699,0.0271198
GemmTunableOp_Half_TN,tn_8192_184_14336,Gemm_Hipblaslt_TN_22047,0.122234
GemmTunableOp_Half_TN,tn_2560_208_8192,Gemm_Hipblaslt_TN_21984,0.0430168
GemmTunableOp_Half_TN,tn_14336_4_8192,Gemm_Hipblaslt_TN_23388,0.0556315
GemmTunableOp_Half_TN,tn_28672_168_8192,Gemm_Hipblaslt_TN_21951,0.230884
GemmTunableOp_Half_TN,tn_57344_112_8192,Gemm_Hipblaslt_TN_22262,0.321229
GemmTunableOp_Half_TN,tn_8192_104_28672,Gemm_Hipblaslt_TN_21799,0.178549
GemmTunableOp_Half_TN,tn_28672_216_8192,Gemm_Hipblaslt_TN_21875,0.258265
GemmTunableOp_Half_TN,tn_5120_2048_8192,Gemm_Hipblaslt_TN_21801,0.330894
GemmTunableOp_Half_TN,tn_5120_4_8192,Gemm_Hipblaslt_TN_21520,0.0254822
GemmTunableOp_Half_TN,tn_8192_88_4096,Gemm_Hipblaslt_TN_21638,0.0335774
GemmTunableOp_Half_TN,tn_32000_256_8192,Gemm_Hipblaslt_TN_21904,0.326163
GemmTunableOp_Half_TN,tn_8192_256_2048,Gemm_Hipblaslt_TN_21938,0.0361285
GemmTunableOp_Half_TN,tn_10240_120_8192,Gemm_Hipblaslt_TN_21781,0.0698506
GemmTunableOp_Half_TN,tn_8192_2_14336,Gemm_Hipblaslt_TN_23386,0.0512145
GemmTunableOp_Half_TN,tn_5120_40_8192,Gemm_Hipblaslt_TN_21558,0.0340174
GemmTunableOp_Half_TN,tn_8192_256_14336,Gemm_Hipblaslt_TN_22087,0.164035
GemmTunableOp_Half_TN,tn_10240_160_8192,Gemm_Hipblaslt_TN_21793,0.0726842
GemmTunableOp_Half_TN,tn_8192_56_2048,Gemm_Hipblaslt_TN_12570,0.0206286
GemmTunableOp_Half_TN,tn_5120_2_8192,Gemm_Hipblaslt_TN_21520,0.0248358
GemmTunableOp_Half_TN,tn_8192_144_8192,Gemm_Hipblaslt_TN_21967,0.0627663
GemmTunableOp_Half_TN,tn_8192_152_7168,Gemm_Hipblaslt_TN_21799,0.0593111
GemmTunableOp_Half_TN,tn_8192_152_4096,Gemm_Hipblaslt_TN_22386,0.0448505
GemmTunableOp_Half_TN,tn_8192_192_14336,Gemm_Hipblaslt_TN_21852,0.120105
GemmTunableOp_Half_TN,tn_8192_4_14336,Gemm_Hipblaslt_TN_23386,0.051672
GemmTunableOp_Half_TN,tn_5120_224_8192,Gemm_Hipblaslt_TN_22137,0.0607654
GemmTunableOp_Half_TN,tn_10240_248_8192,Gemm_Hipblaslt_TN_21954,0.123705
GemmTunableOp_Half_TN,tn_8192_40_8192,Gemm_Hipblaslt_TN_22165,0.0464284
GemmTunableOp_Half_TN,tn_28672_144_8192,Gemm_Hipblaslt_TN_21921,0.200911
GemmTunableOp_Half_TN,tn_28672_248_8192,Gemm_Hipblaslt_TN_22190,0.30424
GemmTunableOp_Half_TN,tn_5120_120_8192,Gemm_Hipblaslt_TN_22364,0.0479974
GemmTunableOp_Half_TN,tn_8192_32768_28672,Gemm_Hipblaslt_TN_21883,28.4108
GemmTunableOp_Half_TN,tn_8192_160_4096,Gemm_Hipblaslt_TN_22386,0.0445573
GemmTunableOp_Half_TN,tn_8192_72_14336,Gemm_Hipblaslt_TN_21667,0.0688465
GemmTunableOp_Half_TN,tn_5120_208_8192,Gemm_Hipblaslt_TN_22098,0.0630227
GemmTunableOp_Half_TN,tn_28672_136_8192,Gemm_Hipblaslt_TN_21921,0.198029
GemmTunableOp_Half_TN,tn_28672_16_8192,Gemm_Hipblaslt_TN_23388,0.137436
GemmTunableOp_Half_TN,tn_2560_136_8192,Gemm_Hipblaslt_TN_21777,0.0352125
GemmTunableOp_Half_TN,tn_8192_32768_4096,Gemm_Hipblaslt_TN_22051,3.8038
GemmTunableOp_Half_TN,tn_5120_168_8192,Gemm_Hipblaslt_TN_22060,0.0529375
GemmTunableOp_Half_TN,tn_8192_1_28672,Gemm_Hipblaslt_TN_21531,0.125295
GemmTunableOp_Half_TN,tn_5120_88_8192,Gemm_Hipblaslt_TN_22133,0.0394969
GemmTunableOp_Half_TN,tn_8192_72_4096,Gemm_Hipblaslt_TN_21638,0.0329126
GemmTunableOp_Half_TN,tn_14336_72_8192,Gemm_Hipblaslt_TN_21636,0.0696266
GemmTunableOp_Half_TN,tn_8192_56_14336,Gemm_Hipblaslt_TN_22165,0.0658987
GemmTunableOp_Half_TN,tn_28672_256_8192,Gemm_Hipblaslt_TN_22190,0.305496
GemmTunableOp_Half_TN,tn_5120_184_8192,Gemm_Hipblaslt_TN_22060,0.054132
GemmTunableOp_Half_TN,tn_8192_40_7168,Gemm_Hipblaslt_TN_22165,0.0422792
GemmTunableOp_Half_TN,tn_8192_96_8192,Gemm_Hipblaslt_TN_22165,0.050256
GemmTunableOp_Half_TN,tn_5120_8_8192,Gemm_Hipblaslt_TN_21530,0.0260842
GemmTunableOp_Half_TN,tn_8192_104_14336,Gemm_Hipblaslt_TN_22108,0.0847853
GemmTunableOp_Half_TN,tn_57344_152_8192,Gemm_Hipblaslt_TN_21797,0.344198
GemmTunableOp_Half_TN,tn_2560_16_8192,Gemm_Hipblaslt_TN_21531,0.0184174
GemmTunableOp_Half_TN,tn_28672_16384_8192,Gemm_Hipblaslt_TN_22029,14.8813
GemmTunableOp_Half_TN,tn_8192_200_28672,Gemm_Hipblaslt_TN_22081,0.236695
GemmTunableOp_Half_TN,tn_5120_192_8192,Gemm_Hipblaslt_TN_22060,0.0518666
GemmTunableOp_Half_TN,tn_8192_128_8192,Gemm_Hipblaslt_TN_22164,0.0585468
GemmTunableOp_Half_TN,tn_8192_32_2048,Gemm_Hipblaslt_TN_21566,0.0188782
GemmTunableOp_Half_TN,tn_8192_64_14336,Gemm_Hipblaslt_TN_21587,0.0656877
GemmTunableOp_Half_TN,tn_28672_200_8192,Gemm_Hipblaslt_TN_22066,0.254491
GemmTunableOp_Half_TN,tn_8192_176_4096,Gemm_Hipblaslt_TN_22197,0.0493952
GemmTunableOp_Half_TN,tn_5120_200_8192,Gemm_Hipblaslt_TN_22137,0.0584061
GemmTunableOp_Half_TN,tn_57344_4_8192,Gemm_Hipblaslt_TN_21529,0.243236
GemmTunableOp_Half_TN,tn_8192_200_14336,Gemm_Hipblaslt_TN_22085,0.125603
GemmTunableOp_Half_TN,tn_8192_160_14336,Gemm_Hipblaslt_TN_22162,0.100576
GemmTunableOp_Half_TN,tn_8000_256_8192,Gemm_Hipblaslt_TN_22140,0.0950008
GemmTunableOp_Half_TN,tn_8000_1_8192,Gemm_Hipblaslt_TN_21538,0.0339199
GemmTunableOp_Half_TN,tn_8192_256_8192,Gemm_Hipblaslt_TN_22140,0.098972
GemmTunableOp_Half_TN,tn_8192_48_14336,Gemm_Hipblaslt_TN_22184,0.0633491
GemmTunableOp_Half_TN,tn_5120_96_8192,Gemm_Hipblaslt_TN_22133,0.0394337
GemmTunableOp_Half_TN,tn_14336_112_8192,Gemm_Hipblaslt_TN_22086,0.0866321
GemmTunableOp_Half_TN,tn_5120_48_8192,Gemm_Hipblaslt_TN_22377,0.0344878
GemmTunableOp_Half_TN,tn_28672_176_8192,Gemm_Hipblaslt_TN_21831,0.231124
GemmTunableOp_Half_TN,tn_8192_4_7168,Gemm_Hipblaslt_TN_23386,0.028155
GemmTunableOp_Half_TN,tn_8192_40_4096,Gemm_Hipblaslt_TN_23388,0.0285626
GemmTunableOp_Half_TN,tn_2560_200_8192,Gemm_Hipblaslt_TN_21984,0.04211
GemmTunableOp_Half_TN,tn_8192_112_4096,Gemm_Hipblaslt_TN_22386,0.0397991
GemmTunableOp_Half_TN,tn_28672_160_8192,Gemm_Hipblaslt_TN_22101,0.204217
GemmTunableOp_Half_TN,tn_14336_56_8192,Gemm_Hipblaslt_TN_21636,0.0688698
GemmTunableOp_Half_TN,tn_8192_32_14336,Gemm_Hipblaslt_TN_22379,0.058798
GemmTunableOp_Half_TN,tn_57344_240_8192,Gemm_Hipblaslt_TN_22029,0.550335
GemmTunableOp_Half_TN,tn_8192_224_7168,Gemm_Hipblaslt_TN_22197,0.0739722
GemmTunableOp_Half_TN,tn_5120_240_8192,Gemm_Hipblaslt_TN_22172,0.0691305
GemmTunableOp_Half_TN,tn_8192_168_28672,Gemm_Hipblaslt_TN_22082,0.211174
GemmTunableOp_Half_TN,tn_10240_16_8192,Gemm_Hipblaslt_TN_23386,0.0459836
GemmTunableOp_Half_TN,tn_8192_16_8192,Gemm_Hipblaslt_TN_22379,0.0383949
GemmTunableOp_Half_TN,tn_8192_224_4096,Gemm_Hipblaslt_TN_22197,0.0496137
GemmTunableOp_Half_TN,tn_5120_232_8192,Gemm_Hipblaslt_TN_22172,0.0682078
GemmTunableOp_Half_TN,tn_8192_168_14336,Gemm_Hipblaslt_TN_22082,0.115041
GemmTunableOp_Half_TN,tn_16000_128_8192,Gemm_Hipblaslt_TN_22118,0.116489
GemmTunableOp_Half_TN,tn_28672_72_8192,Gemm_Hipblaslt_TN_21664,0.163332
GemmTunableOp_Half_TN,tn_28672_120_8192,Gemm_Hipblaslt_TN_21921,0.19396
GemmTunableOp_Half_TN,tn_8192_1_14336,Gemm_Hipblaslt_TN_23386,0.0507825
GemmTunableOp_Half_TN,tn_10240_40_8192,Gemm_Hipblaslt_TN_22359,0.0531548
GemmTunableOp_Half_TN,tn_14336_256_8192,Gemm_Hipblaslt_TN_21954,0.136035
GemmTunableOp_Half_TN,tn_8192_24_4096,Gemm_Hipblaslt_TN_23386,0.0217299
GemmTunableOp_Half_TN,tn_8192_152_14336,Gemm_Hipblaslt_TN_22162,0.09744
GemmTunableOp_Half_TN,tn_10240_56_8192,Gemm_Hipblaslt_TN_22359,0.0553484
GemmTunableOp_Half_TN,tn_8192_248_8192,Gemm_Hipblaslt_TN_22087,0.09645
GemmTunableOp_Half_TN,tn_57344_2_8192,Gemm_Hipblaslt_TN_21529,0.242257
GemmTunableOp_Half_TN,tn_8192_16_28672,Gemm_Hipblaslt_TN_22379,0.129464
GemmTunableOp_Half_TN,tn_8192_8_7168,Gemm_Hipblaslt_TN_12675,0.0282366
GemmTunableOp_Half_TN,tn_8192_8_8192,Gemm_Hipblaslt_TN_21538,0.0365197
GemmTunableOp_Half_TN,tn_8192_16384_4096,Gemm_Rocblas_16092,2.14224
GemmTunableOp_Half_TN,tn_5120_104_8192,Gemm_Hipblaslt_TN_22364,0.045963
GemmTunableOp_Half_TN,tn_8192_24_28672,Gemm_Hipblaslt_TN_22379,0.13599
GemmTunableOp_Half_TN,tn_14336_144_8192,Gemm_Hipblaslt_TN_22086,0.08773
GemmTunableOp_Half_TN,tn_8192_200_8192,Gemm_Hipblaslt_TN_22085,0.0728862
GemmTunableOp_Half_TN,tn_57344_16_8192,Gemm_Hipblaslt_TN_21517,0.244442
GemmTunableOp_Half_TN,tn_5120_56_8192,Gemm_Hipblaslt_TN_22377,0.0354574
GemmTunableOp_Half_TN,tn_10240_80_8192,Gemm_Hipblaslt_TN_21636,0.0579595
GemmTunableOp_Half_TN,tn_10240_4_8192,Gemm_Hipblaslt_TN_21620,0.042446
GemmTunableOp_Half_TN,tn_5120_136_8192,Gemm_Hipblaslt_TN_22058,0.0477985
GemmTunableOp_Half_TN,tn_8192_208_4096,Gemm_Hipblaslt_TN_22197,0.0502396
GemmTunableOp_Half_TN,tn_8192_152_8192,Gemm_Hipblaslt_TN_22162,0.0635595
GemmTunableOp_Half_TN,tn_8192_8_28672,Gemm_Hipblaslt_TN_22379,0.12754
GemmTunableOp_Half_TN,tn_28672_40_8192,Gemm_Hipblaslt_TN_12678,0.149778
GemmTunableOp_Half_TN,tn_8192_2048_7168,Gemm_Rocblas_16092,0.434884
GemmTunableOp_Half_TN,tn_8192_4_28672,Gemm_Hipblaslt_TN_22379,0.126785
GemmTunableOp_Half_TN,tn_8192_32_4096,Gemm_Hipblaslt_TN_23386,0.0206514
GemmTunableOp_Half_TN,tn_57344_208_8192,Gemm_Hipblaslt_TN_22070,0.4464
GemmTunableOp_Half_TN,tn_57344_24_8192,Gemm_Hipblaslt_TN_21529,0.248404
GemmTunableOp_Half_TN,tn_8192_24_8192,Gemm_Hipblaslt_TN_22379,0.0403533
GemmTunableOp_Half_TN,tn_8192_64_28672,Gemm_Hipblaslt_TN_22170,0.151659
GemmTunableOp_Half_TN,tn_2560_144_8192,Gemm_Hipblaslt_TN_21784,0.0354589
GemmTunableOp_Half_TN,tn_8192_40_2048,Gemm_Hipblaslt_TN_23388,0.0176623
GemmTunableOp_Half_TN,tn_57344_48_8192,Gemm_Hipblaslt_TN_21557,0.2537
GemmTunableOp_Half_TN,tn_28672_48_8192,Gemm_Hipblaslt_TN_12678,0.152156
GemmTunableOp_Half_TN,tn_8192_2_8192,Gemm_Hipblaslt_TN_22379,0.0352509
GemmTunableOp_Half_TN,tn_8192_224_14336,Gemm_Hipblaslt_TN_22085,0.130604
GemmTunableOp_Half_TN,tn_8192_112_8192,Gemm_Hipblaslt_TN_22294,0.0604011
GemmTunableOp_Half_TN,tn_8192_176_2048,Gemm_Hipblaslt_TN_12689,0.0294766
GemmTunableOp_Half_TN,tn_28672_224_8192,Gemm_Hipblaslt_TN_21971,0.260637
GemmTunableOp_Half_TN,tn_10240_32768_8192,Gemm_Hipblaslt_TN_21883,9.10508
GemmTunableOp_Half_TN,tn_8192_80_7168,Gemm_Hipblaslt_TN_22165,0.047432
GemmTunableOp_Half_TN,tn_8192_96_14336,Gemm_Hipblaslt_TN_21660,0.0727873
GemmTunableOp_Half_TN,tn_57344_128_8192,Gemm_Hipblaslt_TN_21797,0.334661
GemmTunableOp_Half_TN,tn_57344_176_8192,Gemm_Hipblaslt_TN_21814,0.404824
GemmTunableOp_Half_TN,tn_8192_136_14336,Gemm_Hipblaslt_TN_22162,0.0948922
GemmTunableOp_Half_TN,tn_8192_112_28672,Gemm_Hipblaslt_TN_22162,0.1779
GemmTunableOp_Half_TN,tn_10240_176_8192,Gemm_Hipblaslt_TN_22177,0.0828682
GemmTunableOp_Half_TN,tn_5120_256_8192,Gemm_Hipblaslt_TN_21901,0.0664271
GemmTunableOp_Half_TN,tn_8192_224_8192,Gemm_Hipblaslt_TN_22197,0.0782634
GemmTunableOp_Half_TN,tn_10240_168_8192,Gemm_Hipblaslt_TN_21851,0.0837562
GemmTunableOp_Half_TN,tn_2560_32_8192,Gemm_Hipblaslt_TN_21531,0.0196526
GemmTunableOp_Half_TN,tn_28672_128_8192,Gemm_Hipblaslt_TN_21921,0.194514
GemmTunableOp_Half_TN,tn_8192_4_8192,Gemm_Hipblaslt_TN_22379,0.0355725
GemmTunableOp_Half_TN,tn_8192_88_7168,Gemm_Hipblaslt_TN_22165,0.0500304
GemmTunableOp_Half_TN,tn_28672_56_8192,Gemm_Hipblaslt_TN_12683,0.157918
GemmTunableOp_Half_TN,tn_14336_120_8192,Gemm_Hipblaslt_TN_22086,0.0887556
GemmTunableOp_Half_TN,tn_8192_168_8192,Gemm_Hipblaslt_TN_21996,0.0707578
GemmTunableOp_Half_TN,tn_57344_96_8192,Gemm_Hipblaslt_TN_21663,0.272202
GemmTunableOp_Half_TN,tn_5120_32_8192,Gemm_Hipblaslt_TN_21530,0.0303094
GemmTunableOp_Half_TN,tn_8192_160_8192,Gemm_Hipblaslt_TN_21967,0.0611671
GemmTunableOp_Half_TN,tn_28672_104_8192,Gemm_Hipblaslt_TN_21780,0.192675
GemmTunableOp_Half_TN,tn_14336_216_8192,Gemm_Hipblaslt_TN_21954,0.129826
GemmTunableOp_Half_TN,tn_8192_144_14336,Gemm_Hipblaslt_TN_21799,0.0968448
GemmTunableOp_Half_TN,tn_10240_104_8192,Gemm_Hipblaslt_TN_22223,0.0682122
GemmTunableOp_Half_TN,tn_10240_16384_8192,Gemm_Hipblaslt_TN_21908,5.28384
GemmTunableOp_Half_TN,tn_57344_56_8192,Gemm_Hipblaslt_TN_22021,0.268846
GemmTunableOp_Half_TN,tn_57344_168_8192,Gemm_Hipblaslt_TN_21814,0.401707
GemmTunableOp_Half_TN,tn_8192_232_8192,Gemm_Hipblaslt_TN_22106,0.0935757
GemmTunableOp_Half_TN,tn_5120_152_8192,Gemm_Hipblaslt_TN_22058,0.0484906
GemmTunableOp_Half_TN,tn_8192_80_8192,Gemm_Hipblaslt_TN_22255,0.0502828
GemmTunableOp_Half_TN,tn_8192_64_8192,Gemm_Hipblaslt_TN_22246,0.0473388
GemmTunableOp_Half_TN,tn_8192_240_8192,Gemm_Hipblaslt_TN_21726,0.0970876
GemmTunableOp_Half_TN,tn_8192_128_28672,Gemm_Hipblaslt_TN_22162,0.180273
GemmTunableOp_Half_TN,tn_8192_176_28672,Gemm_Hipblaslt_TN_21815,0.211677
GemmTunableOp_Half_TN,tn_14336_32_8192,Gemm_Hipblaslt_TN_21659,0.0641403
GemmTunableOp_Half_TN,tn_28672_208_8192,Gemm_Hipblaslt_TN_22066,0.253189
GemmTunableOp_Half_TN,tn_57344_216_8192,Gemm_Hipblaslt_TN_21875,0.502415
GemmTunableOp_Half_TN,tn_28672_2_8192,Gemm_Hipblaslt_TN_21538,0.13466
GemmTunableOp_Half_TN,tn_57344_232_8192,Gemm_Hipblaslt_TN_12661,0.539306
GemmTunableOp_Half_TN,tn_8192_136_8192,Gemm_Hipblaslt_TN_22162,0.0644043
GemmTunableOp_Half_TN,tn_2560_112_8192,Gemm_Hipblaslt_TN_23386,0.0344621
GemmTunableOp_Half_TN,tn_8192_48_7168,Gemm_Hipblaslt_TN_21558,0.0432704
GemmTunableOp_Half_TN,tn_8192_32_8192,Gemm_Hipblaslt_TN_21538,0.0420749
GemmTunableOp_Half_TN,tn_10240_96_8192,Gemm_Hipblaslt_TN_21659,0.0575467
GemmTunableOp_Half_TN,tn_10240_184_8192,Gemm_Hipblaslt_TN_22177,0.0843897
GemmTunableOp_Half_TN,tn_8192_120_28672,Gemm_Hipblaslt_TN_21799,0.184427
GemmTunableOp_Half_TN,tn_8192_240_7168,Gemm_Hipblaslt_TN_22290,0.0905112
GemmTunableOp_Half_TN,tn_8192_248_2048,Gemm_Hipblaslt_TN_12695,0.0347901
GemmTunableOp_Half_TN,tn_8192_192_28672,Gemm_Hipblaslt_TN_21852,0.223979
GemmTunableOp_Half_TN,tn_28672_32768_8192,Gemm_Hipblaslt_TN_21883,27.5049
GemmTunableOp_Half_TN,tn_14336_248_8192,Gemm_Hipblaslt_TN_21954,0.133198
GemmTunableOp_Half_TN,tn_14336_160_8192,Gemm_Hipblaslt_TN_22065,0.103851
GemmTunableOp_Half_TN,tn_8192_248_7168,Gemm_Hipblaslt_TN_22290,0.0914584
GemmTunableOp_Half_TN,tn_8192_72_28672,Gemm_Hipblaslt_TN_22170,0.152204
GemmTunableOp_Half_TN,tn_28672_32_8192,Gemm_Hipblaslt_TN_21529,0.140538
GemmTunableOp_Half_TN,tn_8192_240_2048,Gemm_Hipblaslt_TN_12695,0.0343053
GemmTunableOp_Half_TN,tn_8192_136_28672,Gemm_Hipblaslt_TN_22162,0.186851
GemmTunableOp_Half_TN,tn_8192_208_28672,Gemm_Hipblaslt_TN_22085,0.240299
GemmTunableOp_Half_TN,tn_14336_240_8192,Gemm_Hipblaslt_TN_21780,0.131638
GemmTunableOp_Half_TN,tn_8192_112_7168,Gemm_Hipblaslt_TN_22186,0.0578795
GemmTunableOp_Half_TN,tn_2560_2048_8192,Gemm_Hipblaslt_TN_21951,0.177514
GemmTunableOp_Half_TN,tn_8192_232_7168,Gemm_Hipblaslt_TN_22290,0.0885193
GemmTunableOp_Half_TN,tn_2560_256_8192,Gemm_Hipblaslt_TN_22407,0.04824
GemmTunableOp_Half_TN,tn_2560_216_8192,Gemm_Hipblaslt_TN_21685,0.044366
GemmTunableOp_Half_TN,tn_8192_64_7168,Gemm_Hipblaslt_TN_21609,0.0444828
GemmTunableOp_Half_TN,tn_57344_72_8192,Gemm_Hipblaslt_TN_21663,0.268377
GemmTunableOp_Half_TN,tn_8192_208_2048,Gemm_Hipblaslt_TN_12692,0.0313658
GemmTunableOp_Half_TN,tn_14336_208_8192,Gemm_Hipblaslt_TN_21954,0.130243
GemmTunableOp_Half_TN,tn_10240_192_8192,Gemm_Hipblaslt_TN_21851,0.0815274
GemmTunableOp_Half_TN,tn_8192_216_2048,Gemm_Hipblaslt_TN_12692,0.0326765
GemmTunableOp_Half_TN,tn_8192_200_2048,Gemm_Hipblaslt_TN_12692,0.0313701
GemmTunableOp_Half_TN,tn_8192_64_2048,Gemm_Hipblaslt_TN_21566,0.0200574
GemmTunableOp_Half_TN,tn_10240_200_8192,Gemm_Hipblaslt_TN_22119,0.0979212
GemmTunableOp_Half_TN,tn_16000_1_8192,Gemm_Hipblaslt_TN_21538,0.0593092
GemmTunableOp_Half_TN,tn_10240_224_8192,Gemm_Hipblaslt_TN_22069,0.0961716
GemmTunableOp_Half_TN,tn_16000_256_8192,Gemm_Hipblaslt_TN_21972,0.174676
GemmTunableOp_Half_TN,tn_8192_80_2048,Gemm_Hipblaslt_TN_12687,0.021747
GemmTunableOp_Half_TN,tn_8192_200_7168,Gemm_Hipblaslt_TN_21876,0.0743882
GemmTunableOp_Half_TN,tn_2560_192_8192,Gemm_Hipblaslt_TN_21835,0.0388733
GemmTunableOp_Half_TN,tn_8192_120_14336,Gemm_Hipblaslt_TN_22164,0.0920819
GemmTunableOp_Half_TN,tn_8192_224_28672,Gemm_Hipblaslt_TN_22085,0.241912
GemmTunableOp_Half_TN,tn_14336_192_8192,Gemm_Hipblaslt_TN_21938,0.108301
GemmTunableOp_Half_TN,tn_8192_208_7168,Gemm_Hipblaslt_TN_22197,0.074473
GemmTunableOp_Half_TN,tn_8192_168_7168,Gemm_Hipblaslt_TN_21996,0.0688202
GemmTunableOp_Half_TN,tn_10240_72_8192,Gemm_Hipblaslt_TN_21659,0.0592971
GemmTunableOp_Half_TN,tn_28672_96_8192,Gemm_Hipblaslt_TN_21938,0.176833
GemmTunableOp_Half_TN,tn_8192_192_7168,Gemm_Hipblaslt_TN_21996,0.068185
GemmTunableOp_Half_TN,tn_14336_184_8192,Gemm_Hipblaslt_TN_21645,0.114186
GemmTunableOp_Half_TN,tn_10240_152_8192,Gemm_Hipblaslt_TN_21793,0.0743962
GemmTunableOp_Half_TN,tn_8192_96_2048,Gemm_Hipblaslt_TN_12689,0.0232542
GemmTunableOp_Half_TN,tn_28672_2048_8192,Gemm_Hipblaslt_TN_21908,1.91303
GemmTunableOp_Half_TN,tn_57344_224_8192,Gemm_Hipblaslt_TN_21971,0.484305
GemmTunableOp_Half_TN,tn_8192_96_7168,Gemm_Hipblaslt_TN_22165,0.0461964
GemmTunableOp_Half_TN,tn_14336_24_8192,Gemm_Hipblaslt_TN_21529,0.0608603
GemmTunableOp_Half_TN,tn_8192_88_2048,Gemm_Hipblaslt_TN_21638,0.021915
GemmTunableOp_Half_TN,tn_2560_40_8192,Gemm_Hipblaslt_TN_21587,0.021819
GemmTunableOp_Half_TN,tn_8192_4_2048,Gemm_Hipblaslt_TN_23388,0.017603
GemmTunableOp_Half_TN,tn_2560_128_8192,Gemm_Hipblaslt_TN_21712,0.0336525
GemmTunableOp_Half_TN,tn_2560_224_8192,Gemm_Hipblaslt_TN_21685,0.0437904
GemmTunableOp_Half_TN,tn_2560_72_8192,Gemm_Hipblaslt_TN_22134,0.0262558
GemmTunableOp_Half_TN,tn_8192_136_7168,Gemm_Hipblaslt_TN_22162,0.0580163
GemmTunableOp_Half_TN,tn_2560_152_8192,Gemm_Hipblaslt_TN_22093,0.0362545
GemmTunableOp_Half_TN,tn_8192_32768_8192,Gemm_Hipblaslt_TN_21883,7.4455
GemmTunableOp_Half_TN,tn_14336_88_8192,Gemm_Hipblaslt_TN_21995,0.0739274
GemmTunableOp_Half_TN,tn_14336_80_8192,Gemm_Hipblaslt_TN_21995,0.0731786
GemmTunableOp_Half_TN,tn_14336_96_8192,Gemm_Hipblaslt_TN_21658,0.0759546
GemmTunableOp_Half_TN,tn_8192_2048_28672,Gemm_Hipblaslt_TN_21850,2.20788
GemmTunableOp_Half_TN,tn_2560_120_8192,Gemm_Hipblaslt_TN_21712,0.0336893
GemmTunableOp_Half_TN,tn_2560_248_8192,Gemm_Hipblaslt_TN_21729,0.0486128
GemmTunableOp_Half_TN,tn_2560_4_8192,Gemm_Hipblaslt_TN_21531,0.0170767
GemmTunableOp_Half_TN,tn_14336_136_8192,Gemm_Hipblaslt_TN_22086,0.0903104
GemmTunableOp_Half_TN,tn_8192_48_2048,Gemm_Hipblaslt_TN_23388,0.0200798
GemmTunableOp_Half_TN,tn_2560_232_8192,Gemm_Hipblaslt_TN_22407,0.0455876
GemmTunableOp_Half_TN,tn_8192_176_8192,Gemm_Hipblaslt_TN_21996,0.0673751
GemmTunableOp_Half_TN,tn_8192_72_2048,Gemm_Hipblaslt_TN_21638,0.0216974
GemmTunableOp_Half_TN,tn_8192_2_2048,Gemm_Hipblaslt_TN_23388,0.0166847
GemmTunableOp_Half_TN,tn_8192_32768_2048,Gemm_Hipblaslt_TN_22051,2.07679
GemmTunableOp_Half_TN,tn_8192_112_2048,Gemm_Hipblaslt_TN_12681,0.0247854
GemmTunableOp_Half_TN,tn_8192_16_14336,Gemm_Hipblaslt_TN_23386,0.052578
GemmTunableOp_Half_TN,tn_57344_8_8192,Gemm_Hipblaslt_TN_21517,0.243897
GemmTunableOp_Half_TN,tn_8192_112_14336,Gemm_Hipblaslt_TN_21691,0.083047
GemmTunableOp_Half_TN,tn_8192_184_8192,Gemm_Hipblaslt_TN_21996,0.0716762
GemmTunableOp_Half_TN,tn_2560_48_8192,Gemm_Hipblaslt_TN_21587,0.0224142
GemmTunableOp_Half_TN,tn_8192_120_2048,Gemm_Hipblaslt_TN_12601,0.0266298
GemmTunableOp_Half_TN,tn_2560_88_8192,Gemm_Hipblaslt_TN_22134,0.0275934
GemmTunableOp_Half_TN,tn_8192_144_7168,Gemm_Hipblaslt_TN_21799,0.0591003
GemmTunableOp_Half_TN,tn_8192_8_2048,Gemm_Hipblaslt_TN_23388,0.0185806
GemmTunableOp_Half_TN,tn_14336_64_8192,Gemm_Hipblaslt_TN_22412,0.0705626
GemmTunableOp_Half_TN,tn_8192_32_7168,Gemm_Hipblaslt_TN_23386,0.0331593
GemmTunableOp_Half_TN,tn_8192_184_2048,Gemm_Hipblaslt_TN_21641,0.0299373
GemmTunableOp_Half_TN,tn_8192_72_7168,Gemm_Hipblaslt_TN_22215,0.0486684
GemmTunableOp_Half_TN,tn_8192_184_7168,Gemm_Hipblaslt_TN_21994,0.0709898
GemmTunableOp_Half_TN,tn_2560_16384_8192,Gemm_Hipblaslt_TN_21883,1.27883
GemmTunableOp_Half_TN,tn_14336_40_8192,Gemm_Hipblaslt_TN_22412,0.0680938
GemmTunableOp_Half_TN,tn_8192_24_2048,Gemm_Hipblaslt_TN_23386,0.0191006
GemmTunableOp_Half_TN,tn_57344_88_8192,Gemm_Hipblaslt_TN_22021,0.277053
GemmTunableOp_Half_TN,tn_8192_248_4096,Gemm_Hipblaslt_TN_21954,0.0589132
GemmTunableOp_Half_TN,tn_2560_32768_8192,Gemm_Hipblaslt_TN_22051,2.22839
GemmTunableOp_Half_TN,tn_5120_80_8192,Gemm_Hipblaslt_TN_22133,0.0394993
GemmTunableOp_Half_TN,tn_57344_40_8192,Gemm_Hipblaslt_TN_21557,0.253168
GemmTunableOp_Half_TN,tn_57344_32_8192,Gemm_Hipblaslt_TN_21543,0.249054
GemmTunableOp_Half_TN,tn_14336_8_8192,Gemm_Hipblaslt_TN_23388,0.0555052
GemmTunableOp_Half_TN,tn_8192_16_2048,Gemm_Hipblaslt_TN_12571,0.019107
GemmTunableOp_Half_TN,tn_28672_112_8192,Gemm_Hipblaslt_TN_21921,0.19084
GemmTunableOp_Half_TN,tn_8192_168_2048,Gemm_Hipblaslt_TN_12689,0.0293434
GemmTunableOp_Half_TN,tn_8192_128_7168,Gemm_Hipblaslt_TN_22114,0.0575963
GemmTunableOp_Half_TN,tn_8192_208_8192,Gemm_Hipblaslt_TN_22085,0.0711866
GemmTunableOp_Half_TN,tn_57344_104_8192,Gemm_Hipblaslt_TN_21797,0.328785
GemmTunableOp_Half_TN,tn_8192_72_8192,Gemm_Hipblaslt_TN_22165,0.0492824
GemmTunableOp_Half_TN,tn_28672_24_8192,Gemm_Hipblaslt_TN_21529,0.139806
GemmTunableOp_Half_TN,tn_57344_2048_8192,Gemm_Hipblaslt_TN_22029,3.73801
GemmTunableOp_Half_TN,tn_8192_192_8192,Gemm_Hipblaslt_TN_21996,0.0700923
GemmTunableOp_Half_TN,tn_2560_80_8192,Gemm_Hipblaslt_TN_21649,0.0262222
GemmTunableOp_Half_TN,tn_14336_152_8192,Gemm_Hipblaslt_TN_22065,0.100338
GemmTunableOp_Half_TN,tn_2560_96_8192,Gemm_Hipblaslt_TN_21649,0.0287702
GemmTunableOp_Half_TN,tn_8192_216_28672,Gemm_Hipblaslt_TN_22085,0.24067
GemmTunableOp_Half_TN,tn_8192_4_4096,Gemm_Hipblaslt_TN_23386,0.0183287
GemmTunableOp_Half_TN,tn_14336_2_8192,Gemm_Hipblaslt_TN_21531,0.0553179
GemmTunableOp_Half_TN,tn_8192_104_7168,Gemm_Hipblaslt_TN_22164,0.0544747
GemmTunableOp_Half_TN,tn_14336_16384_8192,Gemm_Hipblaslt_TN_21908,7.53413
GemmTunableOp_Half_TN,tn_8192_56_8192,Gemm_Hipblaslt_TN_21647,0.0473084
GemmTunableOp_Half_TN,tn_8192_128_2048,Gemm_Hipblaslt_TN_21925,0.0255534
GemmTunableOp_Half_TN,tn_14336_104_8192,Gemm_Hipblaslt_TN_22086,0.0834385
GemmTunableOp_Half_TN,tn_8192_256_4096,Gemm_Hipblaslt_TN_21954,0.0588412
GemmTunableOp_Half_TN,tn_10240_240_8192,Gemm_Hipblaslt_TN_22140,0.103878
GemmTunableOp_Half_TN,tn_8192_16_7168,Gemm_Hipblaslt_TN_12675,0.0284414
GemmTunableOp_Half_TN,tn_8192_104_2048,Gemm_Hipblaslt_TN_12601,0.0254302
GemmTunableOp_Half_TN,tn_8192_160_2048,Gemm_Hipblaslt_TN_12699,0.0266846
GemmTunableOp_Half_TN,tn_28672_232_8192,Gemm_Hipblaslt_TN_21797,0.302145
GemmTunableOp_Half_TN,tn_14336_224_8192,Gemm_Hipblaslt_TN_21954,0.127907
GemmTunableOp_Half_TN,tn_8192_24_14336,Gemm_Hipblaslt_TN_22379,0.0572768
GemmTunableOp_Half_TN,tn_14336_176_8192,Gemm_Hipblaslt_TN_21645,0.112844
GemmTunableOp_Half_TN,tn_10240_112_8192,Gemm_Hipblaslt_TN_22260,0.0656383
GemmTunableOp_Half_TN,tn_8192_144_2048,Gemm_Hipblaslt_TN_12699,0.0270958
GemmTunableOp_Half_TN,tn_10240_128_8192,Gemm_Hipblaslt_TN_22230,0.0698682
GemmTunableOp_Half_TN,tn_8192_120_7168,Gemm_Hipblaslt_TN_22117,0.0609539
GemmTunableOp_Half_TN,tn_2560_168_8192,Gemm_Hipblaslt_TN_22096,0.0387545
GemmTunableOp_Half_TN,tn_14336_128_8192,Gemm_Hipblaslt_TN_22086,0.0836097
GemmTunableOp_Half_TN,tn_8192_136_2048,Gemm_Hipblaslt_TN_12699,0.0271326
GemmTunableOp_Half_TN,tn_2560_56_8192,Gemm_Hipblaslt_TN_21587,0.0232574
GemmTunableOp_Half_TN,tn_8192_256_7168,Gemm_Hipblaslt_TN_22290,0.0880633
GemmTunableOp_Half_TN,tn_2560_104_8192,Gemm_Hipblaslt_TN_21692,0.0356813
GemmTunableOp_Half_TN,tn_8192_16384_2048,Gemm_Rocblas_16092,1.04959
GemmTunableOp_Half_TN,tn_2560_64_8192,Gemm_Hipblaslt_TN_21587,0.0235774
GemmTunableOp_Half_TN,tn_14336_168_8192,Gemm_Hipblaslt_TN_21938,0.11473
GemmTunableOp_Half_TN,tn_8192_248_28672,Gemm_Hipblaslt_TN_22087,0.306188
GemmTunableOp_Half_TN,tn_57344_248_8192,Gemm_Hipblaslt_TN_22029,0.552787
GemmTunableOp_Half_TN,tn_2560_24_8192,Gemm_Hipblaslt_TN_21531,0.019035
GemmTunableOp_Half_TN,tn_8192_256_28672,Gemm_Hipblaslt_TN_22339,0.311541
GemmTunableOp_Half_TN,tn_8192_216_7168,Gemm_Hipblaslt_TN_22197,0.0749946
GemmTunableOp_Half_TN,tn_10240_256_8192,Gemm_Hipblaslt_TN_21921,0.116815
GemmTunableOp_Half_TN,tn_8192_176_14336,Gemm_Hipblaslt_TN_21815,0.115147
GemmTunableOp_Half_TN,tn_8192_80_28672,Gemm_Hipblaslt_TN_22170,0.153174
GemmTunableOp_Half_TN,tn_10240_144_8192,Gemm_Hipblaslt_TN_22279,0.072161
GemmTunableOp_Half_TN,tn_8192_16384_14336,Gemm_Hipblaslt_TN_21883,7.85864
GemmTunableOp_Half_TN,tn_8192_152_28672,Gemm_Hipblaslt_TN_22162,0.189136
GemmTunableOp_Half_TN,tn_8192_56_7168,Gemm_Hipblaslt_TN_22165,0.0455476
GemmTunableOp_Half_TN,tn_10240_2048_8192,Gemm_Hipblaslt_TN_22071,0.658048
GemmTunableOp_Half_TN,tn_8192_8_4096,Gemm_Hipblaslt_TN_23386,0.0187899
GemmTunableOp_Half_TN,tn_8192_2048_2048,Gemm_Rocblas_16103,0.129107
GemmTunableOp_Half_TN,tn_57344_184_8192,Gemm_Hipblaslt_TN_22127,0.435509
GemmTunableOp_Half_TN,tn_2560_8_8192,Gemm_Hipblaslt_TN_21531,0.0175662
GemmTunableOp_Half_TN,tn_28672_88_8192,Gemm_Hipblaslt_TN_21645,0.173631
GemmTunableOp_Half_TN,tn_14336_232_8192,Gemm_Hipblaslt_TN_21954,0.126985
GemmTunableOp_Half_TN,tn_32000_1_8192,Gemm_Hipblaslt_TN_23388,0.143634
GemmTunableOp_Half_TN,tn_5120_16_8192,Gemm_Hipblaslt_TN_21520,0.0275118
GemmTunableOp_Half_TN,tn_8192_16384_8192,Gemm_Hipblaslt_TN_21883,4.20017
GemmTunableOp_Half_TN,tn_8000_128_8192,Gemm_Hipblaslt_TN_22164,0.0632588
GemmTunableOp_Half_TN,tn_57344_136_8192,Gemm_Hipblaslt_TN_22190,0.340265
GemmTunableOp_Half_TN,tn_14336_16_8192,Gemm_Hipblaslt_TN_23388,0.0563899
GemmTunableOp_Half_TN,tn_57344_144_8192,Gemm_Hipblaslt_TN_22190,0.336711
GemmTunableOp_Half_TN,tn_5120_160_8192,Gemm_Hipblaslt_TN_22058,0.0460117
GemmTunableOp_Half_TN,tn_8192_120_4096,Gemm_Hipblaslt_TN_22386,0.0413625
GemmTunableOp_Half_TN,tn_10240_24_8192,Gemm_Hipblaslt_TN_21530,0.049478
GemmTunableOp_Half_TN,tn_8192_80_4096,Gemm_Hipblaslt_TN_21638,0.032965
GemmTunableOp_Half_TN,tn_8192_136_4096,Gemm_Hipblaslt_TN_22386,0.0434529
GemmTunableOp_Half_TN,tn_8192_56_4096,Gemm_Hipblaslt_TN_21566,0.030013
GemmTunableOp_Half_TN,tn_8192_16_4096,Gemm_Hipblaslt_TN_23386,0.0187399
GemmTunableOp_Half_TN,tn_28672_4_8192,Gemm_Hipblaslt_TN_23388,0.136352
GemmTunableOp_Half_TN,tn_5120_112_8192,Gemm_Hipblaslt_TN_21685,0.0453685
GemmTunableOp_Half_TN,tn_8192_168_4096,Gemm_Hipblaslt_TN_22197,0.0489736
GemmTunableOp_Half_TN,tn_8192_248_14336,Gemm_Hipblaslt_TN_22087,0.164081
GemmTunableOp_Half_TN,tn_2560_160_8192,Gemm_Hipblaslt_TN_21778,0.0359605
GemmTunableOp_Half_TN,tn_57344_80_8192,Gemm_Hipblaslt_TN_22021,0.270684
GemmTunableOp_Half_TN,tn_28672_184_8192,Gemm_Hipblaslt_TN_21831,0.232646
GemmTunableOp_Half_TN,tn_8192_2048_4096,Gemm_Rocblas_16092,0.25734
GemmTunableOp_Half_TN,tn_2560_176_8192,Gemm_Hipblaslt_TN_21660,0.0393677
GemmTunableOp_Half_TN,tn_28672_152_8192,Gemm_Hipblaslt_TN_21780,0.204189
GemmTunableOp_Half_TN,tn_8192_104_4096,Gemm_Hipblaslt_TN_22386,0.0398577
GemmTunableOp_Half_TN,tn_8192_208_14336,Gemm_Hipblaslt_TN_22085,0.12676
GemmTunableOp_Half_TN,tn_8192_224_2048,Gemm_Hipblaslt_TN_12692,0.031177
GemmTunableOp_Half_TN,tn_8192_232_2048,Gemm_Hipblaslt_TN_12695,0.0328749
GemmTunableOp_Half_TN,tn_10240_136_8192,Gemm_Hipblaslt_TN_21781,0.0725754
GemmTunableOp_Half_TN,tn_28672_80_8192,Gemm_Hipblaslt_TN_21645,0.167867
GemmTunableOp_Half_TN,tn_8192_48_8192,Gemm_Hipblaslt_TN_22165,0.0467564
GemmTunableOp_Half_TN,tn_8192_88_14336,Gemm_Hipblaslt_TN_22170,0.0721191
GemmTunableOp_Half_TN,tn_5120_24_8192,Gemm_Hipblaslt_TN_21530,0.0287506
GemmTunableOp_Half_TN,tn_10240_2_8192,Gemm_Hipblaslt_TN_21620,0.0418908
GemmTunableOp_Half_TN,tn_10240_88_8192,Gemm_Hipblaslt_TN_22256,0.0616683
GemmTunableOp_Half_TN,tn_5120_128_8192,Gemm_Hipblaslt_TN_22364,0.0472176
GemmTunableOp_Half_TN,tn_8192_2_7168,Gemm_Hipblaslt_TN_23386,0.0278654
GemmTunableOp_Half_TN,tn_5120_144_8192,Gemm_Hipblaslt_TN_22058,0.0480894
GemmTunableOp_Half_TN,tn_57344_192_8192,Gemm_Hipblaslt_TN_21860,0.431769
GemmTunableOp_Half_TN,tn_2560_184_8192,Gemm_Hipblaslt_TN_21660,0.0398028
GemmTunableOp_Half_TN,tn_8192_40_28672,Gemm_Hipblaslt_TN_21609,0.145701
GemmTunableOp_Half_TN,tn_8192_2_28672,Gemm_Hipblaslt_TN_22379,0.125972
GemmTunableOp_Half_TN,tn_8192_80_14336,Gemm_Hipblaslt_TN_22170,0.0724702
GemmTunableOp_Half_TN,tn_8192_128_14336,Gemm_Hipblaslt_TN_22164,0.094927
GemmTunableOp_Half_TN,tn_8192_32768_7168,Gemm_Hipblaslt_TN_21883,6.67438
GemmTunableOp_Half_TN,tn_8192_232_4096,Gemm_Hipblaslt_TN_21954,0.0569888
GemmTunableOp_Half_TN,tn_2560_2_8192,Gemm_Hipblaslt_TN_21531,0.0176271
GemmTunableOp_Half_TN,tn_5120_16384_8192,Gemm_Hipblaslt_TN_21863,2.61753
GemmTunableOp_Half_TN,tn_8192_64_4096,Gemm_Hipblaslt_TN_23388,0.0297802
GemmTunableOp_Half_TN,tn_28672_64_8192,Gemm_Hipblaslt_TN_12683,0.156712
GemmTunableOp_Half_TN,tn_8192_216_14336,Gemm_Hipblaslt_TN_22085,0.129281
GemmTunableOp_Half_TN,tn_8192_2048_8192,Gemm_Rocblas_16092,0.491836
GemmTunableOp_Half_TN,tn_5120_64_8192,Gemm_Hipblaslt_TN_22377,0.0361597
GemmTunableOp_Half_TN,tn_57344_32768_8192,Gemm_Hipblaslt_TN_21883,54.6744
GemmTunableOp_Half_TN,tn_10240_208_8192,Gemm_Hipblaslt_TN_22173,0.0948872
GemmTunableOp_Half_TN,tn_8192_240_4096,Gemm_Hipblaslt_TN_21954,0.057684
GemmTunableOp_Half_TN,tn_8192_184_28672,Gemm_Hipblaslt_TN_22047,0.225886
GemmTunableOp_Half_TN,tn_8192_40_14336,Gemm_Hipblaslt_TN_21558,0.0635467
GemmTunableOp_Half_TN,tn_8192_200_4096,Gemm_Hipblaslt_TN_22197,0.050124
GemmTunableOp_Half_TN,tn_8192_192_2048,Gemm_Hipblaslt_TN_21949,0.0282462
GemmTunableOp_Half_TN,tn_10240_8_8192,Gemm_Hipblaslt_TN_21620,0.0440124
GemmTunableOp_Half_TN,tn_8192_176_7168,Gemm_Hipblaslt_TN_21996,0.0689498
GemmTunableOp_Half_TN,tn_8192_2048_14336,Gemm_Hipblaslt_TN_22190,1.01899
GemmTunableOp_Half_TN,tn_8192_160_7168,Gemm_Hipblaslt_TN_21967,0.0640962
GemmTunableOp_Half_TN,tn_8192_128_4096,Gemm_Hipblaslt_TN_22386,0.0413553
GemmTunableOp_Half_TN,tn_10240_32_8192,Gemm_Hipblaslt_TN_21530,0.0508412
GemmTunableOp_Half_TN,tn_57344_200_8192,Gemm_Hipblaslt_TN_22070,0.439517
GemmTunableOp_Half_TN,tn_8192_160_28672,Gemm_Hipblaslt_TN_21794,0.189061
GemmTunableOp_Half_TN,tn_8192_120_8192,Gemm_Hipblaslt_TN_22062,0.0588331
GemmTunableOp_Half_TN,tn_14336_48_8192,Gemm_Hipblaslt_TN_21602,0.0661882
GemmTunableOp_Half_TN,tn_8192_144_28672,Gemm_Hipblaslt_TN_21799,0.186068
GemmTunableOp_Half_TN,tn_57344_120_8192,Gemm_Hipblaslt_TN_22190,0.330866
GemmTunableOp_Half_TN,tn_8192_2_4096,Gemm_Hipblaslt_TN_23386,0.0182639
GemmTunableOp_Half_TN,tn_8192_24_7168,Gemm_Hipblaslt_TN_12675,0.0330421
GemmTunableOp_Half_TN,tn_57344_64_8192,Gemm_Hipblaslt_TN_22021,0.268524
GemmTunableOp_Half_TN,tn_2560_240_8192,Gemm_Hipblaslt_TN_21729,0.0484216
GemmTunableOp_Half_TN,tn_8192_88_8192,Gemm_Hipblaslt_TN_22165,0.050326
GemmTunableOp_Half_TN,tn_8192_32_28672,Gemm_Hipblaslt_TN_21538,0.136537
GemmTunableOp_Half_TN,tn_57344_160_8192,Gemm_Hipblaslt_TN_21797,0.344242
GemmTunableOp_Half_TN,tn_8192_56_28672,Gemm_Hipblaslt_TN_22170,0.150107
GemmTunableOp_Half_TN,tn_8192_184_4096,Gemm_Hipblaslt_TN_22197,0.0495904
GemmTunableOp_Half_TN,tn_8192_96_28672,Gemm_Hipblaslt_TN_22170,0.150906
GemmTunableOp_Half_TN,tn_10240_64_8192,Gemm_Hipblaslt_TN_21602,0.0544612
GemmTunableOp_Half_TN,tn_14336_200_8192,Gemm_Hipblaslt_TN_21954,0.130276
GemmTunableOp_Half_TN,tn_8192_32768_14336,Gemm_Hipblaslt_TN_22051,13.6427
GemmTunableOp_Half_TN,tn_8192_48_28672,Gemm_Hipblaslt_TN_22184,0.139593
