vllm/lora/ops/triton_ops/v1/configs/NVIDIA_H100_80GB_HBM3_SHRINK.json
{
  "1": {
    "1": {
      "1": {
        "1024": {
          "16": {
            "block_m": 16,
            "block_n": 16,
            "block_k": 32,
            "split_k": 32,
            "num_warps": 8,
            "num_ctas": 1,
            "num_stages": 4,
            "max_nreg": null
          }
        },
        "2048": {
          "16": {
            "block_m": 16,
            "block_n": 16,
            "block_k": 64,
            "split_k": 32,
            "num_warps": 8,
            "num_ctas": 1,
            "num_stages": 4,
            "max_nreg": null
          }
        },
        "4096": {
          "16": {
            "block_m": 16,
            "block_n": 16,
            "block_k": 128,
            "split_k": 32,
            "num_warps": 8,
            "num_ctas": 1,
            "num_stages": 4,
            "max_nreg": null
          }
        },
        "8192": {
          "16": {
            "block_m": 16,
            "block_n": 16,
            "block_k": 64,
            "split_k": 64,
            "num_warps": 8,
            "num_ctas": 1,
            "num_stages": 4,
            "max_nreg": null
          }
        },
        "12288": {
          "16": {
            "block_m": 16,
            "block_n": 16,
            "block_k": 32,
            "split_k": 128,
            "num_warps": 4,
            "num_ctas": 1,
            "num_stages": 4,
            "max_nreg": null
          }
        },
        "16384": {
          "16": {
            "block_m": 16,
            "block_n": 16,
            "block_k": 64,
            "split_k": 128,
            "num_warps": 4,
            "num_ctas": 1,
            "num_stages": 4,
            "max_nreg": null
          }
        },
        "24576": {
          "16": {
            "block_m": 16,
            "block_n": 16,
            "block_k": 64,
            "split_k": 128,
            "num_warps": 8,
            "num_ctas": 1,
            "num_stages": 4,
            "max_nreg": null
          }
        },
        "32768": {
          "16": {
            "block_m": 16,
            "block_n": 16,
            "block_k": 64,
            "split_k": 128,
            "num_warps": 4,
            "num_ctas": 1,
            "num_stages": 4,
            "max_nreg": null
          }
        }
      },
      "16": {
        "1024": {
          "16": {
            "block_m": 16,
            "block_n": 16,
            "block_k": 32,
            "split_k": 32,
            "num_warps": 8,
            "num_ctas": 1,
            "num_stages": 4,
            "max_nreg": null
          }
        },
        "2048": {
          "16": {
            "block_m": 16,
            "block_n": 16,
            "block_k": 32,
            "split_k": 64,
            "num_warps": 8,
            "num_ctas": 1,
            "num_stages": 4,
            "max_nreg": null
          }
        },
        "4096": {
          "16": {
            "block_m": 16,
            "block_n": 16,
            "block_k": 64,
            "split_k": 32,
            "num_warps": 8,
            "num_ctas": 1,
            "num_stages": 4,
            "max_nreg": null
          }
        },
        "8192": {
          "16": {
            "block_m": 16,
            "block_n": 16,
            "block_k": 64,
            "split_k": 64,
            "num_warps": 8,
            "num_ctas": 1,
            "num_stages": 4,
            "max_nreg": null
          }
        },
        "12288": {
          "16": {
            "block_m": 16,
            "block_n": 16,
            "block_k": 32,
            "split_k": 128,
            "num_warps": 8,
            "num_ctas": 1,
            "num_stages": 4,
            "max_nreg": null
          }
        },
        "16384": {
          "16": {
            "block_m": 16,
            "block_n": 16,
            "block_k": 64,
            "split_k": 128,
            "num_warps": 8,
            "num_ctas": 1,
            "num_stages": 4,
            "max_nreg": null
          }
        },
        "24576": {
          "16": {
            "block_m": 16,
            "block_n": 16,
            "block_k": 32,
            "split_k": 128,
            "num_warps": 8,
            "num_ctas": 1,
            "num_stages": 4,
            "max_nreg": null
          }
        },
        "32768": {
          "16": {
            "block_m": 16,
            "block_n": 16,
            "block_k": 256,
            "split_k": 128,
            "num_warps": 8,
            "num_ctas": 1,
            "num_stages": 4,
            "max_nreg": null
          }
        }
      },
      "32": {
        "1024": {
          "16": {
            "block_m": 16,
            "block_n": 16,
            "block_k": 32,
            "split_k": 32,
            "num_warps": 8,
            "num_ctas": 1,
            "num_stages": 2,
            "max_nreg": null
          }
        },
        "2048": {
          "16": {
            "block_m": 16,
            "block_n": 16,
            "block_k": 32,
            "split_k": 64,
            "num_warps": 8,
            "num_ctas": 1,
            "num_stages": 4,
            "max_nreg": null
          }
        },
        "4096": {
          "16": {
            "block_m": 16,
            "block_n": 16,
            "block_k": 128,
            "split_k": 32,
            "num_warps": 4,
            "num_ctas": 1,
            "num_stages": 4,
            "max_nreg": null
          }
        },
        "8192": {
          "16": {
            "block_m": 16,
            "block_n": 16,
            "block_k": 128,
            "split_k": 32,
            "num_warps": 4,
            "num_ctas": 1,
            "num_stages": 4,
            "max_nreg": null
          }
        },
        "12288": {
          "16": {
            "block_m": 16,
            "block_n": 16,
            "block_k": 64,
            "split_k": 64,
            "num_warps": 4,
            "num_ctas": 1,
            "num_stages": 4,
            "max_nreg": null
          }
        },
        "16384": {
          "16": {
            "block_m": 16,
            "block_n": 16,
            "block_k": 128,
            "split_k": 64,
            "num_warps": 8,
            "num_ctas": 1,
            "num_stages": 4,
            "max_nreg": null
          }
        },
        "24576": {
          "16": {
            "block_m": 16,
            "block_n": 16,
            "block_k": 64,
            "split_k": 64,
            "num_warps": 8,
            "num_ctas": 1,
            "num_stages": 4,
            "max_nreg": null
          }
        },
        "32768": {
          "16": {
            "block_m": 16,
            "block_n": 16,
            "block_k": 128,
            "split_k": 64,
            "num_warps": 4,
            "num_ctas": 1,
            "num_stages": 4,
            "max_nreg": null
          }
        }
      },
      "64": {
        "1024": {
          "16": {
            "block_m": 16,
            "block_n": 16,
            "block_k": 128,
            "split_k": 8,
            "num_warps": 8,
            "num_ctas": 1,
            "num_stages": 2,
            "max_nreg": null
          }
        },
        "2048": {
          "16": {
            "block_m": 16,
            "block_n": 16,
            "block_k": 32,
            "split_k": 32,
            "num_warps": 8,
            "num_ctas": 1,
            "num_stages": 4,
            "max_nreg": null
          }
        },
        "4096": {
          "16": {
            "block_m": 16,
            "block_n": 16,
            "block_k": 64,
            "split_k": 32,
            "num_warps": 8,
            "num_ctas": 1,
            "num_stages": 4,
            "max_nreg": null
          }
        },
        "8192": {
          "16": {
            "block_m": 16,
            "block_n": 16,
            "block_k": 256,
            "split_k": 32,
            "num_warps": 4,
            "num_ctas": 1,
            "num_stages": 2,
            "max_nreg": null
          }
        },
        "12288": {
          "16": {
            "block_m": 16,
            "block_n": 16,
            "block_k": 128,
            "split_k": 32,
            "num_warps": 4,
            "num_ctas": 1,
            "num_stages": 4,
            "max_nreg": null
          }
        },
        "16384": {
          "16": {
            "block_m": 16,
            "block_n": 16,
            "block_k": 256,
            "split_k": 32,
            "num_warps": 4,
            "num_ctas": 1,
            "num_stages": 4,
            "max_nreg": null
          }
        },
        "24576": {
          "16": {
            "block_m": 16,
            "block_n": 16,
            "block_k": 128,
            "split_k": 32,
            "num_warps": 4,
            "num_ctas": 1,
            "num_stages": 4,
            "max_nreg": null
          }
        },
        "32768": {
          "16": {
            "block_m": 32,
            "block_n": 16,
            "block_k": 128,
            "split_k": 64,
            "num_warps": 8,
            "num_ctas": 1,
            "num_stages": 4,
            "max_nreg": null
          }
        }
      },
      "128": {
        "1024": {
          "16": {
            "block_m": 16,
            "block_n": 16,
            "block_k": 64,
            "split_k": 8,
            "num_warps": 4,
            "num_ctas": 1,
            "num_stages": 4,
            "max_nreg": null
          }
        },
        "2048": {
          "16": {
            "block_m": 16,
            "block_n": 16,
            "block_k": 128,
            "split_k": 8,
            "num_warps": 4,
            "num_ctas": 1,
            "num_stages": 4,
            "max_nreg": null
          }
        },
        "4096": {
          "16": {
            "block_m": 16,
            "block_n": 16,
            "block_k": 64,
            "split_k": 32,
            "num_warps": 4,
            "num_ctas": 1,
            "num_stages": 4,
            "max_nreg": null
          }
        },
        "8192": {
          "16": {
            "block_m": 16,
            "block_n": 16,
            "block_k": 128,
            "split_k": 32,
            "num_warps": 4,
            "num_ctas": 1,
            "num_stages": 4,
            "max_nreg": null
          }
        },
        "12288": {
          "16": {
            "block_m": 16,
            "block_n": 16,
            "block_k": 128,
            "split_k": 32,
            "num_warps": 4,
            "num_ctas": 1,
            "num_stages": 4,
            "max_nreg": null
          }
        },
        "16384": {
          "16": {
            "block_m": 16,
            "block_n": 16,
            "block_k": 64,
            "split_k": 32,
            "num_warps": 4,
            "num_ctas": 1,
            "num_stages": 4,
            "max_nreg": null
          }
        },
        "24576": {
          "16": {
            "block_m": 32,
            "block_n": 16,
            "block_k": 128,
            "split_k": 32,
            "num_warps": 8,
            "num_ctas": 1,
            "num_stages": 4,
            "max_nreg": null
          }
        },
        "32768": {
          "16": {
            "block_m": 16,
            "block_n": 16,
            "block_k": 128,
            "split_k": 32,
            "num_warps": 4,
            "num_ctas": 1,
            "num_stages": 4,
            "max_nreg": null
          }
        }
      },
      "192": {
        "1024": {
          "16": {
            "block_m": 16,
            "block_n": 16,
            "block_k": 64,
            "split_k": 8,
            "num_warps": 8,
            "num_ctas": 1,
            "num_stages": 4,
            "max_nreg": null
          }
        },
        "2048": {
          "16": {
            "block_m": 16,
            "block_n": 16,
            "block_k": 256,
            "split_k": 8,
            "num_warps": 4,
            "num_ctas": 1,
            "num_stages": 2,
            "max_nreg": null
          }
        },
        "4096": {
          "16": {
            "block_m": 16,
            "block_n": 16,
            "block_k": 128,
            "split_k": 8,
            "num_warps": 8,
            "num_ctas": 1,
            "num_stages": 4,
            "max_nreg": null
          }
        },
        "8192": {
          "16": {
            "block_m": 16,
            "block_n": 16,
            "block_k": 64,
            "split_k": 32,
            "num_warps": 4,
            "num_ctas": 1,
            "num_stages": 4,
            "max_nreg": null
          }
        },
        "12288": {
          "16": {
            "block_m": 16,
            "block_n": 16,
            "block_k": 256,
            "split_k": 8,
            "num_warps": 4,
            "num_ctas": 1,
            "num_stages": 4,
            "max_nreg": null
          }
        },
        "16384": {
          "16": {
            "block_m": 16,
            "block_n": 16,
            "block_k": 64,
            "split_k": 32,
            "num_warps": 4,
            "num_ctas": 1,
            "num_stages": 4,
            "max_nreg": null
          }
        },
        "24576": {
          "16": {
            "block_m": 16,
            "block_n": 16,
            "block_k": 64,
            "split_k": 32,
            "num_warps": 4,
            "num_ctas": 1,
            "num_stages": 4,
            "max_nreg": null
          }
        },
        "32768": {
          "16": {
            "block_m": 16,
            "block_n": 16,
            "block_k": 128,
            "split_k": 32,
            "num_warps": 4,
            "num_ctas": 1,
            "num_stages": 4,
            "max_nreg": null
          }
        }
      },
      "256": {
        "1024": {
          "16": {
            "block_m": 16,
            "block_n": 16,
            "block_k": 128,
            "split_k": 8,
            "num_warps": 8,
            "num_ctas": 1,
            "num_stages": 2,
            "max_nreg": null
          }
        },
        "2048": {
          "16": {
            "block_m": 16,
            "block_n": 16,
            "block_k": 128,
            "split_k": 8,
            "num_warps": 4,
            "num_ctas": 1,
            "num_stages": 4,
            "max_nreg": null
          }
        },
        "4096": {
          "16": {
            "block_m": 16,
            "block_n": 16,
            "block_k": 512,
            "split_k": 8,
            "num_warps": 4,
            "num_ctas": 1,
            "num_stages": 4,
            "max_nreg": null
          }
        },
        "8192": {
          "16": {
            "block_m": 16,
            "block_n": 16,
            "block_k": 256,
            "split_k": 8,
            "num_warps": 4,
            "num_ctas": 1,
            "num_stages": 4,
            "max_nreg": null
          }
        },
        "12288": {
          "16": {
            "block_m": 16,
            "block_n": 16,
            "block_k": 256,
            "split_k": 8,
            "num_warps": 4,
            "num_ctas": 1,
            "num_stages": 4,
            "max_nreg": null
          }
        },
        "16384": {
          "16": {
            "block_m": 16,
            "block_n": 16,
            "block_k": 256,
            "split_k": 8,
            "num_warps": 4,
            "num_ctas": 1,
            "num_stages": 4,
            "max_nreg": null
          }
        },
        "24576": {
          "16": {
            "block_m": 16,
            "block_n": 16,
            "block_k": 128,
            "split_k": 64,
            "num_warps": 4,
            "num_ctas": 1,
            "num_stages": 2,
            "max_nreg": null
          }
        },
        "32768": {
          "16": {
            "block_m": 16,
            "block_n": 16,
            "block_k": 512,
            "split_k": 8,
            "num_warps": 4,
            "num_ctas": 1,
            "num_stages": 4,
            "max_nreg": null
          }
        }
      },
      "320": {
        "1024": {
          "16": {
            "block_m": 16,
            "block_n": 16,
            "block_k": 128,
            "split_k": 8,
            "num_warps": 8,
            "num_ctas": 1,
            "num_stages": 2,
            "max_nreg": null
          }
        },
        "2048": {
          "16": {
            "block_m": 16,
            "block_n": 16,
            "block_k": 128,
            "split_k": 8,
            "num_warps": 8,
            "num_ctas": 1,
            "num_stages": 4,
            "max_nreg": null
          }
        },
        "4096": {
          "16": {
            "block_m": 16,
            "block_n": 16,
            "block_k": 64,
            "split_k": 8,
            "num_warps": 4,
            "num_ctas": 1,
            "num_stages": 4,
            "max_nreg": null
          }
        },
        "8192": {
          "16": {
            "block_m": 16,
            "block_n": 16,
            "block_k": 256,
            "split_k": 8,
            "num_warps": 4,
            "num_ctas": 1,
            "num_stages": 4,
            "max_nreg": null
          }
        },
        "12288": {
          "16": {
            "block_m": 32,
            "block_n": 16,
            "block_k": 256,
            "split_k": 8,
            "num_warps": 4,
            "num_ctas": 1,
            "num_stages": 4,
            "max_nreg": null
          }
        },
        "16384": {
          "16": {
            "block_m": 32,
            "block_n": 16,
            "block_k": 512,
            "split_k": 8,
            "num_warps": 4,
            "num_ctas": 1,
            "num_stages": 4,
            "max_nreg": null
          }
        },
        "24576": {
          "16": {
            "block_m": 32,
            "block_n": 16,
            "block_k": 512,
            "split_k": 8,
            "num_warps": 4,
            "num_ctas": 1,
            "num_stages": 4,
            "max_nreg": null
          }
        },
        "32768": {
          "16": {
            "block_m": 32,
            "block_n": 16,
            "block_k": 128,
            "split_k": 32,
            "num_warps": 4,
            "num_ctas": 1,
            "num_stages": 4,
            "max_nreg": null
          }
        }
      },
      "384": {
        "1024": {
          "16": {
            "block_m": 16,
            "block_n": 16,
            "block_k": 128,
            "split_k": 8,
            "num_warps": 4,
            "num_ctas": 1,
            "num_stages": 2,
            "max_nreg": null
          }
        },
        "2048": {
          "16": {
            "block_m": 16,
            "block_n": 16,
            "block_k": 64,
            "split_k": 8,
            "num_warps": 4,
            "num_ctas": 1,
            "num_stages": 4,
            "max_nreg": null
          }
        },
        "4096": {
          "16": {
            "block_m": 16,
            "block_n": 16,
            "block_k": 64,
            "split_k": 8,
            "num_warps": 4,
            "num_ctas": 1,
            "num_stages": 4,
            "max_nreg": null
          }
        },
        "8192": {
          "16": {
            "block_m": 16,
            "block_n": 16,
            "block_k": 128,
            "split_k": 8,
            "num_warps": 4,
            "num_ctas": 1,
            "num_stages": 4,
            "max_nreg": null
          }
        },
        "12288": {
          "16": {
            "block_m": 32,
            "block_n": 16,
            "block_k": 256,
            "split_k": 8,
            "num_warps": 4,
            "num_ctas": 1,
            "num_stages": 4,
            "max_nreg": null
          }
        },
        "16384": {
          "16": {
            "block_m": 16,
            "block_n": 16,
            "block_k": 256,
            "split_k": 8,
            "num_warps": 4,
            "num_ctas": 1,
            "num_stages": 4,
            "max_nreg": null
          }
        },
        "24576": {
          "16": {
            "block_m": 32,
            "block_n": 16,
            "block_k": 256,
            "split_k": 8,
            "num_warps": 4,
            "num_ctas": 1,
            "num_stages": 4,
            "max_nreg": null
          }
        },
        "32768": {
          "16": {
            "block_m": 32,
            "block_n": 16,
            "block_k": 64,
            "split_k": 32,
            "num_warps": 4,
            "num_ctas": 1,
            "num_stages": 4,
            "max_nreg": null
          }
        }
      },
      "448": {
        "1024": {
          "16": {
            "block_m": 16,
            "block_n": 16,
            "block_k": 128,
            "split_k": 8,
            "num_warps": 4,
            "num_ctas": 1,
            "num_stages": 2,
            "max_nreg": null
          }
        },
        "2048": {
          "16": {
            "block_m": 16,
            "block_n": 16,
            "block_k": 128,
            "split_k": 8,
            "num_warps": 4,
            "num_ctas": 1,
            "num_stages": 4,
            "max_nreg": null
          }
        },
        "4096": {
          "16": {
            "block_m": 32,
            "block_n": 16,
            "block_k": 128,
            "split_k": 8,
            "num_warps": 4,
            "num_ctas": 1,
            "num_stages": 4,
            "max_nreg": null
          }
        },
        "8192": {
          "16": {
            "block_m": 32,
            "block_n": 16,
            "block_k": 256,
            "split_k": 8,
            "num_warps": 4,
            "num_ctas": 1,
            "num_stages": 4,
            "max_nreg": null
          }
        },
        "12288": {
          "16": {
            "block_m": 16,
            "block_n": 16,
            "block_k": 128,
            "split_k": 32,
            "num_warps": 4,
            "num_ctas": 1,
            "num_stages": 2,
            "max_nreg": null
          }
        },
        "16384": {
          "16": {
            "block_m": 32,
            "block_n": 16,
            "block_k": 256,
            "split_k": 8,
            "num_warps": 4,
            "num_ctas": 1,
            "num_stages": 4,
            "max_nreg": null
          }
        },
        "24576": {
          "16": {
            "block_m": 32,
            "block_n": 16,
            "block_k": 256,
            "split_k": 8,
            "num_warps": 4,
            "num_ctas": 1,
            "num_stages": 4,
            "max_nreg": null
          }
        },
        "32768": {
          "16": {
            "block_m": 64,
            "block_n": 16,
            "block_k": 128,
            "split_k": 32,
            "num_warps": 8,
            "num_ctas": 1,
            "num_stages": 4,
            "max_nreg": null
          }
        }
      },
      "512": {
        "1024": {
          "16": {
            "block_m": 16,
            "block_n": 16,
            "block_k": 128,
            "split_k": 8,
            "num_warps": 4,
            "num_ctas": 1,
            "num_stages": 2,
            "max_nreg": null
          }
        },
        "2048": {
          "16": {
            "block_m": 16,
            "block_n": 16,
            "block_k": 64,
            "split_k": 8,
            "num_warps": 4,
            "num_ctas": 1,
            "num_stages": 4,
            "max_nreg": null
          }
        },
        "4096": {
          "16": {
            "block_m": 16,
            "block_n": 16,
            "block_k": 128,
            "split_k": 8,
            "num_warps": 4,
            "num_ctas": 1,
            "num_stages": 4,
            "max_nreg": null
          }
        },
        "8192": {
          "16": {
            "block_m": 32,
            "block_n": 16,
            "block_k": 256,
            "split_k": 8,
            "num_warps": 4,
            "num_ctas": 1,
            "num_stages": 4,
            "max_nreg": null
          }
        },
        "12288": {
          "16": {
            "block_m": 32,
            "block_n": 16,
            "block_k": 128,
            "split_k": 8,
            "num_warps": 4,
            "num_ctas": 1,
            "num_stages": 4,
            "max_nreg": null
          }
        },
        "16384": {
          "16": {
            "block_m": 32,
            "block_n": 16,
            "block_k": 256,
            "split_k": 8,
            "num_warps": 4,
            "num_ctas": 1,
            "num_stages": 4,
            "max_nreg": null
          }
        },
        "24576": {
          "16": {
            "block_m": 32,
            "block_n": 16,
            "block_k": 64,
            "split_k": 32,
            "num_warps": 8,
            "num_ctas": 1,
            "num_stages": 4,
            "max_nreg": null
          }
        },
        "32768": {
          "16": {
            "block_m": 32,
            "block_n": 16,
            "block_k": 256,
            "split_k": 8,
            "num_warps": 4,
            "num_ctas": 1,
            "num_stages": 4,
            "max_nreg": null
          }
        }
      },
      "640": {
        "1024": {
          "16": {
            "block_m": 16,
            "block_n": 16,
            "block_k": 64,
            "split_k": 8,
            "num_warps": 4,
            "num_ctas": 1,
            "num_stages": 4,
            "max_nreg": null
          }
        },
        "2048": {
          "16": {
            "block_m": 32,
            "block_n": 16,
            "block_k": 64,
            "split_k": 8,
            "num_warps": 8,
            "num_ctas": 1,
            "num_stages": 4,
            "max_nreg": null
          }
        },
        "4096": {
          "16": {
            "block_m": 64,
            "block_n": 16,
            "block_k": 128,
            "split_k": 8,
            "num_warps": 8,
            "num_ctas": 1,
            "num_stages": 4,
            "max_nreg": null
          }
        },
        "8192": {
          "16": {
            "block_m": 32,
            "block_n": 16,
            "block_k": 128,
            "split_k": 8,
            "num_warps": 4,
            "num_ctas": 1,
            "num_stages": 4,
            "max_nreg": null
          }
        },
        "12288": {
          "16": {
            "block_m": 32,
            "block_n": 16,
            "block_k": 128,
            "split_k": 8,
            "num_warps": 4,
            "num_ctas": 1,
            "num_stages": 4,
            "max_nreg": null
          }
        },
        "16384": {
          "16": {
            "block_m": 32,
            "block_n": 16,
            "block_k": 128,
            "split_k": 8,
            "num_warps": 4,
            "num_ctas": 1,
            "num_stages": 4,
            "max_nreg": null
          }
        },
        "24576": {
          "16": {
            "block_m": 64,
            "block_n": 16,
            "block_k": 256,
            "split_k": 8,
            "num_warps": 8,
            "num_ctas": 1,
            "num_stages": 4,
            "max_nreg": null
          }
        },
        "32768": {
          "16": {
            "block_m": 64,
            "block_n": 16,
            "block_k": 256,
            "split_k": 8,
            "num_warps": 8,
            "num_ctas": 1,
            "num_stages": 4,
            "max_nreg": null
          }
        }
      },
      "768": {
        "1024": {
          "16": {
            "block_m": 16,
            "block_n": 16,
            "block_k": 64,
            "split_k": 8,
            "num_warps": 4,
            "num_ctas": 1,
            "num_stages": 2,
            "max_nreg": null
          }
        },
        "2048": {
          "16": {
            "block_m": 16,
            "block_n": 16,
            "block_k": 64,
            "split_k": 8,
            "num_warps": 4,
            "num_ctas": 1,
            "num_stages": 4,
            "max_nreg": null
          }
        },
        "4096": {
          "16": {
            "block_m": 16,
            "block_n": 16,
            "block_k": 64,
            "split_k": 8,
            "num_warps": 4,
            "num_ctas": 1,
            "num_stages": 4,
            "max_nreg": null
          }
        },
        "8192": {
          "16": {
            "block_m": 16,
            "block_n": 16,
            "block_k": 128,
            "split_k": 8,
            "num_warps": 4,
            "num_ctas": 1,
            "num_stages": 4,
            "max_nreg": null
          }
        },
        "12288": {
          "16": {
            "block_m": 32,
            "block_n": 16,
            "block_k": 128,
            "split_k": 8,
            "num_warps": 4,
            "num_ctas": 1,
            "num_stages": 4,
            "max_nreg": null
          }
        },
        "16384": {
          "16": {
            "block_m": 64,
            "block_n": 16,
            "block_k": 256,
            "split_k": 8,
            "num_warps": 8,
            "num_ctas": 1,
            "num_stages": 4,
            "max_nreg": null
          }
        },
        "24576": {
          "16": {
            "block_m": 32,
            "block_n": 16,
            "block_k": 128,
            "split_k": 8,
            "num_warps": 4,
            "num_ctas": 1,
            "num_stages": 4,
            "max_nreg": null
          }
        },
        "32768": {
          "16": {
            "block_m": 32,
            "block_n": 16,
            "block_k": 128,
            "split_k": 8,
            "num_warps": 4,
            "num_ctas": 1,
            "num_stages": 4,
            "max_nreg": null
          }
        }
      },
      "896": {
        "1024": {
          "16": {
            "block_m": 16,
            "block_n": 16,
            "block_k": 64,
            "split_k": 8,
            "num_warps": 4,
            "num_ctas": 1,
            "num_stages": 4,
            "max_nreg": null
          }
        },
        "2048": {
          "16": {
            "block_m": 16,
            "block_n": 16,
            "block_k": 128,
            "split_k": 8,
            "num_warps": 4,
            "num_ctas": 1,
            "num_stages": 4,
            "max_nreg": null
          }
        },
        "4096": {
          "16": {
            "block_m": 64,
            "block_n": 16,
            "block_k": 128,
            "split_k": 8,
            "num_warps": 8,
            "num_ctas": 1,
            "num_stages": 4,
            "max_nreg": null
          }
        },
        "8192": {
          "16": {
            "block_m": 64,
            "block_n": 16,
            "block_k": 128,
            "split_k": 8,
            "num_warps": 8,
            "num_ctas": 1,
            "num_stages": 4,
            "max_nreg": null
          }
        },
        "12288": {
          "16": {
            "block_m": 64,
            "block_n": 16,
            "block_k": 128,
            "split_k": 8,
            "num_warps": 8,
            "num_ctas": 1,
            "num_stages": 4,
            "max_nreg": null
          }
        },
        "16384": {
          "16": {
            "block_m": 64,
            "block_n": 16,
            "block_k": 128,
            "split_k": 8,
            "num_warps": 8,
            "num_ctas": 1,
            "num_stages": 4,
            "max_nreg": null
          }
        },
        "24576": {
          "16": {
            "block_m": 64,
            "block_n": 16,
            "block_k": 128,
            "split_k": 8,
            "num_warps": 8,
            "num_ctas": 1,
            "num_stages": 4,
            "max_nreg": null
          }
        },
        "32768": {
          "16": {
            "block_m": 64,
            "block_n": 16,
            "block_k": 128,
            "split_k": 8,
            "num_warps": 8,
            "num_ctas": 1,
            "num_stages": 4,
            "max_nreg": null
          }
        }
      },
      "1024": {
        "1024": {
          "16": {
            "block_m": 16,
            "block_n": 16,
            "block_k": 64,
            "split_k": 8,
            "num_warps": 4,
            "num_ctas": 1,
            "num_stages": 2,
            "max_nreg": null
          }
        },
        "2048": {
          "16": {
            "block_m": 16,
            "block_n": 16,
            "block_k": 64,
            "split_k": 8,
            "num_warps": 4,
            "num_ctas": 1,
            "num_stages": 2,
            "max_nreg": null
          }
        },
        "4096": {
          "16": {
            "block_m": 16,
            "block_n": 16,
            "block_k": 256,
            "split_k": 8,
            "num_warps": 4,
            "num_ctas": 1,
            "num_stages": 2,
            "max_nreg": null
          }
        },
        "8192": {
          "16": {
            "block_m": 32,
            "block_n": 16,
            "block_k": 128,
            "split_k": 8,
            "num_warps": 4,
            "num_ctas": 1,
            "num_stages": 4,
            "max_nreg": null
          }
        },
        "12288": {
          "16": {
            "block_m": 32,
            "block_n": 16,
            "block_k": 128,
            "split_k": 8,
            "num_warps": 4,
            "num_ctas": 1,
            "num_stages": 4,
            "max_nreg": null
          }
        },
        "16384": {
          "16": {
            "block_m": 32,
            "block_n": 16,
            "block_k": 128,
            "split_k": 8,
            "num_warps": 4,
            "num_ctas": 1,
            "num_stages": 4,
            "max_nreg": null
          }
        },
        "24576": {
          "16": {
            "block_m": 64,
            "block_n": 16,
            "block_k": 128,
            "split_k": 8,
            "num_warps": 8,
            "num_ctas": 1,
            "num_stages": 4,
            "max_nreg": null
          }
        },
        "32768": {
          "16": {
            "block_m": 64,
            "block_n": 16,
            "block_k": 256,
            "split_k": 8,
            "num_warps": 8,
            "num_ctas": 1,
            "num_stages": 4,
            "max_nreg": null
          }
        }
      },
      "2048": {
        "1024": {
          "16": {
            "block_m": 16,
            "block_n": 16,
            "block_k": 64,
            "split_k": 8,
            "num_warps": 4,
            "num_ctas": 1,
            "num_stages": 4,
            "max_nreg": null
          }
        },
        "2048": {
          "16": {
            "block_m": 16,
            "block_n": 16,
            "block_k": 128,
            "split_k": 8,
            "num_warps": 4,
            "num_ctas": 1,
            "num_stages": 2,
            "max_nreg": null
          }
        },
        "4096": {
          "16": {
            "block_m": 32,
            "block_n": 16,
            "block_k": 64,
            "split_k": 8,
            "num_warps": 8,
            "num_ctas": 1,
            "num_stages": 4,
            "max_nreg": null
          }
        },
        "8192": {
          "16": {
            "block_m": 16,
            "block_n": 16,
            "block_k": 128,
            "split_k": 8,
            "num_warps": 4,
            "num_ctas": 1,
            "num_stages": 2,
            "max_nreg": null
          }
        },
        "12288": {
          "16": {
            "block_m": 32,
            "block_n": 16,
            "block_k": 64,
            "split_k": 8,
            "num_warps": 8,
            "num_ctas": 1,
            "num_stages": 4,
            "max_nreg": null
          }
        },
        "16384": {
          "16": {
            "block_m": 32,
            "block_n": 16,
            "block_k": 256,
            "split_k": 8,
            "num_warps": 4,
            "num_ctas": 1,
            "num_stages": 2,
            "max_nreg": null
          }
        },
        "24576": {
          "16": {
            "block_m": 64,
            "block_n": 16,
            "block_k": 256,
            "split_k": 8,
            "num_warps": 8,
            "num_ctas": 1,
            "num_stages": 2,
            "max_nreg": null
          }
        },
        "32768": {
          "16": {
            "block_m": 64,
            "block_n": 16,
            "block_k": 256,
            "split_k": 8,
            "num_warps": 8,
            "num_ctas": 1,
            "num_stages": 2,
            "max_nreg": null
          }
        }
      },
      "3072": {
        "1024": {
          "16": {
            "block_m": 16,
            "block_n": 16,
            "block_k": 128,
            "split_k": 8,
            "num_warps": 4,
            "num_ctas": 1,
            "num_stages": 2,
            "max_nreg": null
          }
        },
        "2048": {
          "16": {
            "block_m": 64,
            "block_n": 16,
            "block_k": 128,
            "split_k": 8,
            "num_warps": 8,
            "num_ctas": 1,
            "num_stages": 2,
            "max_nreg": null
          }
        },
        "4096": {
          "16": {
            "block_m": 64,
            "block_n": 16,
            "block_k": 128,
            "split_k": 8,
            "num_warps": 8,
            "num_ctas": 1,
            "num_stages": 2,
            "max_nreg": null
          }
        },
        "8192": {
          "16": {
            "block_m": 32,
            "block_n": 16,
            "block_k": 128,
            "split_k": 8,
            "num_warps": 4,
            "num_ctas": 1,
            "num_stages": 2,
            "max_nreg": null
          }
        },
        "12288": {
          "16": {
            "block_m": 32,
            "block_n": 16,
            "block_k": 128,
            "split_k": 8,
            "num_warps": 4,
            "num_ctas": 1,
            "num_stages": 4,
            "max_nreg": null
          }
        },
        "16384": {
          "16": {
            "block_m": 64,
            "block_n": 16,
            "block_k": 128,
            "split_k": 8,
            "num_warps": 8,
            "num_ctas": 1,
            "num_stages": 2,
            "max_nreg": null
          }
        },
        "24576": {
          "16": {
            "block_m": 64,
            "block_n": 16,
            "block_k": 128,
            "split_k": 8,
            "num_warps": 8,
            "num_ctas": 1,
            "num_stages": 2,
            "max_nreg": null
          }
        },
        "32768": {
          "16": {
            "block_m": 64,
            "block_n": 16,
            "block_k": 128,
            "split_k": 8,
            "num_warps": 8,
            "num_ctas": 1,
            "num_stages": 2,
            "max_nreg": null
          }
        }
      },
      "4096": {
        "1024": {
          "16": {
            "block_m": 64,
            "block_n": 16,
            "block_k": 128,
            "split_k": 8,
            "num_warps": 8,
            "num_ctas": 1,
            "num_stages": 2,
            "max_nreg": null
          }
        },
        "2048": {
          "16": {
            "block_m": 64,
            "block_n": 16,
            "block_k": 128,
            "split_k": 8,
            "num_warps": 8,
            "num_ctas": 1,
            "num_stages": 2,
            "max_nreg": null
          }
        },
        "4096": {
          "16": {
            "block_m": 32,
            "block_n": 16,
            "block_k": 64,
            "split_k": 8,
            "num_warps": 4,
            "num_ctas": 1,
            "num_stages": 2,
            "max_nreg": null
          }
        },
        "8192": {
          "16": {
            "block_m": 64,
            "block_n": 16,
            "block_k": 128,
            "split_k": 8,
            "num_warps": 8,
            "num_ctas": 1,
            "num_stages": 2,
            "max_nreg": null
          }
        },
        "12288": {
          "16": {
            "block_m": 32,
            "block_n": 16,
            "block_k": 128,
            "split_k": 8,
            "num_warps": 4,
            "num_ctas": 1,
            "num_stages": 2,
            "max_nreg": null
          }
        },
        "16384": {
          "16": {
            "block_m": 32,
            "block_n": 16,
            "block_k": 128,
            "split_k": 8,
            "num_warps": 4,
            "num_ctas": 1,
            "num_stages": 2,
            "max_nreg": null
          }
        },
        "24576": {
          "16": {
            "block_m": 64,
            "block_n": 16,
            "block_k": 128,
            "split_k": 8,
            "num_warps": 8,
            "num_ctas": 1,
            "num_stages": 2,
            "max_nreg": null
          }
        },
        "32768": {
          "16": {
            "block_m": 64,
            "block_n": 16,
            "block_k": 128,
            "split_k": 8,
            "num_warps": 8,
            "num_ctas": 1,
            "num_stages": 4,
            "max_nreg": null
          }
        }
      },
      "5120": {
        "1024": {
          "16": {
            "block_m": 64,
            "block_n": 16,
            "block_k": 64,
            "split_k": 8,
            "num_warps": 8,
            "num_ctas": 1,
            "num_stages": 4,
            "max_nreg": null
          }
        },
        "2048": {
          "16": {
            "block_m": 64,
            "block_n": 16,
            "block_k": 64,
            "split_k": 8,
            "num_warps": 8,
            "num_ctas": 1,
            "num_stages": 4,
            "max_nreg": null
          }
        },
        "4096": {
          "16": {
            "block_m": 64,
            "block_n": 16,
            "block_k": 64,
            "split_k": 8,
            "num_warps": 8,
            "num_ctas": 1,
            "num_stages": 4,
            "max_nreg": null
          }
        },
        "8192": {
          "16": {
            "block_m": 64,
            "block_n": 16,
            "block_k": 128,
            "split_k": 8,
            "num_warps": 8,
            "num_ctas": 1,
            "num_stages": 2,
            "max_nreg": null
          }
        },
        "12288": {
          "16": {
            "block_m": 64,
            "block_n": 16,
            "block_k": 128,
            "split_k": 8,
            "num_warps": 8,
            "num_ctas": 1,
            "num_stages": 2,
            "max_nreg": null
          }
        },
        "16384": {
          "16": {
            "block_m": 64,
            "block_n": 16,
            "block_k": 128,
            "split_k": 8,
            "num_warps": 8,
            "num_ctas": 1,
            "num_stages": 2,
            "max_nreg": null
          }
        },
        "24576": {
          "16": {
            "block_m": 64,
            "block_n": 16,
            "block_k": 128,
            "split_k": 8,
            "num_warps": 8,
            "num_ctas": 1,
            "num_stages": 2,
            "max_nreg": null
          }
        },
        "32768": {
          "16": {
            "block_m": 64,
            "block_n": 16,
            "block_k": 128,
            "split_k": 8,
            "num_warps": 8,
            "num_ctas": 1,
            "num_stages": 2,
            "max_nreg": null
          }
        }
      },
      "6144": {
        "1024": {
          "16": {
            "block_m": 64,
            "block_n": 16,
            "block_k": 128,
            "split_k": 8,
            "num_warps": 8,
            "num_ctas": 1,
            "num_stages": 2,
            "max_nreg": null
          }
        },
        "2048": {
          "16": {
            "block_m": 32,
            "block_n": 16,
            "block_k": 128,
            "split_k": 8,
            "num_warps": 4,
            "num_ctas": 1,
            "num_stages": 2,
            "max_nreg": null
          }
        },
        "4096": {
          "16": {
            "block_m": 64,
            "block_n": 16,
            "block_k": 64,
            "split_k": 8,
            "num_warps": 8,
            "num_ctas": 1,
            "num_stages": 2,
            "max_nreg": null
          }
        },
        "8192": {
          "16": {
            "block_m": 128,
            "block_n": 16,
            "block_k": 128,
            "split_k": 8,
            "num_warps": 8,
            "num_ctas": 1,
            "num_stages": 2,
            "max_nreg": null
          }
        },
        "12288": {
          "16": {
            "block_m": 128,
            "block_n": 16,
            "block_k": 128,
            "split_k": 8,
            "num_warps": 8,
            "num_ctas": 1,
            "num_stages": 2,
            "max_nreg": null
          }
        },
        "16384": {
          "16": {
            "block_m": 64,
            "block_n": 16,
            "block_k": 64,
            "split_k": 8,
            "num_warps": 8,
            "num_ctas": 1,
            "num_stages": 2,
            "max_nreg": null
          }
        },
        "24576": {
          "16": {
            "block_m": 64,
            "block_n": 16,
            "block_k": 64,
            "split_k": 8,
            "num_warps": 8,
            "num_ctas": 1,
            "num_stages": 2,
            "max_nreg": null
          }
        },
        "32768": {
          "16": {
            "block_m": 64,
            "block_n": 16,
            "block_k": 64,
            "split_k": 8,
            "num_warps": 8,
            "num_ctas": 1,
            "num_stages": 2,
            "max_nreg": null
          }
        }
      },
      "7168": {
        "1024": {
          "16": {
            "block_m": 64,
            "block_n": 16,
            "block_k": 64,
            "split_k": 8,
            "num_warps": 8,
            "num_ctas": 1,
            "num_stages": 2,
            "max_nreg": null
          }
        },
        "2048": {
          "16": {
            "block_m": 64,
            "block_n": 16,
            "block_k": 64,
            "split_k": 8,
            "num_warps": 8,
            "num_ctas": 1,
            "num_stages": 2,
            "max_nreg": null
          }
        },
        "4096": {
          "16": {
            "block_m": 16,
            "block_n": 16,
            "block_k": 128,
            "split_k": 8,
            "num_warps": 4,
            "num_ctas": 1,
            "num_stages": 4,
            "max_nreg": null
          }
        },
        "8192": {
          "16": {
            "block_m": 64,
            "block_n": 16,
            "block_k": 64,
            "split_k": 8,
            "num_warps": 8,
            "num_ctas": 1,
            "num_stages": 2,
            "max_nreg": null
          }
        },
        "12288": {
          "16": {
            "block_m": 64,
            "block_n": 16,
            "block_k": 64,
            "split_k": 8,
            "num_warps": 8,
            "num_ctas": 1,
            "num_stages": 2,
            "max_nreg": null
          }
        },
        "16384": {
          "16": {
            "block_m": 128,
            "block_n": 16,
            "block_k": 64,
            "split_k": 8,
            "num_warps": 8,
            "num_ctas": 1,
            "num_stages": 2,
            "max_nreg": null
          }
        },
        "24576": {
          "16": {
            "block_m": 64,
            "block_n": 16,
            "block_k": 64,
            "split_k": 8,
            "num_warps": 8,
            "num_ctas": 1,
            "num_stages": 2,
            "max_nreg": null
          }
        },
        "32768": {
          "16": {
            "block_m": 128,
            "block_n": 16,
            "block_k": 64,
            "split_k": 8,
            "num_warps": 8,
            "num_ctas": 1,
            "num_stages": 2,
            "max_nreg": null
          }
        }
      },
      "8192": {
        "1024": {
          "16": {
            "block_m": 64,
            "block_n": 16,
            "block_k": 64,
            "split_k": 8,
            "num_warps": 8,
            "num_ctas": 1,
            "num_stages": 4,
            "max_nreg": null
          }
        },
        "2048": {
          "16": {
            "block_m": 64,
            "block_n": 16,
            "block_k": 64,
            "split_k": 8,
            "num_warps": 8,
            "num_ctas": 1,
            "num_stages": 2,
            "max_nreg": null
          }
        },
        "4096": {
          "16": {
            "block_m": 32,
            "block_n": 16,
            "block_k": 128,
            "split_k": 8,
            "num_warps": 4,
            "num_ctas": 1,
            "num_stages": 2,
            "max_nreg": null
          }
        },
        "8192": {
          "16": {
            "block_m": 64,
            "block_n": 16,
            "block_k": 64,
            "split_k": 8,
            "num_warps": 8,
            "num_ctas": 1,
            "num_stages": 2,
            "max_nreg": null
          }
        },
        "12288": {
          "16": {
            "block_m": 64,
            "block_n": 16,
            "block_k": 64,
            "split_k": 8,
            "num_warps": 8,
            "num_ctas": 1,
            "num_stages": 2,
            "max_nreg": null
          }
        },
        "16384": {
          "16": {
            "block_m": 32,
            "block_n": 16,
            "block_k": 128,
            "split_k": 8,
            "num_warps": 4,
            "num_ctas": 1,
            "num_stages": 2,
            "max_nreg": null
          }
        },
        "24576": {
          "16": {
            "block_m": 64,
            "block_n": 16,
            "block_k": 64,
            "split_k": 8,
            "num_warps": 8,
            "num_ctas": 1,
            "num_stages": 2,
            "max_nreg": null
          }
        },
        "32768": {
          "16": {
            "block_m": 128,
            "block_n": 16,
            "block_k": 64,
            "split_k": 8,
            "num_warps": 8,
            "num_ctas": 1,
            "num_stages": 2,
            "max_nreg": null
          }
        }
      }
    },
    "2": {
      "1": {
        "1024": {
          "16": {
            "block_m": 16,
            "block_n": 16,
            "block_k": 32,
            "split_k": 32,
            "num_warps": 8,
            "num_ctas": 1,
            "num_stages": 4,
            "max_nreg": null
          }
        },
        "2048": {
          "16": {
            "block_m": 16,
            "block_n": 16,
            "block_k": 32,
            "split_k": 64,
            "num_warps": 4,
            "num_ctas": 1,
            "num_stages": 2,
            "max_nreg": null
          }
        },
        "4096": {
          "16": {
            "block_m": 16,
            "block_n": 16,
            "block_k": 32,
            "split_k": 128,
            "num_warps": 4,
            "num_ctas": 1,
            "num_stages": 4,
            "max_nreg": null
          }
        },
        "8192": {
          "16": {
            "block_m": 16,
            "block_n": 16,
            "block_k": 64,
            "split_k": 128,
            "num_warps": 8,
            "num_ctas": 1,
            "num_stages": 4,
            "max_nreg": null
          }
        },
        "12288": {
          "16": {
            "block_m": 16,
            "block_n": 16,
            "block_k": 32,
            "split_k": 128,
            "num_warps": 4,
            "num_ctas": 1,
            "num_stages": 4,
            "max_nreg": null
          }
        },
        "16384": {
          "16": {
            "block_m": 16,
            "block_n": 16,
            "block_k": 128,
            "split_k": 128,
            "num_warps": 8,
            "num_ctas": 1,
            "num_stages": 4,
            "max_nreg": null
          }
        },
        "24576": {
          "16": {
            "block_m": 16,
            "block_n": 16,
            "block_k": 64,
            "split_k": 128,
            "num_warps": 8,
            "num_ctas": 1,
            "num_stages": 4,
            "max_nreg": null
          }
        },
        "32768": {
          "16": {
            "block_m": 16,
            "block_n": 16,
            "block_k": 128,
            "split_k": 128,
            "num_warps": 8,
            "num_ctas": 1,
            "num_stages": 4,
            "max_nreg": null
          }
        }
      },
      "16": {
        "1024": {
          "16": {
            "block_m": 16,
            "block_n": 16,
            "block_k": 32,
            "split_k": 32,
            "num_warps": 4,
            "num_ctas": 1,
            "num_stages": 4,
            "max_nreg": null
          }
        },
        "2048": {
          "16": {
            "block_m": 16,
            "block_n": 16,
            "block_k": 32,
            "split_k": 64,
            "num_warps": 8,
            "num_ctas": 1,
            "num_stages": 4,
            "max_nreg": null
          }
        },
        "4096": {
          "16": {
            "block_m": 16,
            "block_n": 16,
            "block_k": 64,
            "split_k": 64,
            "num_warps": 4,
            "num_ctas": 1,
            "num_stages": 2,
            "max_nreg": null
          }
        },
        "8192": {
          "16": {
            "block_m": 16,
            "block_n": 16,
            "block_k": 256,
            "split_k": 32,
            "num_warps": 4,
            "num_ctas": 1,
            "num_stages": 4,
            "max_nreg": null
          }
        },
        "12288": {
          "16": {
            "block_m": 16,
            "block_n": 16,
            "block_k": 64,
            "split_k": 64,
            "num_warps": 8,
            "num_ctas": 1,
            "num_stages": 4,
            "max_nreg": null
          }
        },
        "16384": {
          "16": {
            "block_m": 16,
            "block_n": 16,
            "block_k": 256,
            "split_k": 64,
            "num_warps": 4,
            "num_ctas": 1,
            "num_stages": 2,
            "max_nreg": null
          }
        },
        "24576": {
          "16": {
            "block_m": 16,
            "block_n": 16,
            "block_k": 128,
            "split_k": 64,
            "num_warps": 4,
            "num_ctas": 1,
            "num_stages": 4,
            "max_nreg": null
          }
        },
        "32768": {
          "16": {
            "block_m": 16,
            "block_n": 16,
            "block_k": 128,
            "split_k": 128,
            "num_warps": 8,
            "num_ctas": 1,
            "num_stages": 4,
            "max_nreg": null
          }
        }
      },
      "32": {
        "1024": {
          "16": {
            "block_m": 16,
            "block_n": 16,
            "block_k": 32,
            "split_k": 32,
            "num_warps": 8,
            "num_ctas": 1,
            "num_stages": 2,
            "max_nreg": null
          }
        },
        "2048": {
          "16": {
            "block_m": 16,
            "block_n": 16,
            "block_k": 64,
            "split_k": 32,
            "num_warps": 8,
            "num_ctas": 1,
            "num_stages": 4,
            "max_nreg": null
          }
        },
        "4096": {
          "16": {
            "block_m": 16,
            "block_n": 16,
            "block_k": 64,
            "split_k": 64,
            "num_warps": 8,
            "num_ctas": 1,
            "num_stages": 2,
            "max_nreg": null
          }
        },
        "8192": {
          "16": {
            "block_m": 16,
            "block_n": 16,
            "block_k": 256,
            "split_k": 32,
            "num_warps": 8,
            "num_ctas": 1,
            "num_stages": 4,
            "max_nreg": null
          }
        },
        "12288": {
          "16": {
            "block_m": 16,
            "block_n": 16,
            "block_k": 64,
            "split_k": 64,
            "num_warps": 8,
            "num_ctas": 1,
            "num_stages": 4,
            "max_nreg": null
          }
        },
        "16384": {
          "16": {
            "block_m": 16,
            "block_n": 16,
            "block_k": 256,
            "split_k": 32,
            "num_warps": 4,
            "num_ctas": 1,
            "num_stages": 4,
            "max_nreg": null
          }
        },
        "24576": {
          "16": {
            "block_m": 16,
            "block_n": 16,
            "block_k": 128,
            "split_k": 64,
            "num_warps": 4,
            "num_ctas": 1,
            "num_stages": 4,
            "max_nreg": null
          }
        },
        "32768": {
          "16": {
            "block_m": 16,
            "block_n": 16,
            "block_k": 256,
            "split_k": 64,
            "num_warps": 4,
            "num_ctas": 1,
            "num_stages": 4,
            "max_nreg": null
          }
        }
      },
      "64": {
        "1024": {
          "16": {
            "block_m": 16,
            "block_n": 16,
            "block_k": 32,
            "split_k": 32,
            "num_warps": 8,
            "num_ctas": 1,
            "num_stages": 2,
            "max_nreg": null
          }
        },
        "2048": {
          "16": {
            "block_m": 16,
            "block_n": 16,
            "block_k": 256,
            "split_k": 8,
            "num_warps": 4,
            "num_ctas": 1,
            "num_stages": 2,
            "max_nreg": null
          }
        },
        "4096": {
          "16": {
            "block_m": 16,
            "block_n": 16,
            "block_k": 64,
            "split_k": 32,
            "num_warps": 8,
            "num_ctas": 1,
            "num_stages": 4,
            "max_nreg": null
          }
        },
        "8192": {
          "16": {
            "block_m": 16,
            "block_n": 16,
            "block_k": 256,
            "split_k": 32,
            "num_warps": 4,
            "num_ctas": 1,
            "num_stages": 4,
            "max_nreg": null
          }
        },
        "12288": {
          "16": {
            "block_m": 16,
            "block_n": 16,
            "block_k": 128,
            "split_k": 32,
            "num_warps": 8,
            "num_ctas": 1,
            "num_stages": 4,
            "max_nreg": null
          }
        },
        "16384": {
          "16": {
            "block_m": 32,
            "block_n": 16,
            "block_k": 256,
            "split_k": 32,
            "num_warps": 8,
            "num_ctas": 1,
            "num_stages": 4,
            "max_nreg": null
          }
        },
        "24576": {
          "16": {
            "block_m": 16,
            "block_n": 16,
            "block_k": 256,
            "split_k": 32,
            "num_warps": 4,
            "num_ctas": 1,
            "num_stages": 4,
            "max_nreg": null
          }
        },
        "32768": {
          "16": {
            "block_m": 32,
            "block_n": 16,
            "block_k": 128,
            "split_k": 64,
            "num_warps": 8,
            "num_ctas": 1,
            "num_stages": 4,
            "max_nreg": null
          }
        }
      },
      "128": {
        "1024": {
          "16": {
            "block_m": 16,
            "block_n": 16,
            "block_k": 128,
            "split_k": 8,
            "num_warps": 4,
            "num_ctas": 1,
            "num_stages": 4,
            "max_nreg": null
          }
        },
        "2048": {
          "16": {
            "block_m": 16,
            "block_n": 16,
            "block_k": 256,
            "split_k": 8,
            "num_warps": 8,
            "num_ctas": 1,
            "num_stages": 4,
            "max_nreg": null
          }
        },
        "4096": {
          "16": {
            "block_m": 16,
            "block_n": 16,
            "block_k": 256,
            "split_k": 8,
            "num_warps": 4,
            "num_ctas": 1,
            "num_stages": 4,
            "max_nreg": null
          }
        },
        "8192": {
          "16": {
            "block_m": 32,
            "block_n": 16,
            "block_k": 128,
            "split_k": 32,
            "num_warps": 8,
            "num_ctas": 1,
            "num_stages": 4,
            "max_nreg": null
          }
        },
        "12288": {
          "16": {
            "block_m": 32,
            "block_n": 16,
            "block_k": 128,
            "split_k": 32,
            "num_warps": 8,
            "num_ctas": 1,
            "num_stages": 4,
            "max_nreg": null
          }
        },
        "16384": {
          "16": {
            "block_m": 64,
            "block_n": 16,
            "block_k": 512,
            "split_k": 32,
            "num_warps": 8,
            "num_ctas": 1,
            "num_stages": 2,
            "max_nreg": null
          }
        },
        "24576": {
          "16": {
            "block_m": 32,
            "block_n": 16,
            "block_k": 128,
            "split_k": 32,
            "num_warps": 8,
            "num_ctas": 1,
            "num_stages": 4,
            "max_nreg": null
          }
        },
        "32768": {
          "16": {
            "block_m": 64,
            "block_n": 16,
            "block_k": 512,
            "split_k": 32,
            "num_warps": 8,
            "num_ctas": 1,
            "num_stages": 2,
            "max_nreg": null
          }
        }
      },
      "192": {
        "1024": {
          "16": {
            "block_m": 16,
            "block_n": 16,
            "block_k": 64,
            "split_k": 8,
            "num_warps": 8,
            "num_ctas": 1,
            "num_stages": 4,
            "max_nreg": null
          }
        },
        "2048": {
          "16": {
            "block_m": 16,
            "block_n": 16,
            "block_k": 256,
            "split_k": 8,
            "num_warps": 4,
            "num_ctas": 1,
            "num_stages": 4,
            "max_nreg": null
          }
        },
        "4096": {
          "16": {
            "block_m": 16,
            "block_n": 16,
            "block_k": 256,
            "split_k": 8,
            "num_warps": 4,
            "num_ctas": 1,
            "num_stages": 4,
            "max_nreg": null
          }
        },
        "8192": {
          "16": {
            "block_m": 32,
            "block_n": 16,
            "block_k": 128,
            "split_k": 32,
            "num_warps": 4,
            "num_ctas": 1,
            "num_stages": 4,
            "max_nreg": null
          }
        },
        "12288": {
          "16": {
            "block_m": 32,
            "block_n": 16,
            "block_k": 128,
            "split_k": 32,
            "num_warps": 4,
            "num_ctas": 1,
            "num_stages": 4,
            "max_nreg": null
          }
        },
        "16384": {
          "16": {
            "block_m": 32,
            "block_n": 16,
            "block_k": 128,
            "split_k": 32,
            "num_warps": 4,
            "num_ctas": 1,
            "num_stages": 4,
            "max_nreg": null
          }
        },
        "24576": {
          "16": {
            "block_m": 64,
            "block_n": 16,
            "block_k": 128,
            "split_k": 64,
            "num_warps": 8,
            "num_ctas": 1,
            "num_stages": 2,
            "max_nreg": null
          }
        },
        "32768": {
          "16": {
            "block_m": 32,
            "block_n": 16,
            "block_k": 128,
            "split_k": 32,
            "num_warps": 4,
            "num_ctas": 1,
            "num_stages": 4,
            "max_nreg": null
          }
        }
      },
      "256": {
        "1024": {
          "16": {
            "block_m": 16,
            "block_n": 16,
            "block_k": 128,
            "split_k": 8,
            "num_warps": 8,
            "num_ctas": 1,
            "num_stages": 4,
            "max_nreg": null
          }
        },
        "2048": {
          "16": {
            "block_m": 16,
            "block_n": 16,
            "block_k": 256,
            "split_k": 8,
            "num_warps": 4,
            "num_ctas": 1,
            "num_stages": 2,
            "max_nreg": null
          }
        },
        "4096": {
          "16": {
            "block_m": 32,
            "block_n": 16,
            "block_k": 256,
            "split_k": 8,
            "num_warps": 4,
            "num_ctas": 1,
            "num_stages": 4,
            "max_nreg": null
          }
        },
        "8192": {
          "16": {
            "block_m": 64,
            "block_n": 16,
            "block_k": 256,
            "split_k": 32,
            "num_warps": 8,
            "num_ctas": 1,
            "num_stages": 2,
            "max_nreg": null
          }
        },
        "12288": {
          "16": {
            "block_m": 32,
            "block_n": 16,
            "block_k": 64,
            "split_k": 32,
            "num_warps": 8,
            "num_ctas": 1,
            "num_stages": 4,
            "max_nreg": null
          }
        },
        "16384": {
          "16": {
            "block_m": 64,
            "block_n": 16,
            "block_k": 256,
            "split_k": 32,
            "num_warps": 8,
            "num_ctas": 1,
            "num_stages": 2,
            "max_nreg": null
          }
        },
        "24576": {
          "16": {
            "block_m": 32,
            "block_n": 16,
            "block_k": 128,
            "split_k": 32,
            "num_warps": 4,
            "num_ctas": 1,
            "num_stages": 4,
            "max_nreg": null
          }
        },
        "32768": {
          "16": {
            "block_m": 32,
            "block_n": 16,
            "block_k": 128,
            "split_k": 32,
            "num_warps": 4,
            "num_ctas": 1,
            "num_stages": 4,
            "max_nreg": null
          }
        }
      },
      "320": {
        "1024": {
          "16": {
            "block_m": 16,
            "block_n": 16,
            "block_k": 64,
            "split_k": 8,
            "num_warps": 4,
            "num_ctas": 1,
            "num_stages": 4,
            "max_nreg": null
          }
        },
        "2048": {
          "16": {
            "block_m": 32,
            "block_n": 16,
            "block_k": 64,
            "split_k": 8,
            "num_warps": 8,
            "num_ctas": 1,
            "num_stages": 4,
            "max_nreg": null
          }
        },
        "4096": {
          "16": {
            "block_m": 32,
            "block_n": 16,
            "block_k": 128,
            "split_k": 8,
            "num_warps": 8,
            "num_ctas": 1,
            "num_stages": 4,
            "max_nreg": null
          }
        },
        "8192": {
          "16": {
            "block_m": 32,
            "block_n": 16,
            "block_k": 64,
            "split_k": 32,
            "num_warps": 4,
            "num_ctas": 1,
            "num_stages": 4,
            "max_nreg": null
          }
        },
        "12288": {
          "16": {
            "block_m": 32,
            "block_n": 16,
            "block_k": 64,
            "split_k": 32,
            "num_warps": 4,
            "num_ctas": 1,
            "num_stages": 4,
            "max_nreg": null
          }
        },
        "16384": {
          "16": {
            "block_m": 32,
            "block_n": 16,
            "block_k": 64,
            "split_k": 32,
            "num_warps": 4,
            "num_ctas": 1,
            "num_stages": 4,
            "max_nreg": null
          }
        },
        "24576": {
          "16": {
            "block_m": 64,
            "block_n": 16,
            "block_k": 128,
            "split_k": 32,
            "num_warps": 8,
            "num_ctas": 1,
            "num_stages": 4,
            "max_nreg": null
          }
        },
        "32768": {
          "16": {
            "block_m": 64,
            "block_n": 16,
            "block_k": 128,
            "split_k": 32,
            "num_warps": 8,
            "num_ctas": 1,
            "num_stages": 4,
            "max_nreg": null
          }
        }
      },
      "384": {
        "1024": {
          "16": {
            "block_m": 32,
            "block_n": 16,
            "block_k": 128,
            "split_k": 8,
            "num_warps": 8,
            "num_ctas": 1,
            "num_stages": 2,
            "max_nreg": null
          }
        },
        "2048": {
          "16": {
            "block_m": 16,
            "block_n": 16,
            "block_k": 128,
            "split_k": 8,
            "num_warps": 4,
            "num_ctas": 1,
            "num_stages": 4,
            "max_nreg": null
          }
        },
        "4096": {
          "16": {
            "block_m": 32,
            "block_n": 16,
            "block_k": 128,
            "split_k": 8,
            "num_warps": 8,
            "num_ctas": 1,
            "num_stages": 4,
            "max_nreg": null
          }
        },
        "8192": {
          "16": {
            "block_m": 64,
            "block_n": 16,
            "block_k": 128,
            "split_k": 32,
            "num_warps": 8,
            "num_ctas": 1,
            "num_stages": 4,
            "max_nreg": null
          }
        },
        "12288": {
          "16": {
            "block_m": 64,
            "block_n": 16,
            "block_k": 128,
            "split_k": 32,
            "num_warps": 8,
            "num_ctas": 1,
            "num_stages": 4,
            "max_nreg": null
          }
        },
        "16384": {
          "16": {
            "block_m": 32,
            "block_n": 16,
            "block_k": 64,
            "split_k": 32,
            "num_warps": 4,
            "num_ctas": 1,
            "num_stages": 4,
            "max_nreg": null
          }
        },
        "24576": {
          "16": {
            "block_m": 32,
            "block_n": 16,
            "block_k": 64,
            "split_k": 32,
            "num_warps": 4,
            "num_ctas": 1,
            "num_stages": 4,
            "max_nreg": null
          }
        },
        "32768": {
          "16": {
            "block_m": 64,
            "block_n": 16,
            "block_k": 128,
            "split_k": 32,
            "num_warps": 8,
            "num_ctas": 1,
            "num_stages": 4,
            "max_nreg": null
          }
        }
      },
      "448": {
        "1024": {
          "16": {
            "block_m": 32,
            "block_n": 16,
            "block_k": 128,
            "split_k": 8,
            "num_warps": 8,
            "num_ctas": 1,
            "num_stages": 4,
            "max_nreg": null
          }
        },
        "2048": {
          "16": {
            "block_m": 32,
            "block_n": 16,
            "block_k": 128,
            "split_k": 8,
            "num_warps": 8,
            "num_ctas": 1,
            "num_stages": 4,
            "max_nreg": null
          }
        },
        "4096": {
          "16": {
            "block_m": 64,
            "block_n": 16,
            "block_k": 512,
            "split_k": 8,
            "num_warps": 8,
            "num_ctas": 1,
            "num_stages": 2,
            "max_nreg": null
          }
        },
        "8192": {
          "16": {
            "block_m": 64,
            "block_n": 16,
            "block_k": 512,
            "split_k": 8,
            "num_warps": 8,
            "num_ctas": 1,
            "num_stages": 2,
            "max_nreg": null
          }
        },
        "12288": {
          "16": {
            "block_m": 64,
            "block_n": 16,
            "block_k": 512,
            "split_k": 8,
            "num_warps": 8,
            "num_ctas": 1,
            "num_stages": 2,
            "max_nreg": null
          }
        },
        "16384": {
          "16": {
            "block_m": 64,
            "block_n": 16,
            "block_k": 512,
            "split_k": 8,
            "num_warps": 8,
            "num_ctas": 1,
            "num_stages": 2,
            "max_nreg": null
          }
        },
        "24576": {
          "16": {
            "block_m": 128,
            "block_n": 16,
            "block_k": 128,
            "split_k": 32,
            "num_warps": 8,
            "num_ctas": 1,
            "num_stages": 2,
            "max_nreg": null
          }
        },
        "32768": {
          "16": {
            "block_m": 128,
            "block_n": 16,
            "block_k": 128,
            "split_k": 32,
            "num_warps": 4,
            "num_ctas": 1,
            "num_stages": 2,
            "max_nreg": null
          }
        }
      },
      "512": {
        "1024": {
          "16": {
            "block_m": 32,
            "block_n": 16,
            "block_k": 128,
            "split_k": 8,
            "num_warps": 8,
            "num_ctas": 1,
            "num_stages": 4,
            "max_nreg": null
          }
        },
        "2048": {
          "16": {
            "block_m": 16,
            "block_n": 16,
            "block_k": 128,
            "split_k": 8,
            "num_warps": 4,
            "num_ctas": 1,
            "num_stages": 4,
            "max_nreg": null
          }
        },
        "4096": {
          "16": {
            "block_m": 32,
            "block_n": 16,
            "block_k": 128,
            "split_k": 8,
            "num_warps": 8,
            "num_ctas": 1,
            "num_stages": 4,
            "max_nreg": null
          }
        },
        "8192": {
          "16": {
            "block_m": 32,
            "block_n": 16,
            "block_k": 256,
            "split_k": 8,
            "num_warps": 4,
            "num_ctas": 1,
            "num_stages": 4,
            "max_nreg": null
          }
        },
        "12288": {
          "16": {
            "block_m": 64,
            "block_n": 16,
            "block_k": 512,
            "split_k": 8,
            "num_warps": 8,
            "num_ctas": 1,
            "num_stages": 2,
            "max_nreg": null
          }
        },
        "16384": {
          "16": {
            "block_m": 32,
            "block_n": 16,
            "block_k": 256,
            "split_k": 8,
            "num_warps": 4,
            "num_ctas": 1,
            "num_stages": 4,
            "max_nreg": null
          }
        },
        "24576": {
          "16": {
            "block_m": 32,
            "block_n": 16,
            "block_k": 256,
            "split_k": 8,
            "num_warps": 4,
            "num_ctas": 1,
            "num_stages": 4,
            "max_nreg": null
          }
        },
        "32768": {
          "16": {
            "block_m": 32,
            "block_n": 16,
            "block_k": 256,
            "split_k": 8,
            "num_warps": 4,
            "num_ctas": 1,
            "num_stages": 4,
            "max_nreg": null
          }
        }
      },
      "640": {
        "1024": {
          "16": {
            "block_m": 32,
            "block_n": 16,
            "block_k": 64,
            "split_k": 8,
            "num_warps": 8,
            "num_ctas": 1,
            "num_stages": 2,
            "max_nreg": null
          }
        },
        "2048": {
          "16": {
            "block_m": 64,
            "block_n": 16,
            "block_k": 256,
            "split_k": 8,
            "num_warps": 8,
            "num_ctas": 1,
            "num_stages": 2,
            "max_nreg": null
          }
        },
        "4096": {
          "16": {
            "block_m": 32,
            "block_n": 16,
            "block_k": 128,
            "split_k": 8,
            "num_warps": 4,
            "num_ctas": 1,
            "num_stages": 2,
            "max_nreg": null
          }
        },
        "8192": {
          "16": {
            "block_m": 32,
            "block_n": 16,
            "block_k": 128,
            "split_k": 8,
            "num_warps": 4,
            "num_ctas": 1,
            "num_stages": 4,
            "max_nreg": null
          }
        },
        "12288": {
          "16": {
            "block_m": 32,
            "block_n": 16,
            "block_k": 128,
            "split_k": 8,
            "num_warps": 4,
            "num_ctas": 1,
            "num_stages": 4,
            "max_nreg": null
          }
        },
        "16384": {
          "16": {
            "block_m": 32,
            "block_n": 16,
            "block_k": 128,
            "split_k": 8,
            "num_warps": 4,
            "num_ctas": 1,
            "num_stages": 4,
            "max_nreg": null
          }
        },
        "24576": {
          "16": {
            "block_m": 64,
            "block_n": 16,
            "block_k": 64,
            "split_k": 32,
            "num_warps": 8,
            "num_ctas": 1,
            "num_stages": 4,
            "max_nreg": null
          }
        },
        "32768": {
          "16": {
            "block_m": 128,
            "block_n": 16,
            "block_k": 128,
            "split_k": 32,
            "num_warps": 8,
            "num_ctas": 1,
            "num_stages": 2,
            "max_nreg": null
          }
        }
      },
      "768": {
        "1024": {
          "16": {
            "block_m": 64,
            "block_n": 16,
            "block_k": 128,
            "split_k": 8,
            "num_warps": 8,
            "num_ctas": 1,
            "num_stages": 4,
            "max_nreg": null
          }
        },
        "2048": {
          "16": {
            "block_m": 64,
            "block_n": 16,
            "block_k": 256,
            "split_k": 8,
            "num_warps": 8,
            "num_ctas": 1,
            "num_stages": 2,
            "max_nreg": null
          }
        },
        "4096": {
          "16": {
            "block_m": 32,
            "block_n": 16,
            "block_k": 64,
            "split_k": 8,
            "num_warps": 4,
            "num_ctas": 1,
            "num_stages": 4,
            "max_nreg": null
          }
        },
        "8192": {
          "16": {
            "block_m": 32,
            "block_n": 16,
            "block_k": 128,
            "split_k": 8,
            "num_warps": 4,
            "num_ctas": 1,
            "num_stages": 4,
            "max_nreg": null
          }
        },
        "12288": {
          "16": {
            "block_m": 32,
            "block_n": 16,
            "block_k": 128,
            "split_k": 8,
            "num_warps": 4,
            "num_ctas": 1,
            "num_stages": 4,
            "max_nreg": null
          }
        },
        "16384": {
          "16": {
            "block_m": 32,
            "block_n": 16,
            "block_k": 128,
            "split_k": 8,
            "num_warps": 4,
            "num_ctas": 1,
            "num_stages": 4,
            "max_nreg": null
          }
        },
        "24576": {
          "16": {
            "block_m": 128,
            "block_n": 16,
            "block_k": 128,
            "split_k": 32,
            "num_warps": 8,
            "num_ctas": 1,
            "num_stages": 2,
            "max_nreg": null
          }
        },
        "32768": {
          "16": {
            "block_m": 128,
            "block_n": 16,
            "block_k": 128,
            "split_k": 32,
            "num_warps": 8,
            "num_ctas": 1,
            "num_stages": 2,
            "max_nreg": null
          }
        }
      },
      "896": {
        "1024": {
          "16": {
            "block_m": 16,
            "block_n": 16,
            "block_k": 64,
            "split_k": 8,
            "num_warps": 4,
            "num_ctas": 1,
            "num_stages": 2,
            "max_nreg": null
          }
        },
        "2048": {
          "16": {
            "block_m": 64,
            "block_n": 16,
            "block_k": 256,
            "split_k": 8,
            "num_warps": 8,
            "num_ctas": 1,
            "num_stages": 2,
            "max_nreg": null
          }
        },
        "4096": {
          "16": {
            "block_m": 32,
            "block_n": 16,
            "block_k": 128,
            "split_k": 8,
            "num_warps": 4,
            "num_ctas": 1,
            "num_stages": 2,
            "max_nreg": null
          }
        },
        "8192": {
          "16": {
            "block_m": 32,
            "block_n": 16,
            "block_k": 128,
            "split_k": 8,
            "num_warps": 4,
            "num_ctas": 1,
            "num_stages": 2,
            "max_nreg": null
          }
        },
        "12288": {
          "16": {
            "block_m": 32,
            "block_n": 16,
            "block_k": 128,
            "split_k": 8,
            "num_warps": 4,
            "num_ctas": 1,
            "num_stages": 4,
            "max_nreg": null
          }
        },
        "16384": {
          "16": {
            "block_m": 32,
            "block_n": 16,
            "block_k": 128,
            "split_k": 8,
            "num_warps": 4,
            "num_ctas": 1,
            "num_stages": 4,
            "max_nreg": null
          }
        },
        "24576": {
          "16": {
            "block_m": 32,
            "block_n": 16,
            "block_k": 128,
            "split_k": 8,
            "num_warps": 4,
            "num_ctas": 1,
            "num_stages": 4,
            "max_nreg": null
          }
        },
        "32768": {
          "16": {
            "block_m": 32,
            "block_n": 16,
            "block_k": 128,
            "split_k": 8,
            "num_warps": 4,
            "num_ctas": 1,
            "num_stages": 4,
            "max_nreg": null
          }
        }
      },
      "1024": {
        "1024": {
          "16": {
            "block_m": 32,
            "block_n": 16,
            "block_k": 64,
            "split_k": 8,
            "num_warps": 8,
            "num_ctas": 1,
            "num_stages": 4,
            "max_nreg": null
          }
        },
        "2048": {
          "16": {
            "block_m": 32,
            "block_n": 16,
            "block_k": 128,
            "split_k": 8,
            "num_warps": 4,
            "num_ctas": 1,
            "num_stages": 2,
            "max_nreg": null
          }
        },
        "4096": {
          "16": {
            "block_m": 32,
            "block_n": 16,
            "block_k": 128,
            "split_k": 8,
            "num_warps": 4,
            "num_ctas": 1,
            "num_stages": 2,
            "max_nreg": null
          }
        },
        "8192": {
          "16": {
            "block_m": 32,
            "block_n": 16,
            "block_k": 128,
            "split_k": 8,
            "num_warps": 4,
            "num_ctas": 1,
            "num_stages": 4,
            "max_nreg": null
          }
        },
        "12288": {
          "16": {
            "block_m": 32,
            "block_n": 16,
            "block_k": 128,
            "split_k": 8,
            "num_warps": 4,
            "num_ctas": 1,
            "num_stages": 4,
            "max_nreg": null
          }
        },
        "16384": {
          "16": {
            "block_m": 32,
            "block_n": 16,
            "block_k": 128,
            "split_k": 8,
            "num_warps": 4,
            "num_ctas": 1,
            "num_stages": 4,
            "max_nreg": null
          }
        },
        "24576": {
          "16": {
            "block_m": 32,
            "block_n": 16,
            "block_k": 128,
            "split_k": 8,
            "num_warps": 4,
            "num_ctas": 1,
            "num_stages": 4,
            "max_nreg": null
          }
        },
        "32768": {
          "16": {
            "block_m": 32,
            "block_n": 16,
            "block_k": 128,
            "split_k": 8,
            "num_warps": 4,
            "num_ctas": 1,
            "num_stages": 4,
            "max_nreg": null
          }
        }
      },
      "2048": {
        "1024": {
          "16": {
            "block_m": 64,
            "block_n": 16,
            "block_k": 64,
            "split_k": 8,
            "num_warps": 8,
            "num_ctas": 1,
            "num_stages": 4,
            "max_nreg": null
          }
        },
        "2048": {
          "16": {
            "block_m": 64,
            "block_n": 16,
            "block_k": 64,
            "split_k": 8,
            "num_warps": 8,
            "num_ctas": 1,
            "num_stages": 4,
            "max_nreg": null
          }
        },
        "4096": {
          "16": {
            "block_m": 64,
            "block_n": 16,
            "block_k": 128,
            "split_k": 8,
            "num_warps": 4,
            "num_ctas": 1,
            "num_stages": 2,
            "max_nreg": null
          }
        },
        "8192": {
          "16": {
            "block_m": 128,
            "block_n": 16,
            "block_k": 128,
            "split_k": 8,
            "num_warps": 4,
            "num_ctas": 1,
            "num_stages": 2,
            "max_nreg": null
          }
        },
        "12288": {
          "16": {
            "block_m": 64,
            "block_n": 16,
            "block_k": 64,
            "split_k": 8,
            "num_warps": 8,
            "num_ctas": 1,
            "num_stages": 4,
            "max_nreg": null
          }
        },
        "16384": {
          "16": {
            "block_m": 128,
            "block_n": 16,
            "block_k": 128,
            "split_k": 8,
            "num_warps": 4,
            "num_ctas": 1,
            "num_stages": 2,
            "max_nreg": null
          }
        },
        "24576": {
          "16": {
            "block_m": 128,
            "block_n": 16,
            "block_k": 128,
            "split_k": 8,
            "num_warps": 4,
            "num_ctas": 1,
            "num_stages": 2,
            "max_nreg": null
          }
        },
        "32768": {
          "16": {
            "block_m": 128,
            "block_n": 16,
            "block_k": 128,
            "split_k": 8,
            "num_warps": 4,
            "num_ctas": 1,
            "num_stages": 2,
            "max_nreg": null
          }
        }
      },
      "3072": {
        "1024": {
          "16": {
            "block_m": 128,
            "block_n": 16,
            "block_k": 128,
            "split_k": 8,
            "num_warps": 8,
            "num_ctas": 1,
            "num_stages": 2,
            "max_nreg": null
          }
        },
        "2048": {
          "16": {
            "block_m": 64,
            "block_n": 16,
            "block_k": 32,
            "split_k": 8,
            "num_warps": 8,
            "num_ctas": 1,
            "num_stages": 4,
            "max_nreg": null
          }
        },
        "4096": {
          "16": {
            "block_m": 128,
            "block_n": 16,
            "block_k": 128,
            "split_k": 8,
            "num_warps": 8,
            "num_ctas": 1,
            "num_stages": 2,
            "max_nreg": null
          }
        },
        "8192": {
          "16": {
            "block_m": 128,
            "block_n": 16,
            "block_k": 128,
            "split_k": 8,
            "num_warps": 4,
            "num_ctas": 1,
            "num_stages": 2,
            "max_nreg": null
          }
        },
        "12288": {
          "16": {
            "block_m": 128,
            "block_n": 16,
            "block_k": 128,
            "split_k": 8,
            "num_warps": 4,
            "num_ctas": 1,
            "num_stages": 2,
            "max_nreg": null
          }
        },
        "16384": {
          "16": {
            "block_m": 128,
            "block_n": 16,
            "block_k": 128,
            "split_k": 8,
            "num_warps": 4,
            "num_ctas": 1,
            "num_stages": 2,
            "max_nreg": null
          }
        },
        "24576": {
          "16": {
            "block_m": 128,
            "block_n": 16,
            "block_k": 128,
            "split_k": 8,
            "num_warps": 4,
            "num_ctas": 1,
            "num_stages": 2,
            "max_nreg": null
          }
        },
        "32768": {
          "16": {
            "block_m": 128,
            "block_n": 16,
            "block_k": 128,
            "split_k": 8,
            "num_warps": 4,
            "num_ctas": 1,
            "num_stages": 2,
            "max_nreg": null
          }
        }
      },
      "4096": {
        "1024": {
          "16": {
            "block_m": 128,
            "block_n": 16,
            "block_k": 64,
            "split_k": 8,
            "num_warps": 8,
            "num_ctas": 1,
            "num_stages": 2,
            "max_nreg": null
          }
        },
        "2048": {
          "16": {
            "block_m": 128,
            "block_n": 16,
            "block_k": 64,
            "split_k": 8,
            "num_warps": 8,
            "num_ctas": 1,
            "num_stages": 2,
            "max_nreg": null
          }
        },
        "4096": {
          "16": {
            "block_m": 64,
            "block_n": 16,
            "block_k": 64,
            "split_k": 8,
            "num_warps": 4,
            "num_ctas": 1,
            "num_stages": 2,
            "max_nreg": null
          }
        },
        "8192": {
          "16": {
            "block_m": 64,
            "block_n": 16,
            "block_k": 32,
            "split_k": 8,
            "num_warps": 4,
            "num_ctas": 1,
            "num_stages": 4,
            "max_nreg": null
          }
        },
        "12288": {
          "16": {
            "block_m": 128,
            "block_n": 16,
            "block_k": 32,
            "split_k": 8,
            "num_warps": 8,
            "num_ctas": 1,
            "num_stages": 4,
            "max_nreg": null
          }
        },
        "16384": {
          "16": {
            "block_m": 64,
            "block_n": 16,
            "block_k": 32,
            "split_k": 8,
            "num_warps": 4,
            "num_ctas": 1,
            "num_stages": 4,
            "max_nreg": null
          }
        },
        "24576": {
          "16": {
            "block_m": 64,
            "block_n": 16,
            "block_k": 32,
            "split_k": 8,
            "num_warps": 4,
            "num_ctas": 1,
            "num_stages": 4,
            "max_nreg": null
          }
        },
        "32768": {
          "16": {
            "block_m": 64,
            "block_n": 16,
            "block_k": 32,
            "split_k": 8,
            "num_warps": 4,
            "num_ctas": 1,
            "num_stages": 4,
            "max_nreg": null
          }
        }
      },
      "5120": {
        "1024": {
          "16": {
            "block_m": 128,
            "block_n": 16,
            "block_k": 64,
            "split_k": 8,
            "num_warps": 8,
            "num_ctas": 1,
            "num_stages": 2,
            "max_nreg": null
          }
        },
        "2048": {
          "16": {
            "block_m": 128,
            "block_n": 16,
            "block_k": 64,
            "split_k": 8,
            "num_warps": 8,
            "num_ctas": 1,
            "num_stages": 2,
            "max_nreg": null
          }
        },
        "4096": {
          "16": {
            "block_m": 128,
            "block_n": 16,
            "block_k": 64,
            "split_k": 8,
            "num_warps": 8,
            "num_ctas": 1,
            "num_stages": 2,
            "max_nreg": null
          }
        },
        "8192": {
          "16": {
            "block_m": 64,
            "block_n": 16,
            "block_k": 32,
            "split_k": 8,
            "num_warps": 4,
            "num_ctas": 1,
            "num_stages": 4,
            "max_nreg": null
          }
        },
        "12288": {
          "16": {
            "block_m": 128,
            "block_n": 16,
            "block_k": 32,
            "split_k": 8,
            "num_warps": 8,
            "num_ctas": 1,
            "num_stages": 4,
            "max_nreg": null
          }
        },
        "16384": {
          "16": {
            "block_m": 128,
            "block_n": 16,
            "block_k": 32,
            "split_k": 8,
            "num_warps": 8,
            "num_ctas": 1,
            "num_stages": 4,
            "max_nreg": null
          }
        },
        "24576": {
          "16": {
            "block_m": 64,
            "block_n": 16,
            "block_k": 32,
            "split_k": 8,
            "num_warps": 4,
            "num_ctas": 1,
            "num_stages": 4,
            "max_nreg": null
          }
        },
        "32768": {
          "16": {
            "block_m": 64,
            "block_n": 16,
            "block_k": 32,
            "split_k": 8,
            "num_warps": 4,
            "num_ctas": 1,
            "num_stages": 4,
            "max_nreg": null
          }
        }
      },
      "6144": {
        "1024": {
          "16": {
            "block_m": 128,
            "block_n": 16,
            "block_k": 32,
            "split_k": 8,
            "num_warps": 8,
            "num_ctas": 1,
            "num_stages": 2,
            "max_nreg": null
          }
        },
        "2048": {
          "16": {
            "block_m": 128,
            "block_n": 16,
            "block_k": 32,
            "split_k": 8,
            "num_warps": 8,
            "num_ctas": 1,
            "num_stages": 4,
            "max_nreg": null
          }
        },
        "4096": {
          "16": {
            "block_m": 128,
            "block_n": 16,
            "block_k": 32,
            "split_k": 8,
            "num_warps": 8,
            "num_ctas": 1,
            "num_stages": 4,
            "max_nreg": null
          }
        },
        "8192": {
          "16": {
            "block_m": 128,
            "block_n": 16,
            "block_k": 32,
            "split_k": 8,
            "num_warps": 8,
            "num_ctas": 1,
            "num_stages": 4,
            "max_nreg": null
          }
        },
        "12288": {
          "16": {
            "block_m": 128,
            "block_n": 16,
            "block_k": 32,
            "split_k": 8,
            "num_warps": 8,
            "num_ctas": 1,
            "num_stages": 4,
            "max_nreg": null
          }
        },
        "16384": {
          "16": {
            "block_m": 128,
            "block_n": 16,
            "block_k": 32,
            "split_k": 8,
            "num_warps": 8,
            "num_ctas": 1,
            "num_stages": 4,
            "max_nreg": null
          }
        },
        "24576": {
          "16": {
            "block_m": 128,
            "block_n": 16,
            "block_k": 32,
            "split_k": 8,
            "num_warps": 8,
            "num_ctas": 1,
            "num_stages": 4,
            "max_nreg": null
          }
        },
        "32768": {
          "16": {
            "block_m": 128,
            "block_n": 16,
            "block_k": 32,
            "split_k": 8,
            "num_warps": 8,
            "num_ctas": 1,
            "num_stages": 4,
            "max_nreg": null
          }
        }
      },
      "7168": {
        "1024": {
          "16": {
            "block_m": 64,
            "block_n": 16,
            "block_k": 64,
            "split_k": 8,
            "num_warps": 8,
            "num_ctas": 1,
            "num_stages": 2,
            "max_nreg": null
          }
        },
        "2048": {
          "16": {
            "block_m": 64,
            "block_n": 16,
            "block_k": 64,
            "split_k": 8,
            "num_warps": 8,
            "num_ctas": 1,
            "num_stages": 2,
            "max_nreg": null
          }
        },
        "4096": {
          "16": {
            "block_m": 128,
            "block_n": 16,
            "block_k": 32,
            "split_k": 8,
            "num_warps": 4,
            "num_ctas": 1,
            "num_stages": 2,
            "max_nreg": null
          }
        },
        "8192": {
          "16": {
            "block_m": 128,
            "block_n": 16,
            "block_k": 32,
            "split_k": 8,
            "num_warps": 4,
            "num_ctas": 1,
            "num_stages": 2,
            "max_nreg": null
          }
        },
        "12288": {
          "16": {
            "block_m": 128,
            "block_n": 16,
            "block_k": 32,
            "split_k": 8,
            "num_warps": 4,
            "num_ctas": 1,
            "num_stages": 2,
            "max_nreg": null
          }
        },
        "16384": {
          "16": {
            "block_m": 128,
            "block_n": 16,
            "block_k": 32,
            "split_k": 8,
            "num_warps": 4,
            "num_ctas": 1,
            "num_stages": 2,
            "max_nreg": null
          }
        },
        "24576": {
          "16": {
            "block_m": 128,
            "block_n": 16,
            "block_k": 32,
            "split_k": 8,
            "num_warps": 4,
            "num_ctas": 1,
            "num_stages": 2,
            "max_nreg": null
          }
        },
        "32768": {
          "16": {
            "block_m": 128,
            "block_n": 16,
            "block_k": 32,
            "split_k": 8,
            "num_warps": 4,
            "num_ctas": 1,
            "num_stages": 2,
            "max_nreg": null
          }
        }
      },
      "8192": {
        "1024": {
          "16": {
            "block_m": 64,
            "block_n": 16,
            "block_k": 64,
            "split_k": 8,
            "num_warps": 8,
            "num_ctas": 1,
            "num_stages": 2,
            "max_nreg": null
          }
        },
        "2048": {
          "16": {
            "block_m": 128,
            "block_n": 16,
            "block_k": 64,
            "split_k": 8,
            "num_warps": 8,
            "num_ctas": 1,
            "num_stages": 2,
            "max_nreg": null
          }
        },
        "4096": {
          "16": {
            "block_m": 256,
            "block_n": 16,
            "block_k": 32,
            "split_k": 8,
            "num_warps": 8,
            "num_ctas": 1,
            "num_stages": 2,
            "max_nreg": null
          }
        },
        "8192": {
          "16": {
            "block_m": 128,
            "block_n": 16,
            "block_k": 32,
            "split_k": 8,
            "num_warps": 4,
            "num_ctas": 1,
            "num_stages": 2,
            "max_nreg": null
          }
        },
        "12288": {
          "16": {
            "block_m": 256,
            "block_n": 16,
            "block_k": 32,
            "split_k": 8,
            "num_warps": 8,
            "num_ctas": 1,
            "num_stages": 2,
            "max_nreg": null
          }
        },
        "16384": {
          "16": {
            "block_m": 256,
            "block_n": 16,
            "block_k": 32,
            "split_k": 8,
            "num_warps": 8,
            "num_ctas": 1,
            "num_stages": 2,
            "max_nreg": null
          }
        },
        "24576": {
          "16": {
            "block_m": 128,
            "block_n": 16,
            "block_k": 32,
            "split_k": 8,
            "num_warps": 4,
            "num_ctas": 1,
            "num_stages": 2,
            "max_nreg": null
          }
        },
        "32768": {
          "16": {
            "block_m": 256,
            "block_n": 16,
            "block_k": 32,
            "split_k": 8,
            "num_warps": 8,
            "num_ctas": 1,
            "num_stages": 2,
            "max_nreg": null
          }
        }
      }
    },
    "3": {
      "1": {
        "1024": {
          "16": {
            "block_m": 16,
            "block_n": 16,
            "block_k": 32,
            "split_k": 32,
            "num_warps": 8,
            "num_ctas": 1,
            "num_stages": 4,
            "max_nreg": null
          }
        },
        "2048": {
          "16": {
            "block_m": 16,
            "block_n": 16,
            "block_k": 64,
            "split_k": 32,
            "num_warps": 8,
            "num_ctas": 1,
            "num_stages": 4,
            "max_nreg": null
          }
        },
        "4096": {
          "16": {
            "block_m": 16,
            "block_n": 16,
            "block_k": 32,
            "split_k": 128,
            "num_warps": 8,
            "num_ctas": 1,
            "num_stages": 4,
            "max_nreg": null
          }
        },
        "8192": {
          "16": {
            "block_m": 16,
            "block_n": 16,
            "block_k": 32,
            "split_k": 128,
            "num_warps": 8,
            "num_ctas": 1,
            "num_stages": 4,
            "max_nreg": null
          }
        },
        "12288": {
          "16": {
            "block_m": 16,
            "block_n": 16,
            "block_k": 32,
            "split_k": 128,
            "num_warps": 8,
            "num_ctas": 1,
            "num_stages": 4,
            "max_nreg": null
          }
        },
        "16384": {
          "16": {
            "block_m": 16,
            "block_n": 16,
            "block_k": 64,
            "split_k": 128,
            "num_warps": 8,
            "num_ctas": 1,
            "num_stages": 4,
            "max_nreg": null
          }
        },
        "24576": {
          "16": {
            "block_m": 16,
            "block_n": 16,
            "block_k": 64,
            "split_k": 128,
            "num_warps": 4,
            "num_ctas": 1,
            "num_stages": 4,
            "max_nreg": null
          }
        },
        "32768": {
          "16": {
            "block_m": 16,
            "block_n": 16,
            "block_k": 64,
            "split_k": 128,
            "num_warps": 4,
            "num_ctas": 1,
            "num_stages": 4,
            "max_nreg": null
          }
        }
      },
      "16": {
        "1024": {
          "16": {
            "block_m": 16,
            "block_n": 16,
            "block_k": 32,
            "split_k": 32,
            "num_warps": 8,
            "num_ctas": 1,
            "num_stages": 4,
            "max_nreg": null
          }
        },
        "2048": {
          "16": {
            "block_m": 16,
            "block_n": 16,
            "block_k": 64,
            "split_k": 32,
            "num_warps": 8,
            "num_ctas": 1,
            "num_stages": 2,
            "max_nreg": null
          }
        },
        "4096": {
          "16": {
            "block_m": 16,
            "block_n": 16,
            "block_k": 64,
            "split_k": 64,
            "num_warps": 8,
            "num_ctas": 1,
            "num_stages": 2,
            "max_nreg": null
          }
        },
        "8192": {
          "16": {
            "block_m": 16,
            "block_n": 16,
            "block_k": 256,
            "split_k": 32,
            "num_warps": 4,
            "num_ctas": 1,
            "num_stages": 2,
            "max_nreg": null
          }
        },
        "12288": {
          "16": {
            "block_m": 16,
            "block_n": 16,
            "block_k": 32,
            "split_k": 128,
            "num_warps": 8,
            "num_ctas": 1,
            "num_stages": 4,
            "max_nreg": null
          }
        },
        "16384": {
          "16": {
            "block_m": 16,
            "block_n": 16,
            "block_k": 128,
            "split_k": 64,
            "num_warps": 8,
            "num_ctas": 1,
            "num_stages": 4,
            "max_nreg": null
          }
        },
        "24576": {
          "16": {
            "block_m": 16,
            "block_n": 16,
            "block_k": 128,
            "split_k": 64,
            "num_warps": 4,
            "num_ctas": 1,
            "num_stages": 4,
            "max_nreg": null
          }
        },
        "32768": {
          "16": {
            "block_m": 16,
            "block_n": 16,
            "block_k": 256,
            "split_k": 64,
            "num_warps": 4,
            "num_ctas": 1,
            "num_stages": 4,
            "max_nreg": null
          }
        }
      },
      "32": {
        "1024": {
          "16": {
            "block_m": 16,
            "block_n": 16,
            "block_k": 32,
            "split_k": 32,
            "num_warps": 8,
            "num_ctas": 1,
            "num_stages": 4,
            "max_nreg": null
          }
        },
        "2048": {
          "16": {
            "block_m": 16,
            "block_n": 16,
            "block_k": 64,
            "split_k": 32,
            "num_warps": 8,
            "num_ctas": 1,
            "num_stages": 4,
            "max_nreg": null
          }
        },
        "4096": {
          "16": {
            "block_m": 16,
            "block_n": 16,
            "block_k": 128,
            "split_k": 32,
            "num_warps": 8,
            "num_ctas": 1,
            "num_stages": 2,
            "max_nreg": null
          }
        },
        "8192": {
          "16": {
            "block_m": 16,
            "block_n": 16,
            "block_k": 64,
            "split_k": 64,
            "num_warps": 8,
            "num_ctas": 1,
            "num_stages": 4,
            "max_nreg": null
          }
        },
        "12288": {
          "16": {
            "block_m": 16,
            "block_n": 16,
            "block_k": 64,
            "split_k": 64,
            "num_warps": 8,
            "num_ctas": 1,
            "num_stages": 4,
            "max_nreg": null
          }
        },
        "16384": {
          "16": {
            "block_m": 16,
            "block_n": 16,
            "block_k": 128,
            "split_k": 64,
            "num_warps": 4,
            "num_ctas": 1,
            "num_stages": 4,
            "max_nreg": null
          }
        },
        "24576": {
          "16": {
            "block_m": 16,
            "block_n": 16,
            "block_k": 128,
            "split_k": 64,
            "num_warps": 4,
            "num_ctas": 1,
            "num_stages": 4,
            "max_nreg": null
          }
        },
        "32768": {
          "16": {
            "block_m": 16,
            "block_n": 16,
            "block_k": 128,
            "split_k": 64,
            "num_warps": 4,
            "num_ctas": 1,
            "num_stages": 4,
            "max_nreg": null
          }
        }
      },
      "64": {
        "1024": {
          "16": {
            "block_m": 16,
            "block_n": 16,
            "block_k": 128,
            "split_k": 8,
            "num_warps": 8,
            "num_ctas": 1,
            "num_stages": 4,
            "max_nreg": null
          }
        },
        "2048": {
          "16": {
            "block_m": 16,
            "block_n": 16,
            "block_k": 32,
            "split_k": 32,
            "num_warps": 8,
            "num_ctas": 1,
            "num_stages": 4,
            "max_nreg": null
          }
        },
        "4096": {
          "16": {
            "block_m": 16,
            "block_n": 16,
            "block_k": 32,
            "split_k": 32,
            "num_warps": 8,
            "num_ctas": 1,
            "num_stages": 4,
            "max_nreg": null
          }
        },
        "8192": {
          "16": {
            "block_m": 32,
            "block_n": 16,
            "block_k": 128,
            "split_k": 32,
            "num_warps": 8,
            "num_ctas": 1,
            "num_stages": 4,
            "max_nreg": null
          }
        },
        "12288": {
          "16": {
            "block_m": 16,
            "block_n": 16,
            "block_k": 128,
            "split_k": 32,
            "num_warps": 4,
            "num_ctas": 1,
            "num_stages": 4,
            "max_nreg": null
          }
        },
        "16384": {
          "16": {
            "block_m": 16,
            "block_n": 16,
            "block_k": 128,
            "split_k": 32,
            "num_warps": 4,
            "num_ctas": 1,
            "num_stages": 4,
            "max_nreg": null
          }
        },
        "24576": {
          "16": {
            "block_m": 16,
            "block_n": 16,
            "block_k": 64,
            "split_k": 64,
            "num_warps": 4,
            "num_ctas": 1,
            "num_stages": 4,
            "max_nreg": null
          }
        },
        "32768": {
          "16": {
            "block_m": 32,
            "block_n": 16,
            "block_k": 256,
            "split_k": 32,
            "num_warps": 4,
            "num_ctas": 1,
            "num_stages": 4,
            "max_nreg": null
          }
        }
      },
      "128": {
        "1024": {
          "16": {
            "block_m": 16,
            "block_n": 16,
            "block_k": 64,
            "split_k": 8,
            "num_warps": 8,
            "num_ctas": 1,
            "num_stages": 4,
            "max_nreg": null
          }
        },
        "2048": {
          "16": {
            "block_m": 16,
            "block_n": 16,
            "block_k": 256,
            "split_k": 8,
            "num_warps": 4,
            "num_ctas": 1,
            "num_stages": 2,
            "max_nreg": null
          }
        },
        "4096": {
          "16": {
            "block_m": 32,
            "block_n": 16,
            "block_k": 64,
            "split_k": 32,
            "num_warps": 8,
            "num_ctas": 1,
            "num_stages": 4,
            "max_nreg": null
          }
        },
        "8192": {
          "16": {
            "block_m": 32,
            "block_n": 16,
            "block_k": 64,
            "split_k": 32,
            "num_warps": 4,
            "num_ctas": 1,
            "num_stages": 4,
            "max_nreg": null
          }
        },
        "12288": {
          "16": {
            "block_m": 32,
            "block_n": 16,
            "block_k": 128,
            "split_k": 32,
            "num_warps": 4,
            "num_ctas": 1,
            "num_stages": 4,
            "max_nreg": null
          }
        },
        "16384": {
          "16": {
            "block_m": 32,
            "block_n": 16,
            "block_k": 128,
            "split_k": 32,
            "num_warps": 4,
            "num_ctas": 1,
            "num_stages": 4,
            "max_nreg": null
          }
        },
        "24576": {
          "16": {
            "block_m": 32,
            "block_n": 16,
            "block_k": 128,
            "split_k": 32,
            "num_warps": 4,
            "num_ctas": 1,
            "num_stages": 4,
            "max_nreg": null
          }
        },
        "32768": {
          "16": {
            "block_m": 32,
            "block_n": 16,
            "block_k": 128,
            "split_k": 32,
            "num_warps": 4,
            "num_ctas": 1,
            "num_stages": 4,
            "max_nreg": null
          }
        }
      },
      "192": {
        "1024": {
          "16": {
            "block_m": 16,
            "block_n": 16,
            "block_k": 64,
            "split_k": 8,
            "num_warps": 4,
            "num_ctas": 1,
            "num_stages": 4,
            "max_nreg": null
          }
        },
        "2048": {
          "16": {
            "block_m": 16,
            "block_n": 16,
            "block_k": 128,
            "split_k": 8,
            "num_warps": 4,
            "num_ctas": 1,
            "num_stages": 4,
            "max_nreg": null
          }
        },
        "4096": {
          "16": {
            "block_m": 64,
            "block_n": 16,
            "block_k": 512,
            "split_k": 8,
            "num_warps": 8,
            "num_ctas": 1,
            "num_stages": 2,
            "max_nreg": null
          }
        },
        "8192": {
          "16": {
            "block_m": 64,
            "block_n": 16,
            "block_k": 128,
            "split_k": 32,
            "num_warps": 8,
            "num_ctas": 1,
            "num_stages": 4,
            "max_nreg": null
          }
        },
        "12288": {
          "16": {
            "block_m": 64,
            "block_n": 16,
            "block_k": 128,
            "split_k": 32,
            "num_warps": 8,
            "num_ctas": 1,
            "num_stages": 4,
            "max_nreg": null
          }
        },
        "16384": {
          "16": {
            "block_m": 64,
            "block_n": 16,
            "block_k": 128,
            "split_k": 32,
            "num_warps": 8,
            "num_ctas": 1,
            "num_stages": 4,
            "max_nreg": null
          }
        },
        "24576": {
          "16": {
            "block_m": 32,
            "block_n": 16,
            "block_k": 64,
            "split_k": 32,
            "num_warps": 4,
            "num_ctas": 1,
            "num_stages": 4,
            "max_nreg": null
          }
        },
        "32768": {
          "16": {
            "block_m": 64,
            "block_n": 16,
            "block_k": 128,
            "split_k": 32,
            "num_warps": 8,
            "num_ctas": 1,
            "num_stages": 4,
            "max_nreg": null
          }
        }
      },
      "256": {
        "1024": {
          "16": {
            "block_m": 16,
            "block_n": 16,
            "block_k": 64,
            "split_k": 8,
            "num_warps": 4,
            "num_ctas": 1,
            "num_stages": 4,
            "max_nreg": null
          }
        },
        "2048": {
          "16": {
            "block_m": 16,
            "block_n": 16,
            "block_k": 64,
            "split_k": 8,
            "num_warps": 4,
            "num_ctas": 1,
            "num_stages": 4,
            "max_nreg": null
          }
        },
        "4096": {
          "16": {
            "block_m": 32,
            "block_n": 16,
            "block_k": 128,
            "split_k": 8,
            "num_warps": 4,
            "num_ctas": 1,
            "num_stages": 4,
            "max_nreg": null
          }
        },
        "8192": {
          "16": {
            "block_m": 32,
            "block_n": 16,
            "block_k": 256,
            "split_k": 8,
            "num_warps": 4,
            "num_ctas": 1,
            "num_stages": 4,
            "max_nreg": null
          }
        },
        "12288": {
          "16": {
            "block_m": 32,
            "block_n": 16,
            "block_k": 256,
            "split_k": 8,
            "num_warps": 4,
            "num_ctas": 1,
            "num_stages": 4,
            "max_nreg": null
          }
        },
        "16384": {
          "16": {
            "block_m": 64,
            "block_n": 16,
            "block_k": 128,
            "split_k": 32,
            "num_warps": 8,
            "num_ctas": 1,
            "num_stages": 2,
            "max_nreg": null
          }
        },
        "24576": {
          "16": {
            "block_m": 32,
            "block_n": 16,
            "block_k": 64,
            "split_k": 32,
            "num_warps": 4,
            "num_ctas": 1,
            "num_stages": 4,
            "max_nreg": null
          }
        },
        "32768": {
          "16": {
            "block_m": 64,
            "block_n": 16,
            "block_k": 128,
            "split_k": 32,
            "num_warps": 8,
            "num_ctas": 1,
            "num_stages": 4,
            "max_nreg": null
          }
        }
      },
      "320": {
        "1024": {
          "16": {
            "block_m": 32,
            "block_n": 16,
            "block_k": 128,
            "split_k": 8,
            "num_warps": 8,
            "num_ctas": 1,
            "num_stages": 4,
            "max_nreg": null
          }
        },
        "2048": {
          "16": {
            "block_m": 16,
            "block_n": 16,
            "block_k": 128,
            "split_k": 8,
            "num_warps": 4,
            "num_ctas": 1,
            "num_stages": 4,
            "max_nreg": null
          }
        },
        "4096": {
          "16": {
            "block_m": 64,
            "block_n": 16,
            "block_k": 512,
            "split_k": 8,
            "num_warps": 8,
            "num_ctas": 1,
            "num_stages": 2,
            "max_nreg": null
          }
        },
        "8192": {
          "16": {
            "block_m": 64,
            "block_n": 16,
            "block_k": 512,
            "split_k": 8,
            "num_warps": 8,
            "num_ctas": 1,
            "num_stages": 2,
            "max_nreg": null
          }
        },
        "12288": {
          "16": {
            "block_m": 64,
            "block_n": 16,
            "block_k": 512,
            "split_k": 8,
            "num_warps": 8,
            "num_ctas": 1,
            "num_stages": 2,
            "max_nreg": null
          }
        },
        "16384": {
          "16": {
            "block_m": 64,
            "block_n": 16,
            "block_k": 512,
            "split_k": 8,
            "num_warps": 8,
            "num_ctas": 1,
            "num_stages": 2,
            "max_nreg": null
          }
        },
        "24576": {
          "16": {
            "block_m": 32,
            "block_n": 16,
            "block_k": 256,
            "split_k": 8,
            "num_warps": 4,
            "num_ctas": 1,
            "num_stages": 4,
            "max_nreg": null
          }
        },
        "32768": {
          "16": {
            "block_m": 32,
            "block_n": 16,
            "block_k": 256,
            "split_k": 8,
            "num_warps": 4,
            "num_ctas": 1,
            "num_stages": 4,
            "max_nreg": null
          }
        }
      },
      "384": {
        "1024": {
          "16": {
            "block_m": 16,
            "block_n": 16,
            "block_k": 32,
            "split_k": 8,
            "num_warps": 4,
            "num_ctas": 1,
            "num_stages": 4,
            "max_nreg": null
          }
        },
        "2048": {
          "16": {
            "block_m": 32,
            "block_n": 16,
            "block_k": 128,
            "split_k": 8,
            "num_warps": 4,
            "num_ctas": 1,
            "num_stages": 4,
            "max_nreg": null
          }
        },
        "4096": {
          "16": {
            "block_m": 32,
            "block_n": 16,
            "block_k": 128,
            "split_k": 8,
            "num_warps": 4,
            "num_ctas": 1,
            "num_stages": 4,
            "max_nreg": null
          }
        },
        "8192": {
          "16": {
            "block_m": 32,
            "block_n": 16,
            "block_k": 128,
            "split_k": 8,
            "num_warps": 4,
            "num_ctas": 1,
            "num_stages": 4,
            "max_nreg": null
          }
        },
        "12288": {
          "16": {
            "block_m": 32,
            "block_n": 16,
            "block_k": 128,
            "split_k": 8,
            "num_warps": 4,
            "num_ctas": 1,
            "num_stages": 4,
            "max_nreg": null
          }
        },
        "16384": {
          "16": {
            "block_m": 32,
            "block_n": 16,
            "block_k": 128,
            "split_k": 8,
            "num_warps": 4,
            "num_ctas": 1,
            "num_stages": 4,
            "max_nreg": null
          }
        },
        "24576": {
          "16": {
            "block_m": 64,
            "block_n": 16,
            "block_k": 64,
            "split_k": 32,
            "num_warps": 8,
            "num_ctas": 1,
            "num_stages": 4,
            "max_nreg": null
          }
        },
        "32768": {
          "16": {
            "block_m": 64,
            "block_n": 16,
            "block_k": 128,
            "split_k": 32,
            "num_warps": 4,
            "num_ctas": 1,
            "num_stages": 2,
            "max_nreg": null
          }
        }
      },
      "448": {
        "1024": {
          "16": {
            "block_m": 32,
            "block_n": 16,
            "block_k": 64,
            "split_k": 8,
            "num_warps": 8,
            "num_ctas": 1,
            "num_stages": 2,
            "max_nreg": null
          }
        },
        "2048": {
          "16": {
            "block_m": 64,
            "block_n": 16,
            "block_k": 128,
            "split_k": 8,
            "num_warps": 8,
            "num_ctas": 1,
            "num_stages": 4,
            "max_nreg": null
          }
        },
        "4096": {
          "16": {
            "block_m": 64,
            "block_n": 16,
            "block_k": 256,
            "split_k": 8,
            "num_warps": 8,
            "num_ctas": 1,
            "num_stages": 2,
            "max_nreg": null
          }
        },
        "8192": {
          "16": {
            "block_m": 32,
            "block_n": 16,
            "block_k": 128,
            "split_k": 8,
            "num_warps": 4,
            "num_ctas": 1,
            "num_stages": 4,
            "max_nreg": null
          }
        },
        "12288": {
          "16": {
            "block_m": 32,
            "block_n": 16,
            "block_k": 128,
            "split_k": 8,
            "num_warps": 4,
            "num_ctas": 1,
            "num_stages": 4,
            "max_nreg": null
          }
        },
        "16384": {
          "16": {
            "block_m": 128,
            "block_n": 16,
            "block_k": 128,
            "split_k": 32,
            "num_warps": 8,
            "num_ctas": 1,
            "num_stages": 2,
            "max_nreg": null
          }
        },
        "24576": {
          "16": {
            "block_m": 128,
            "block_n": 16,
            "block_k": 128,
            "split_k": 32,
            "num_warps": 8,
            "num_ctas": 1,
            "num_stages": 2,
            "max_nreg": null
          }
        },
        "32768": {
          "16": {
            "block_m": 128,
            "block_n": 16,
            "block_k": 128,
            "split_k": 32,
            "num_warps": 8,
            "num_ctas": 1,
            "num_stages": 2,
            "max_nreg": null
          }
        }
      },
      "512": {
        "1024": {
          "16": {
            "block_m": 32,
            "block_n": 16,
            "block_k": 64,
            "split_k": 8,
            "num_warps": 8,
            "num_ctas": 1,
            "num_stages": 4,
            "max_nreg": null
          }
        },
        "2048": {
          "16": {
            "block_m": 64,
            "block_n": 16,
            "block_k": 256,
            "split_k": 8,
            "num_warps": 8,
            "num_ctas": 1,
            "num_stages": 2,
            "max_nreg": null
          }
        },
        "4096": {
          "16": {
            "block_m": 32,
            "block_n": 16,
            "block_k": 128,
            "split_k": 8,
            "num_warps": 4,
            "num_ctas": 1,
            "num_stages": 4,
            "max_nreg": null
          }
        },
        "8192": {
          "16": {
            "block_m": 32,
            "block_n": 16,
            "block_k": 128,
            "split_k": 8,
            "num_warps": 4,
            "num_ctas": 1,
            "num_stages": 2,
            "max_nreg": null
          }
        },
        "12288": {
          "16": {
            "block_m": 32,
            "block_n": 16,
            "block_k": 128,
            "split_k": 8,
            "num_warps": 4,
            "num_ctas": 1,
            "num_stages": 4,
            "max_nreg": null
          }
        },
        "16384": {
          "16": {
            "block_m": 32,
            "block_n": 16,
            "block_k": 128,
            "split_k": 8,
            "num_warps": 4,
            "num_ctas": 1,
            "num_stages": 4,
            "max_nreg": null
          }
        },
        "24576": {
          "16": {
            "block_m": 128,
            "block_n": 16,
            "block_k": 128,
            "split_k": 32,
            "num_warps": 8,
            "num_ctas": 1,
            "num_stages": 2,
            "max_nreg": null
          }
        },
        "32768": {
          "16": {
            "block_m": 128,
            "block_n": 16,
            "block_k": 128,
            "split_k": 32,
            "num_warps": 4,
            "num_ctas": 1,
            "num_stages": 2,
            "max_nreg": null
          }
        }
      },
      "640": {
        "1024": {
          "16": {
            "block_m": 32,
            "block_n": 16,
            "block_k": 64,
            "split_k": 8,
            "num_warps": 8,
            "num_ctas": 1,
            "num_stages": 2,
            "max_nreg": null
          }
        },
        "2048": {
          "16": {
            "block_m": 64,
            "block_n": 16,
            "block_k": 256,
            "split_k": 8,
            "num_warps": 8,
            "num_ctas": 1,
            "num_stages": 2,
            "max_nreg": null
          }
        },
        "4096": {
          "16": {
            "block_m": 32,
            "block_n": 16,
            "block_k": 128,
            "split_k": 8,
            "num_warps": 4,
            "num_ctas": 1,
            "num_stages": 4,
            "max_nreg": null
          }
        },
        "8192": {
          "16": {
            "block_m": 32,
            "block_n": 16,
            "block_k": 128,
            "split_k": 8,
            "num_warps": 4,
            "num_ctas": 1,
            "num_stages": 4,
            "max_nreg": null
          }
        },
        "12288": {
          "16": {
            "block_m": 32,
            "block_n": 16,
            "block_k": 128,
            "split_k": 8,
            "num_warps": 4,
            "num_ctas": 1,
            "num_stages": 4,
            "max_nreg": null
          }
        },
        "16384": {
          "16": {
            "block_m": 32,
            "block_n": 16,
            "block_k": 128,
            "split_k": 8,
            "num_warps": 4,
            "num_ctas": 1,
            "num_stages": 4,
            "max_nreg": null
          }
        },
        "24576": {
          "16": {
            "block_m": 32,
            "block_n": 16,
            "block_k": 128,
            "split_k": 8,
            "num_warps": 4,
            "num_ctas": 1,
            "num_stages": 4,
            "max_nreg": null
          }
        },
        "32768": {
          "16": {
            "block_m": 32,
            "block_n": 16,
            "block_k": 128,
            "split_k": 8,
            "num_warps": 4,
            "num_ctas": 1,
            "num_stages": 4,
            "max_nreg": null
          }
        }
      },
      "768": {
        "1024": {
          "16": {
            "block_m": 32,
            "block_n": 16,
            "block_k": 32,
            "split_k": 8,
            "num_warps": 8,
            "num_ctas": 1,
            "num_stages": 4,
            "max_nreg": null
          }
        },
        "2048": {
          "16": {
            "block_m": 64,
            "block_n": 16,
            "block_k": 128,
            "split_k": 8,
            "num_warps": 8,
            "num_ctas": 1,
            "num_stages": 4,
            "max_nreg": null
          }
        },
        "4096": {
          "16": {
            "block_m": 64,
            "block_n": 16,
            "block_k": 128,
            "split_k": 8,
            "num_warps": 8,
            "num_ctas": 1,
            "num_stages": 4,
            "max_nreg": null
          }
        },
        "8192": {
          "16": {
            "block_m": 32,
            "block_n": 16,
            "block_k": 64,
            "split_k": 8,
            "num_warps": 4,
            "num_ctas": 1,
            "num_stages": 4,
            "max_nreg": null
          }
        },
        "12288": {
          "16": {
            "block_m": 32,
            "block_n": 16,
            "block_k": 64,
            "split_k": 8,
            "num_warps": 4,
            "num_ctas": 1,
            "num_stages": 4,
            "max_nreg": null
          }
        },
        "16384": {
          "16": {
            "block_m": 32,
            "block_n": 16,
            "block_k": 64,
            "split_k": 8,
            "num_warps": 4,
            "num_ctas": 1,
            "num_stages": 4,
            "max_nreg": null
          }
        },
        "24576": {
          "16": {
            "block_m": 128,
            "block_n": 16,
            "block_k": 32,
            "split_k": 32,
            "num_warps": 8,
            "num_ctas": 1,
            "num_stages": 4,
            "max_nreg": null
          }
        },
        "32768": {
          "16": {
            "block_m": 64,
            "block_n": 16,
            "block_k": 32,
            "split_k": 32,
            "num_warps": 4,
            "num_ctas": 1,
            "num_stages": 4,
            "max_nreg": null
          }
        }
      },
      "896": {
        "1024": {
          "16": {
            "block_m": 64,
            "block_n": 16,
            "block_k": 128,
            "split_k": 8,
            "num_warps": 8,
            "num_ctas": 1,
            "num_stages": 4,
            "max_nreg": null
          }
        },
        "2048": {
          "16": {
            "block_m": 64,
            "block_n": 16,
            "block_k": 128,
            "split_k": 8,
            "num_warps": 8,
            "num_ctas": 1,
            "num_stages": 4,
            "max_nreg": null
          }
        },
        "4096": {
          "16": {
            "block_m": 32,
            "block_n": 16,
            "block_k": 64,
            "split_k": 8,
            "num_warps": 4,
            "num_ctas": 1,
            "num_stages": 4,
            "max_nreg": null
          }
        },
        "8192": {
          "16": {
            "block_m": 32,
            "block_n": 16,
            "block_k": 64,
            "split_k": 8,
            "num_warps": 4,
            "num_ctas": 1,
            "num_stages": 4,
            "max_nreg": null
          }
        },
        "12288": {
          "16": {
            "block_m": 32,
            "block_n": 16,
            "block_k": 64,
            "split_k": 8,
            "num_warps": 4,
            "num_ctas": 1,
            "num_stages": 4,
            "max_nreg": null
          }
        },
        "16384": {
          "16": {
            "block_m": 32,
            "block_n": 16,
            "block_k": 64,
            "split_k": 8,
            "num_warps": 4,
            "num_ctas": 1,
            "num_stages": 4,
            "max_nreg": null
          }
        },
        "24576": {
          "16": {
            "block_m": 64,
            "block_n": 16,
            "block_k": 128,
            "split_k": 8,
            "num_warps": 8,
            "num_ctas": 1,
            "num_stages": 4,
            "max_nreg": null
          }
        },
        "32768": {
          "16": {
            "block_m": 128,
            "block_n": 16,
            "block_k": 32,
            "split_k": 32,
            "num_warps": 8,
            "num_ctas": 1,
            "num_stages": 4,
            "max_nreg": null
          }
        }
      },
      "1024": {
        "1024": {
          "16": {
            "block_m": 64,
            "block_n": 16,
            "block_k": 64,
            "split_k": 8,
            "num_warps": 8,
            "num_ctas": 1,
            "num_stages": 4,
            "max_nreg": null
          }
        },
        "2048": {
          "16": {
            "block_m": 64,
            "block_n": 16,
            "block_k": 128,
            "split_k": 8,
            "num_warps": 8,
            "num_ctas": 1,
            "num_stages": 2,
            "max_nreg": null
          }
        },
        "4096": {
          "16": {
            "block_m": 64,
            "block_n": 16,
            "block_k": 128,
            "split_k": 8,
            "num_warps": 8,
            "num_ctas": 1,
            "num_stages": 4,
            "max_nreg": null
          }
        },
        "8192": {
          "16": {
            "block_m": 64,
            "block_n": 16,
            "block_k": 128,
            "split_k": 8,
            "num_warps": 8,
            "num_ctas": 1,
            "num_stages": 4,
            "max_nreg": null
          }
        },
        "12288": {
          "16": {
            "block_m": 64,
            "block_n": 16,
            "block_k": 128,
            "split_k": 8,
            "num_warps": 8,
            "num_ctas": 1,
            "num_stages": 4,
            "max_nreg": null
          }
        },
        "16384": {
          "16": {
            "block_m": 64,
            "block_n": 16,
            "block_k": 128,
            "split_k": 8,
            "num_warps": 8,
            "num_ctas": 1,
            "num_stages": 4,
            "max_nreg": null
          }
        },
        "24576": {
          "16": {
            "block_m": 64,
            "block_n": 16,
            "block_k": 128,
            "split_k": 8,
            "num_warps": 8,
            "num_ctas": 1,
            "num_stages": 4,
            "max_nreg": null
          }
        },
        "32768": {
          "16": {
            "block_m": 64,
            "block_n": 16,
            "block_k": 128,
            "split_k": 8,
            "num_warps": 8,
            "num_ctas": 1,
            "num_stages": 4,
            "max_nreg": null
          }
        }
      },
      "2048": {
        "1024": {
          "16": {
            "block_m": 128,
            "block_n": 16,
            "block_k": 128,
            "split_k": 8,
            "num_warps": 8,
            "num_ctas": 1,
            "num_stages": 2,
            "max_nreg": null
          }
        },
        "2048": {
          "16": {
            "block_m": 128,
            "block_n": 16,
            "block_k": 128,
            "split_k": 8,
            "num_warps": 8,
            "num_ctas": 1,
            "num_stages": 2,
            "max_nreg": null
          }
        },
        "4096": {
          "16": {
            "block_m": 128,
            "block_n": 16,
            "block_k": 128,
            "split_k": 8,
            "num_warps": 8,
            "num_ctas": 1,
            "num_stages": 2,
            "max_nreg": null
          }
        },
        "8192": {
          "16": {
            "block_m": 128,
            "block_n": 16,
            "block_k": 128,
            "split_k": 8,
            "num_warps": 4,
            "num_ctas": 1,
            "num_stages": 2,
            "max_nreg": null
          }
        },
        "12288": {
          "16": {
            "block_m": 128,
            "block_n": 16,
            "block_k": 128,
            "split_k": 8,
            "num_warps": 4,
            "num_ctas": 1,
            "num_stages": 2,
            "max_nreg": null
          }
        },
        "16384": {
          "16": {
            "block_m": 128,
            "block_n": 16,
            "block_k": 128,
            "split_k": 8,
            "num_warps": 4,
            "num_ctas": 1,
            "num_stages": 2,
            "max_nreg": null
          }
        },
        "24576": {
          "16": {
            "block_m": 128,
            "block_n": 16,
            "block_k": 128,
            "split_k": 8,
            "num_warps": 4,
            "num_ctas": 1,
            "num_stages": 2,
            "max_nreg": null
          }
        },
        "32768": {
          "16": {
            "block_m": 128,
            "block_n": 16,
            "block_k": 128,
            "split_k": 8,
            "num_warps": 4,
            "num_ctas": 1,
            "num_stages": 2,
            "max_nreg": null
          }
        }
      },
      "3072": {
        "1024": {
          "16": {
            "block_m": 128,
            "block_n": 16,
            "block_k": 64,
            "split_k": 8,
            "num_warps": 8,
            "num_ctas": 1,
            "num_stages": 2,
            "max_nreg": null
          }
        },
        "2048": {
          "16": {
            "block_m": 128,
            "block_n": 16,
            "block_k": 64,
            "split_k": 8,
            "num_warps": 8,
            "num_ctas": 1,
            "num_stages": 2,
            "max_nreg": null
          }
        },
        "4096": {
          "16": {
            "block_m": 128,
            "block_n": 16,
            "block_k": 64,
            "split_k": 8,
            "num_warps": 8,
            "num_ctas": 1,
            "num_stages": 2,
            "max_nreg": null
          }
        },
        "8192": {
          "16": {
            "block_m": 64,
            "block_n": 16,
            "block_k": 32,
            "split_k": 8,
            "num_warps": 4,
            "num_ctas": 1,
            "num_stages": 4,
            "max_nreg": null
          }
        },
        "12288": {
          "16": {
            "block_m": 128,
            "block_n": 16,
            "block_k": 32,
            "split_k": 8,
            "num_warps": 8,
            "num_ctas": 1,
            "num_stages": 4,
            "max_nreg": null
          }
        },
        "16384": {
          "16": {
            "block_m": 64,
            "block_n": 16,
            "block_k": 32,
            "split_k": 8,
            "num_warps": 4,
            "num_ctas": 1,
            "num_stages": 4,
            "max_nreg": null
          }
        },
        "24576": {
          "16": {
            "block_m": 64,
            "block_n": 16,
            "block_k": 32,
            "split_k": 8,
            "num_warps": 4,
            "num_ctas": 1,
            "num_stages": 4,
            "max_nreg": null
          }
        },
        "32768": {
          "16": {
            "block_m": 64,
            "block_n": 16,
            "block_k": 32,
            "split_k": 8,
            "num_warps": 4,
            "num_ctas": 1,
            "num_stages": 4,
            "max_nreg": null
          }
        }
      },
      "4096": {
        "1024": {
          "16": {
            "block_m": 128,
            "block_n": 16,
            "block_k": 32,
            "split_k": 8,
            "num_warps": 8,
            "num_ctas": 1,
            "num_stages": 4,
            "max_nreg": null
          }
        },
        "2048": {
          "16": {
            "block_m": 128,
            "block_n": 16,
            "block_k": 32,
            "split_k": 8,
            "num_warps": 8,
            "num_ctas": 1,
            "num_stages": 4,
            "max_nreg": null
          }
        },
        "4096": {
          "16": {
            "block_m": 128,
            "block_n": 16,
            "block_k": 32,
            "split_k": 8,
            "num_warps": 8,
            "num_ctas": 1,
            "num_stages": 4,
            "max_nreg": null
          }
        },
        "8192": {
          "16": {
            "block_m": 128,
            "block_n": 16,
            "block_k": 32,
            "split_k": 8,
            "num_warps": 8,
            "num_ctas": 1,
            "num_stages": 4,
            "max_nreg": null
          }
        },
        "12288": {
          "16": {
            "block_m": 128,
            "block_n": 16,
            "block_k": 32,
            "split_k": 8,
            "num_warps": 8,
            "num_ctas": 1,
            "num_stages": 4,
            "max_nreg": null
          }
        },
        "16384": {
          "16": {
            "block_m": 128,
            "block_n": 16,
            "block_k": 32,
            "split_k": 8,
            "num_warps": 8,
            "num_ctas": 1,
            "num_stages": 4,
            "max_nreg": null
          }
        },
        "24576": {
          "16": {
            "block_m": 128,
            "block_n": 16,
            "block_k": 32,
            "split_k": 8,
            "num_warps": 8,
            "num_ctas": 1,
            "num_stages": 4,
            "max_nreg": null
          }
        },
        "32768": {
          "16": {
            "block_m": 128,
            "block_n": 16,
            "block_k": 32,
            "split_k": 8,
            "num_warps": 8,
            "num_ctas": 1,
            "num_stages": 4,
            "max_nreg": null
          }
        }
      },
      "5120": {
        "1024": {
          "16": {
            "block_m": 64,
            "block_n": 16,
            "block_k": 64,
            "split_k": 8,
            "num_warps": 8,
            "num_ctas": 1,
            "num_stages": 4,
            "max_nreg": null
          }
        },
        "2048": {
          "16": {
            "block_m": 64,
            "block_n": 16,
            "block_k": 64,
            "split_k": 8,
            "num_warps": 8,
            "num_ctas": 1,
            "num_stages": 4,
            "max_nreg": null
          }
        },
        "4096": {
          "16": {
            "block_m": 128,
            "block_n": 16,
            "block_k": 32,
            "split_k": 8,
            "num_warps": 4,
            "num_ctas": 1,
            "num_stages": 2,
            "max_nreg": null
          }
        },
        "8192": {
          "16": {
            "block_m": 128,
            "block_n": 16,
            "block_k": 32,
            "split_k": 8,
            "num_warps": 4,
            "num_ctas": 1,
            "num_stages": 2,
            "max_nreg": null
          }
        },
        "12288": {
          "16": {
            "block_m": 128,
            "block_n": 16,
            "block_k": 32,
            "split_k": 8,
            "num_warps": 4,
            "num_ctas": 1,
            "num_stages": 2,
            "max_nreg": null
          }
        },
        "16384": {
          "16": {
            "block_m": 128,
            "block_n": 16,
            "block_k": 32,
            "split_k": 8,
            "num_warps": 4,
            "num_ctas": 1,
            "num_stages": 2,
            "max_nreg": null
          }
        },
        "24576": {
          "16": {
            "block_m": 128,
            "block_n": 16,
            "block_k": 32,
            "split_k": 8,
            "num_warps": 4,
            "num_ctas": 1,
            "num_stages": 2,
            "max_nreg": null
          }
        },
        "32768": {
          "16": {
            "block_m": 128,
            "block_n": 16,
            "block_k": 32,
            "split_k": 8,
            "num_warps": 4,
            "num_ctas": 1,
            "num_stages": 2,
            "max_nreg": null
          }
        }
      },
      "6144": {
        "1024": {
          "16": {
            "block_m": 128,
            "block_n": 16,
            "block_k": 64,
            "split_k": 8,
            "num_warps": 8,
            "num_ctas": 1,
            "num_stages": 2,
            "max_nreg": null
          }
        },
        "2048": {
          "16": {
            "block_m": 128,
            "block_n": 16,
            "block_k": 64,
            "split_k": 8,
            "num_warps": 8,
            "num_ctas": 1,
            "num_stages": 2,
            "max_nreg": null
          }
        },
        "4096": {
          "16": {
            "block_m": 128,
            "block_n": 16,
            "block_k": 64,
            "split_k": 8,
            "num_warps": 8,
            "num_ctas": 1,
            "num_stages": 2,
            "max_nreg": null
          }
        },
        "8192": {
          "16": {
            "block_m": 256,
            "block_n": 16,
            "block_k": 32,
            "split_k": 8,
            "num_warps": 4,
            "num_ctas": 1,
            "num_stages": 2,
            "max_nreg": null
          }
        },
        "12288": {
          "16": {
            "block_m": 256,
            "block_n": 16,
            "block_k": 32,
            "split_k": 8,
            "num_warps": 4,
            "num_ctas": 1,
            "num_stages": 2,
            "max_nreg": null
          }
        },
        "16384": {
          "16": {
            "block_m": 256,
            "block_n": 16,
            "block_k": 32,
            "split_k": 8,
            "num_warps": 4,
            "num_ctas": 1,
            "num_stages": 2,
            "max_nreg": null
          }
        },
        "24576": {
          "16": {
            "block_m": 256,
            "block_n": 16,
            "block_k": 32,
            "split_k": 8,
            "num_warps": 4,
            "num_ctas": 1,
            "num_stages": 2,
            "max_nreg": null
          }
        },
        "32768": {
          "16": {
            "block_m": 256,
            "block_n": 16,
            "block_k": 32,
            "split_k": 8,
            "num_warps": 4,
            "num_ctas": 1,
            "num_stages": 2,
            "max_nreg": null
          }
        }
      },
      "7168": {
        "1024": {
          "16": {
            "block_m": 128,
            "block_n": 16,
            "block_k": 32,
            "split_k": 8,
            "num_warps": 8,
            "num_ctas": 1,
            "num_stages": 4,
            "max_nreg": null
          }
        },
        "2048": {
          "16": {
            "block_m": 128,
            "block_n": 16,
            "block_k": 32,
            "split_k": 8,
            "num_warps": 8,
            "num_ctas": 1,
            "num_stages": 4,
            "max_nreg": null
          }
        },
        "4096": {
          "16": {
            "block_m": 128,
            "block_n": 16,
            "block_k": 32,
            "split_k": 8,
            "num_warps": 8,
            "num_ctas": 1,
            "num_stages": 4,
            "max_nreg": null
          }
        },
        "8192": {
          "16": {
            "block_m": 128,
            "block_n": 16,
            "block_k": 32,
            "split_k": 8,
            "num_warps": 8,
            "num_ctas": 1,
            "num_stages": 4,
            "max_nreg": null
          }
        },
        "12288": {
          "16": {
            "block_m": 512,
            "block_n": 16,
            "block_k": 32,
            "split_k": 8,
            "num_warps": 4,
            "num_ctas": 1,
            "num_stages": 2,
            "max_nreg": null
          }
        },
        "16384": {
          "16": {
            "block_m": 512,
            "block_n": 16,
            "block_k": 32,
            "split_k": 8,
            "num_warps": 4,
            "num_ctas": 1,
            "num_stages": 2,
            "max_nreg": null
          }
        },
        "24576": {
          "16": {
            "block_m": 512,
            "block_n": 16,
            "block_k": 32,
            "split_k": 8,
            "num_warps": 4,
            "num_ctas": 1,
            "num_stages": 2,
            "max_nreg": null
          }
        },
        "32768": {
          "16": {
            "block_m": 512,
            "block_n": 16,
            "block_k": 32,
            "split_k": 8,
            "num_warps": 4,
            "num_ctas": 1,
            "num_stages": 2,
            "max_nreg": null
          }
        }
      },
      "8192": {
        "1024": {
          "16": {
            "block_m": 128,
            "block_n": 16,
            "block_k": 32,
            "split_k": 8,
            "num_warps": 8,
            "num_ctas": 1,
            "num_stages": 4,
            "max_nreg": null
          }
        },
        "2048": {
          "16": {
            "block_m": 128,
            "block_n": 16,
            "block_k": 32,
            "split_k": 8,
            "num_warps": 8,
            "num_ctas": 1,
            "num_stages": 4,
            "max_nreg": null
          }
        },
        "4096": {
          "16": {
            "block_m": 128,
            "block_n": 16,
            "block_k": 32,
            "split_k": 8,
            "num_warps": 8,
            "num_ctas": 1,
            "num_stages": 4,
            "max_nreg": null
          }
        },
        "8192": {
          "16": {
            "block_m": 512,
            "block_n": 16,
            "block_k": 32,
            "split_k": 8,
            "num_warps": 4,
            "num_ctas": 1,
            "num_stages": 2,
            "max_nreg": null
          }
        },
        "12288": {
          "16": {
            "block_m": 512,
            "block_n": 16,
            "block_k": 32,
            "split_k": 8,
            "num_warps": 4,
            "num_ctas": 1,
            "num_stages": 2,
            "max_nreg": null
          }
        },
        "16384": {
          "16": {
            "block_m": 512,
            "block_n": 16,
            "block_k": 32,
            "split_k": 8,
            "num_warps": 4,
            "num_ctas": 1,
            "num_stages": 2,
            "max_nreg": null
          }
        },
        "24576": {
          "16": {
            "block_m": 512,
            "block_n": 16,
            "block_k": 32,
            "split_k": 8,
            "num_warps": 4,
            "num_ctas": 1,
            "num_stages": 2,
            "max_nreg": null
          }
        },
        "32768": {
          "16": {
            "block_m": 512,
            "block_n": 16,
            "block_k": 32,
            "split_k": 8,
            "num_warps": 4,
            "num_ctas": 1,
            "num_stages": 2,
            "max_nreg": null
          }
        }
      }
    }
  },
  "4": {
    "1": {
      "1": {
        "1024": {
          "16": {
            "block_m": 16,
            "block_n": 16,
            "block_k": 64,
            "split_k": 8,
            "num_warps": 4,
            "num_ctas": 1,
            "num_stages": 4,
            "max_nreg": null
          }
        },
        "2048": {
          "16": {
            "block_m": 16,
            "block_n": 16,
            "block_k": 32,
            "split_k": 64,
            "num_warps": 8,
            "num_ctas": 1,
            "num_stages": 2,
            "max_nreg": null
          }
        },
        "4096": {
          "16": {
            "block_m": 16,
            "block_n": 16,
            "block_k": 64,
            "split_k": 64,
            "num_warps": 8,
            "num_ctas": 1,
            "num_stages": 2,
            "max_nreg": null
          }
        },
        "8192": {
          "16": {
            "block_m": 16,
            "block_n": 16,
            "block_k": 32,
            "split_k": 128,
            "num_warps": 8,
            "num_ctas": 1,
            "num_stages": 4,
            "max_nreg": null
          }
        },
        "12288": {
          "16": {
            "block_m": 16,
            "block_n": 16,
            "block_k": 64,
            "split_k": 64,
            "num_warps": 8,
            "num_ctas": 1,
            "num_stages": 4,
            "max_nreg": null
          }
        },
        "16384": {
          "16": {
            "block_m": 16,
            "block_n": 16,
            "block_k": 128,
            "split_k": 64,
            "num_warps": 8,
            "num_ctas": 1,
            "num_stages": 4,
            "max_nreg": null
          }
        },
        "24576": {
          "16": {
            "block_m": 16,
            "block_n": 16,
            "block_k": 64,
            "split_k": 64,
            "num_warps": 8,
            "num_ctas": 1,
            "num_stages": 4,
            "max_nreg": null
          }
        },
        "32768": {
          "16": {
            "block_m": 16,
            "block_n": 16,
            "block_k": 64,
            "split_k": 128,
            "num_warps": 4,
            "num_ctas": 1,
            "num_stages": 4,
            "max_nreg": null
          }
        }
      },
      "16": {
        "1024": {
          "16": {
            "block_m": 16,
            "block_n": 16,
            "block_k": 32,
            "split_k": 32,
            "num_warps": 8,
            "num_ctas": 1,
            "num_stages": 2,
            "max_nreg": null
          }
        },
        "2048": {
          "16": {
            "block_m": 16,
            "block_n": 16,
            "block_k": 64,
            "split_k": 32,
            "num_warps": 8,
            "num_ctas": 1,
            "num_stages": 4,
            "max_nreg": null
          }
        },
        "4096": {
          "16": {
            "block_m": 16,
            "block_n": 16,
            "block_k": 64,
            "split_k": 32,
            "num_warps": 8,
            "num_ctas": 1,
            "num_stages": 4,
            "max_nreg": null
          }
        },
        "8192": {
          "16": {
            "block_m": 16,
            "block_n": 16,
            "block_k": 128,
            "split_k": 32,
            "num_warps": 8,
            "num_ctas": 1,
            "num_stages": 4,
            "max_nreg": null
          }
        },
        "12288": {
          "16": {
            "block_m": 16,
            "block_n": 16,
            "block_k": 128,
            "split_k": 32,
            "num_warps": 8,
            "num_ctas": 1,
            "num_stages": 4,
            "max_nreg": null
          }
        },
        "16384": {
          "16": {
            "block_m": 16,
            "block_n": 16,
            "block_k": 64,
            "split_k": 64,
            "num_warps": 4,
            "num_ctas": 1,
            "num_stages": 4,
            "max_nreg": null
          }
        },
        "24576": {
          "16": {
            "block_m": 16,
            "block_n": 16,
            "block_k": 128,
            "split_k": 32,
            "num_warps": 4,
            "num_ctas": 1,
            "num_stages": 4,
            "max_nreg": null
          }
        },
        "32768": {
          "16": {
            "block_m": 16,
            "block_n": 16,
            "block_k": 256,
            "split_k": 32,
            "num_warps": 4,
            "num_ctas": 1,
            "num_stages": 4,
            "max_nreg": null
          }
        }
      },
      "32": {
        "1024": {
          "16": {
            "block_m": 16,
            "block_n": 16,
            "block_k": 64,
            "split_k": 8,
            "num_warps": 8,
            "num_ctas": 1,
            "num_stages": 4,
            "max_nreg": null
          }
        },
        "2048": {
          "16": {
            "block_m": 16,
            "block_n": 16,
            "block_k": 64,
            "split_k": 32,
            "num_warps": 4,
            "num_ctas": 1,
            "num_stages": 4,
            "max_nreg": null
          }
        },
        "4096": {
          "16": {
            "block_m": 16,
            "block_n": 16,
            "block_k": 128,
            "split_k": 32,
            "num_warps": 8,
            "num_ctas": 1,
            "num_stages": 4,
            "max_nreg": null
          }
        },
        "8192": {
          "16": {
            "block_m": 16,
            "block_n": 16,
            "block_k": 128,
            "split_k": 32,
            "num_warps": 4,
            "num_ctas": 1,
            "num_stages": 4,
            "max_nreg": null
          }
        },
        "12288": {
          "16": {
            "block_m": 32,
            "block_n": 16,
            "block_k": 64,
            "split_k": 32,
            "num_warps": 8,
            "num_ctas": 1,
            "num_stages": 4,
            "max_nreg": null
          }
        },
        "16384": {
          "16": {
            "block_m": 16,
            "block_n": 16,
            "block_k": 128,
            "split_k": 128,
            "num_warps": 8,
            "num_ctas": 1,
            "num_stages": 4,
            "max_nreg": null
          }
        },
        "24576": {
          "16": {
            "block_m": 16,
            "block_n": 16,
            "block_k": 64,
            "split_k": 64,
            "num_warps": 4,
            "num_ctas": 1,
            "num_stages": 4,
            "max_nreg": null
          }
        },
        "32768": {
          "16": {
            "block_m": 32,
            "block_n": 16,
            "block_k": 256,
            "split_k": 32,
            "num_warps": 4,
            "num_ctas": 1,
            "num_stages": 4,
            "max_nreg": null
          }
        }
      },
      "64": {
        "1024": {
          "16": {
            "block_m": 16,
            "block_n": 16,
            "block_k": 64,
            "split_k": 8,
            "num_warps": 4,
            "num_ctas": 1,
            "num_stages": 4,
            "max_nreg": null
          }
        },
        "2048": {
          "16": {
            "block_m": 16,
            "block_n": 16,
            "block_k": 256,
            "split_k": 8,
            "num_warps": 4,
            "num_ctas": 1,
            "num_stages": 2,
            "max_nreg": null
          }
        },
        "4096": {
          "16": {
            "block_m": 16,
            "block_n": 16,
            "block_k": 256,
            "split_k": 8,
            "num_warps": 4,
            "num_ctas": 1,
            "num_stages": 4,
            "max_nreg": null
          }
        },
        "8192": {
          "16": {
            "block_m": 16,
            "block_n": 16,
            "block_k": 64,
            "split_k": 64,
            "num_warps": 4,
            "num_ctas": 1,
            "num_stages": 4,
            "max_nreg": null
          }
        },
        "12288": {
          "16": {
            "block_m": 16,
            "block_n": 16,
            "block_k": 32,
            "split_k": 64,
            "num_warps": 4,
            "num_ctas": 1,
            "num_stages": 4,
            "max_nreg": null
          }
        },
        "16384": {
          "16": {
            "block_m": 16,
            "block_n": 16,
            "block_k": 64,
            "split_k": 64,
            "num_warps": 4,
            "num_ctas": 1,
            "num_stages": 4,
            "max_nreg": null
          }
        },
        "24576": {
          "16": {
            "block_m": 64,
            "block_n": 16,
            "block_k": 128,
            "split_k": 32,
            "num_warps": 4,
            "num_ctas": 1,
            "num_stages": 4,
            "max_nreg": null
          }
        },
        "32768": {
          "16": {
            "block_m": 16,
            "block_n": 16,
            "block_k": 64,
            "split_k": 64,
            "num_warps": 4,
            "num_ctas": 1,
            "num_stages": 4,
            "max_nreg": null
          }
        }
      },
      "128": {
        "1024": {
          "16": {
            "block_m": 16,
            "block_n": 16,
            "block_k": 128,
            "split_k": 8,
            "num_warps": 8,
            "num_ctas": 1,
            "num_stages": 4,
            "max_nreg": null
          }
        },
        "2048": {
          "16": {
            "block_m": 16,
            "block_n": 16,
            "block_k": 64,
            "split_k": 32,
            "num_warps": 4,
            "num_ctas": 1,
            "num_stages": 2,
            "max_nreg": null
          }
        },
        "4096": {
          "16": {
            "block_m": 16,
            "block_n": 16,
            "block_k": 64,
            "split_k": 32,
            "num_warps": 4,
            "num_ctas": 1,
            "num_stages": 2,
            "max_nreg": null
          }
        },
        "8192": {
          "16": {
            "block_m": 16,
            "block_n": 16,
            "block_k": 128,
            "split_k": 32,
            "num_warps": 4,
            "num_ctas": 1,
            "num_stages": 2,
            "max_nreg": null
          }
        },
        "12288": {
          "16": {
            "block_m": 16,
            "block_n": 16,
            "block_k": 64,
            "split_k": 32,
            "num_warps": 4,
            "num_ctas": 1,
            "num_stages": 4,
            "max_nreg": null
          }
        },
        "16384": {
          "16": {
            "block_m": 16,
            "block_n": 16,
            "block_k": 64,
            "split_k": 32,
            "num_warps": 4,
            "num_ctas": 1,
            "num_stages": 4,
            "max_nreg": null
          }
        },
        "24576": {
          "16": {
            "block_m": 16,
            "block_n": 16,
            "block_k": 64,
            "split_k": 64,
            "num_warps": 4,
            "num_ctas": 1,
            "num_stages": 4,
            "max_nreg": null
          }
        },
        "32768": {
          "16": {
            "block_m": 16,
            "block_n": 16,
            "block_k": 256,
            "split_k": 64,
            "num_warps": 4,
            "num_ctas": 1,
            "num_stages": 2,
            "max_nreg": null
          }
        }
      },
      "192": {
        "1024": {
          "16": {
            "block_m": 16,
            "block_n": 16,
            "block_k": 64,
            "split_k": 8,
            "num_warps": 4,
            "num_ctas": 1,
            "num_stages": 4,
            "max_nreg": null
          }
        },
        "2048": {
          "16": {
            "block_m": 16,
            "block_n": 16,
            "block_k": 128,
            "split_k": 8,
            "num_warps": 4,
            "num_ctas": 1,
            "num_stages": 4,
            "max_nreg": null
          }
        },
        "4096": {
          "16": {
            "block_m": 16,
            "block_n": 16,
            "block_k": 128,
            "split_k": 32,
            "num_warps": 4,
            "num_ctas": 1,
            "num_stages": 2,
            "max_nreg": null
          }
        },
        "8192": {
          "16": {
            "block_m": 16,
            "block_n": 16,
            "block_k": 32,
            "split_k": 32,
            "num_warps": 4,
            "num_ctas": 1,
            "num_stages": 4,
            "max_nreg": null
          }
        },
        "12288": {
          "16": {
            "block_m": 16,
            "block_n": 16,
            "block_k": 128,
            "split_k": 32,
            "num_warps": 4,
            "num_ctas": 1,
            "num_stages": 2,
            "max_nreg": null
          }
        },
        "16384": {
          "16": {
            "block_m": 16,
            "block_n": 16,
            "block_k": 256,
            "split_k": 32,
            "num_warps": 4,
            "num_ctas": 1,
            "num_stages": 2,
            "max_nreg": null
          }
        },
        "24576": {
          "16": {
            "block_m": 16,
            "block_n": 16,
            "block_k": 128,
            "split_k": 64,
            "num_warps": 4,
            "num_ctas": 1,
            "num_stages": 2,
            "max_nreg": null
          }
        },
        "32768": {
          "16": {
            "block_m": 16,
            "block_n": 16,
            "block_k": 128,
            "split_k": 64,
            "num_warps": 4,
            "num_ctas": 1,
            "num_stages": 2,
            "max_nreg": null
          }
        }
      },
      "256": {
        "1024": {
          "16": {
            "block_m": 32,
            "block_n": 16,
            "block_k": 128,
            "split_k": 8,
            "num_warps": 8,
            "num_ctas": 1,
            "num_stages": 4,
            "max_nreg": null
          }
        },
        "2048": {
          "16": {
            "block_m": 16,
            "block_n": 16,
            "block_k": 64,
            "split_k": 32,
            "num_warps": 4,
            "num_ctas": 1,
            "num_stages": 4,
            "max_nreg": null
          }
        },
        "4096": {
          "16": {
            "block_m": 16,
            "block_n": 16,
            "block_k": 64,
            "split_k": 32,
            "num_warps": 4,
            "num_ctas": 1,
            "num_stages": 4,
            "max_nreg": null
          }
        },
        "8192": {
          "16": {
            "block_m": 16,
            "block_n": 16,
            "block_k": 128,
            "split_k": 32,
            "num_warps": 4,
            "num_ctas": 1,
            "num_stages": 2,
            "max_nreg": null
          }
        },
        "12288": {
          "16": {
            "block_m": 16,
            "block_n": 16,
            "block_k": 128,
            "split_k": 32,
            "num_warps": 4,
            "num_ctas": 1,
            "num_stages": 2,
            "max_nreg": null
          }
        },
        "16384": {
          "16": {
            "block_m": 16,
            "block_n": 16,
            "block_k": 64,
            "split_k": 32,
            "num_warps": 4,
            "num_ctas": 1,
            "num_stages": 4,
            "max_nreg": null
          }
        },
        "24576": {
          "16": {
            "block_m": 16,
            "block_n": 16,
            "block_k": 256,
            "split_k": 32,
            "num_warps": 4,
            "num_ctas": 1,
            "num_stages": 2,
            "max_nreg": null
          }
        },
        "32768": {
          "16": {
            "block_m": 16,
            "block_n": 16,
            "block_k": 64,
            "split_k": 32,
            "num_warps": 4,
            "num_ctas": 1,
            "num_stages": 4,
            "max_nreg": null
          }
        }
      },
      "320": {
        "1024": {
          "16": {
            "block_m": 16,
            "block_n": 16,
            "block_k": 128,
            "split_k": 8,
            "num_warps": 4,
            "num_ctas": 1,
            "num_stages": 4,
            "max_nreg": null
          }
        },
        "2048": {
          "16": {
            "block_m": 16,
            "block_n": 16,
            "block_k": 128,
            "split_k": 8,
            "num_warps": 4,
            "num_ctas": 1,
            "num_stages": 2,
            "max_nreg": null
          }
        },
        "4096": {
          "16": {
            "block_m": 16,
            "block_n": 16,
            "block_k": 64,
            "split_k": 32,
            "num_warps": 4,
            "num_ctas": 1,
            "num_stages": 2,
            "max_nreg": null
          }
        },
        "8192": {
          "16": {
            "block_m": 16,
            "block_n": 16,
            "block_k": 128,
            "split_k": 32,
            "num_warps": 4,
            "num_ctas": 1,
            "num_stages": 2,
            "max_nreg": null
          }
        },
        "12288": {
          "16": {
            "block_m": 16,
            "block_n": 16,
            "block_k": 256,
            "split_k": 8,
            "num_warps": 4,
            "num_ctas": 1,
            "num_stages": 4,
            "max_nreg": null
          }
        },
        "16384": {
          "16": {
            "block_m": 16,
            "block_n": 16,
            "block_k": 256,
            "split_k": 8,
            "num_warps": 4,
            "num_ctas": 1,
            "num_stages": 4,
            "max_nreg": null
          }
        },
        "24576": {
          "16": {
            "block_m": 32,
            "block_n": 16,
            "block_k": 256,
            "split_k": 32,
            "num_warps": 4,
            "num_ctas": 1,
            "num_stages": 2,
            "max_nreg": null
          }
        },
        "32768": {
          "16": {
            "block_m": 32,
            "block_n": 16,
            "block_k": 256,
            "split_k": 32,
            "num_warps": 4,
            "num_ctas": 1,
            "num_stages": 2,
            "max_nreg": null
          }
        }
      },
      "384": {
        "1024": {
          "16": {
            "block_m": 16,
            "block_n": 16,
            "block_k": 32,
            "split_k": 8,
            "num_warps": 4,
            "num_ctas": 1,
            "num_stages": 4,
            "max_nreg": null
          }
        },
        "2048": {
          "16": {
            "block_m": 16,
            "block_n": 16,
            "block_k": 64,
            "split_k": 32,
            "num_warps": 4,
            "num_ctas": 1,
            "num_stages": 2,
            "max_nreg": null
          }
        },
        "4096": {
          "16": {
            "block_m": 16,
            "block_n": 16,
            "block_k": 128,
            "split_k": 32,
            "num_warps": 4,
            "num_ctas": 1,
            "num_stages": 2,
            "max_nreg": null
          }
        },
        "8192": {
          "16": {
            "block_m": 16,
            "block_n": 16,
            "block_k": 128,
            "split_k": 32,
            "num_warps": 4,
            "num_ctas": 1,
            "num_stages": 2,
            "max_nreg": null
          }
        },
        "12288": {
          "16": {
            "block_m": 16,
            "block_n": 16,
            "block_k": 128,
            "split_k": 32,
            "num_warps": 4,
            "num_ctas": 1,
            "num_stages": 2,
            "max_nreg": null
          }
        },
        "16384": {
          "16": {
            "block_m": 64,
            "block_n": 16,
            "block_k": 256,
            "split_k": 8,
            "num_warps": 8,
            "num_ctas": 1,
            "num_stages": 4,
            "max_nreg": null
          }
        },
        "24576": {
          "16": {
            "block_m": 32,
            "block_n": 16,
            "block_k": 512,
            "split_k": 8,
            "num_warps": 4,
            "num_ctas": 1,
            "num_stages": 4,
            "max_nreg": null
          }
        },
        "32768": {
          "16": {
            "block_m": 64,
            "block_n": 16,
            "block_k": 256,
            "split_k": 32,
            "num_warps": 8,
            "num_ctas": 1,
            "num_stages": 2,
            "max_nreg": null
          }
        }
      },
      "448": {
        "1024": {
          "16": {
            "block_m": 16,
            "block_n": 16,
            "block_k": 64,
            "split_k": 8,
            "num_warps": 4,
            "num_ctas": 1,
            "num_stages": 4,
            "max_nreg": null
          }
        },
        "2048": {
          "16": {
            "block_m": 16,
            "block_n": 16,
            "block_k": 128,
            "split_k": 8,
            "num_warps": 4,
            "num_ctas": 1,
            "num_stages": 4,
            "max_nreg": null
          }
        },
        "4096": {
          "16": {
            "block_m": 16,
            "block_n": 16,
            "block_k": 128,
            "split_k": 32,
            "num_warps": 4,
            "num_ctas": 1,
            "num_stages": 2,
            "max_nreg": null
          }
        },
        "8192": {
          "16": {
            "block_m": 64,
            "block_n": 16,
            "block_k": 256,
            "split_k": 8,
            "num_warps": 8,
            "num_ctas": 1,
            "num_stages": 4,
            "max_nreg": null
          }
        },
        "12288": {
          "16": {
            "block_m": 16,
            "block_n": 16,
            "block_k": 128,
            "split_k": 32,
            "num_warps": 4,
            "num_ctas": 1,
            "num_stages": 4,
            "max_nreg": null
          }
        },
        "16384": {
          "16": {
            "block_m": 16,
            "block_n": 16,
            "block_k": 128,
            "split_k": 32,
            "num_warps": 4,
            "num_ctas": 1,
            "num_stages": 2,
            "max_nreg": null
          }
        },
        "24576": {
          "16": {
            "block_m": 16,
            "block_n": 16,
            "block_k": 128,
            "split_k": 32,
            "num_warps": 4,
            "num_ctas": 1,
            "num_stages": 2,
            "max_nreg": null
          }
        },
        "32768": {
          "16": {
            "block_m": 64,
            "block_n": 16,
            "block_k": 256,
            "split_k": 8,
            "num_warps": 8,
            "num_ctas": 1,
            "num_stages": 4,
            "max_nreg": null
          }
        }
      },
      "512": {
        "1024": {
          "16": {
            "block_m": 16,
            "block_n": 16,
            "block_k": 128,
            "split_k": 8,
            "num_warps": 4,
            "num_ctas": 1,
            "num_stages": 4,
            "max_nreg": null
          }
        },
        "2048": {
          "16": {
            "block_m": 16,
            "block_n": 16,
            "block_k": 64,
            "split_k": 8,
            "num_warps": 4,
            "num_ctas": 1,
            "num_stages": 4,
            "max_nreg": null
          }
        },
        "4096": {
          "16": {
            "block_m": 16,
            "block_n": 16,
            "block_k": 128,
            "split_k": 32,
            "num_warps": 4,
            "num_ctas": 1,
            "num_stages": 2,
            "max_nreg": null
          }
        },
        "8192": {
          "16": {
            "block_m": 64,
            "block_n": 16,
            "block_k": 256,
            "split_k": 8,
            "num_warps": 8,
            "num_ctas": 1,
            "num_stages": 4,
            "max_nreg": null
          }
        },
        "12288": {
          "16": {
            "block_m": 16,
            "block_n": 16,
            "block_k": 64,
            "split_k": 32,
            "num_warps": 4,
            "num_ctas": 1,
            "num_stages": 4,
            "max_nreg": null
          }
        },
        "16384": {
          "16": {
            "block_m": 64,
            "block_n": 16,
            "block_k": 256,
            "split_k": 8,
            "num_warps": 8,
            "num_ctas": 1,
            "num_stages": 4,
            "max_nreg": null
          }
        },
        "24576": {
          "16": {
            "block_m": 16,
            "block_n": 16,
            "block_k": 64,
            "split_k": 32,
            "num_warps": 4,
            "num_ctas": 1,
            "num_stages": 4,
            "max_nreg": null
          }
        },
        "32768": {
          "16": {
            "block_m": 16,
            "block_n": 16,
            "block_k": 64,
            "split_k": 32,
            "num_warps": 4,
            "num_ctas": 1,
            "num_stages": 4,
            "max_nreg": null
          }
        }
      },
      "640": {
        "1024": {
          "16": {
            "block_m": 16,
            "block_n": 16,
            "block_k": 128,
            "split_k": 8,
            "num_warps": 4,
            "num_ctas": 1,
            "num_stages": 2,
            "max_nreg": null
          }
        },
        "2048": {
          "16": {
            "block_m": 16,
            "block_n": 16,
            "block_k": 128,
            "split_k": 8,
            "num_warps": 4,
            "num_ctas": 1,
            "num_stages": 4,
            "max_nreg": null
          }
        },
        "4096": {
          "16": {
            "block_m": 16,
            "block_n": 16,
            "block_k": 64,
            "split_k": 8,
            "num_warps": 4,
            "num_ctas": 1,
            "num_stages": 4,
            "max_nreg": null
          }
        },
        "8192": {
          "16": {
            "block_m": 16,
            "block_n": 16,
            "block_k": 128,
            "split_k": 8,
            "num_warps": 4,
            "num_ctas": 1,
            "num_stages": 4,
            "max_nreg": null
          }
        },
        "12288": {
          "16": {
            "block_m": 32,
            "block_n": 16,
            "block_k": 128,
            "split_k": 8,
            "num_warps": 8,
            "num_ctas": 1,
            "num_stages": 4,
            "max_nreg": null
          }
        },
        "16384": {
          "16": {
            "block_m": 32,
            "block_n": 16,
            "block_k": 128,
            "split_k": 8,
            "num_warps": 4,
            "num_ctas": 1,
            "num_stages": 4,
            "max_nreg": null
          }
        },
        "24576": {
          "16": {
            "block_m": 64,
            "block_n": 16,
            "block_k": 256,
            "split_k": 8,
            "num_warps": 8,
            "num_ctas": 1,
            "num_stages": 4,
            "max_nreg": null
          }
        },
        "32768": {
          "16": {
            "block_m": 64,
            "block_n": 16,
            "block_k": 256,
            "split_k": 8,
            "num_warps": 8,
            "num_ctas": 1,
            "num_stages": 4,
            "max_nreg": null
          }
        }
      },
      "768": {
        "1024": {
          "16": {
            "block_m": 16,
            "block_n": 16,
            "block_k": 128,
            "split_k": 8,
            "num_warps": 4,
            "num_ctas": 1,
            "num_stages": 4,
            "max_nreg": null
          }
        },
        "2048": {
          "16": {
            "block_m": 16,
            "block_n": 16,
            "block_k": 128,
            "split_k": 8,
            "num_warps": 4,
            "num_ctas": 1,
            "num_stages": 4,
            "max_nreg": null
          }
        },
        "4096": {
          "16": {
            "block_m": 16,
            "block_n": 16,
            "block_k": 256,
            "split_k": 8,
            "num_warps": 4,
            "num_ctas": 1,
            "num_stages": 2,
            "max_nreg": null
          }
        },
        "8192": {
          "16": {
            "block_m": 32,
            "block_n": 16,
            "block_k": 128,
            "split_k": 8,
            "num_warps": 4,
            "num_ctas": 1,
            "num_stages": 4,
            "max_nreg": null
          }
        },
        "12288": {
          "16": {
            "block_m": 32,
            "block_n": 16,
            "block_k": 128,
            "split_k": 8,
            "num_warps": 4,
            "num_ctas": 1,
            "num_stages": 4,
            "max_nreg": null
          }
        },
        "16384": {
          "16": {
            "block_m": 32,
            "block_n": 16,
            "block_k": 128,
            "split_k": 8,
            "num_warps": 4,
            "num_ctas": 1,
            "num_stages": 4,
            "max_nreg": null
          }
        },
        "24576": {
          "16": {
            "block_m": 32,
            "block_n": 16,
            "block_k": 128,
            "split_k": 8,
            "num_warps": 4,
            "num_ctas": 1,
            "num_stages": 4,
            "max_nreg": null
          }
        },
        "32768": {
          "16": {
            "block_m": 64,
            "block_n": 16,
            "block_k": 256,
            "split_k": 8,
            "num_warps": 8,
            "num_ctas": 1,
            "num_stages": 4,
            "max_nreg": null
          }
        }
      },
      "896": {
        "1024": {
          "16": {
            "block_m": 16,
            "block_n": 16,
            "block_k": 64,
            "split_k": 8,
            "num_warps": 4,
            "num_ctas": 1,
            "num_stages": 4,
            "max_nreg": null
          }
        },
        "2048": {
          "16": {
            "block_m": 16,
            "block_n": 16,
            "block_k": 32,
            "split_k": 8,
            "num_warps": 4,
            "num_ctas": 1,
            "num_stages": 4,
            "max_nreg": null
          }
        },
        "4096": {
          "16": {
            "block_m": 32,
            "block_n": 16,
            "block_k": 64,
            "split_k": 8,
            "num_warps": 4,
            "num_ctas": 1,
            "num_stages": 4,
            "max_nreg": null
          }
        },
        "8192": {
          "16": {
            "block_m": 16,
            "block_n": 16,
            "block_k": 128,
            "split_k": 8,
            "num_warps": 4,
            "num_ctas": 1,
            "num_stages": 4,
            "max_nreg": null
          }
        },
        "12288": {
          "16": {
            "block_m": 64,
            "block_n": 16,
            "block_k": 512,
            "split_k": 8,
            "num_warps": 8,
            "num_ctas": 1,
            "num_stages": 2,
            "max_nreg": null
          }
        },
        "16384": {
          "16": {
            "block_m": 32,
            "block_n": 16,
            "block_k": 128,
            "split_k": 8,
            "num_warps": 4,
            "num_ctas": 1,
            "num_stages": 4,
            "max_nreg": null
          }
        },
        "24576": {
          "16": {
            "block_m": 32,
            "block_n": 16,
            "block_k": 128,
            "split_k": 8,
            "num_warps": 4,
            "num_ctas": 1,
            "num_stages": 4,
            "max_nreg": null
          }
        },
        "32768": {
          "16": {
            "block_m": 32,
            "block_n": 16,
            "block_k": 128,
            "split_k": 8,
            "num_warps": 4,
            "num_ctas": 1,
            "num_stages": 4,
            "max_nreg": null
          }
        }
      },
      "1024": {
        "1024": {
          "16": {
            "block_m": 16,
            "block_n": 16,
            "block_k": 128,
            "split_k": 8,
            "num_warps": 4,
            "num_ctas": 1,
            "num_stages": 2,
            "max_nreg": null
          }
        },
        "2048": {
          "16": {
            "block_m": 16,
            "block_n": 16,
            "block_k": 128,
            "split_k": 8,
            "num_warps": 4,
            "num_ctas": 1,
            "num_stages": 2,
            "max_nreg": null
          }
        },
        "4096": {
          "16": {
            "block_m": 16,
            "block_n": 16,
            "block_k": 256,
            "split_k": 8,
            "num_warps": 4,
            "num_ctas": 1,
            "num_stages": 2,
            "max_nreg": null
          }
        },
        "8192": {
          "16": {
            "block_m": 64,
            "block_n": 16,
            "block_k": 128,
            "split_k": 8,
            "num_warps": 8,
            "num_ctas": 1,
            "num_stages": 4,
            "max_nreg": null
          }
        },
        "12288": {
          "16": {
            "block_m": 64,
            "block_n": 16,
            "block_k": 128,
            "split_k": 8,
            "num_warps": 8,
            "num_ctas": 1,
            "num_stages": 4,
            "max_nreg": null
          }
        },
        "16384": {
          "16": {
            "block_m": 64,
            "block_n": 16,
            "block_k": 128,
            "split_k": 8,
            "num_warps": 8,
            "num_ctas": 1,
            "num_stages": 4,
            "max_nreg": null
          }
        },
        "24576": {
          "16": {
            "block_m": 16,
            "block_n": 16,
            "block_k": 256,
            "split_k": 8,
            "num_warps": 4,
            "num_ctas": 1,
            "num_stages": 4,
            "max_nreg": null
          }
        },
        "32768": {
          "16": {
            "block_m": 64,
            "block_n": 16,
            "block_k": 128,
            "split_k": 8,
            "num_warps": 8,
            "num_ctas": 1,
            "num_stages": 4,
            "max_nreg": null
          }
        }
      },
      "2048": {
        "1024": {
          "16": {
            "block_m": 32,
            "block_n": 16,
            "block_k": 64,
            "split_k": 8,
            "num_warps": 8,
            "num_ctas": 1,
            "num_stages": 4,
            "max_nreg": null
          }
        },
        "2048": {
          "16": {
            "block_m": 16,
            "block_n": 16,
            "block_k": 128,
            "split_k": 8,
            "num_warps": 4,
            "num_ctas": 1,
            "num_stages": 2,
            "max_nreg": null
          }
        },
        "4096": {
          "16": {
            "block_m": 16,
            "block_n": 16,
            "block_k": 64,
            "split_k": 8,
            "num_warps": 4,
            "num_ctas": 1,
            "num_stages": 4,
            "max_nreg": null
          }
        },
        "8192": {
          "16": {
            "block_m": 32,
            "block_n": 16,
            "block_k": 64,
            "split_k": 8,
            "num_warps": 8,
            "num_ctas": 1,
            "num_stages": 4,
            "max_nreg": null
          }
        },
        "12288": {
          "16": {
            "block_m": 32,
            "block_n": 16,
            "block_k": 64,
            "split_k": 8,
            "num_warps": 8,
            "num_ctas": 1,
            "num_stages": 4,
            "max_nreg": null
          }
        },
        "16384": {
          "16": {
            "block_m": 32,
            "block_n": 16,
            "block_k": 256,
            "split_k": 8,
            "num_warps": 4,
            "num_ctas": 1,
            "num_stages": 2,
            "max_nreg": null
          }
        },
        "24576": {
          "16": {
            "block_m": 32,
            "block_n": 16,
            "block_k": 64,
            "split_k": 8,
            "num_warps": 4,
            "num_ctas": 1,
            "num_stages": 4,
            "max_nreg": null
          }
        },
        "32768": {
          "16": {
            "block_m": 64,
            "block_n": 16,
            "block_k": 256,
            "split_k": 8,
            "num_warps": 8,
            "num_ctas": 1,
            "num_stages": 2,
            "max_nreg": null
          }
        }
      },
      "3072": {
        "1024": {
          "16": {
            "block_m": 32,
            "block_n": 16,
            "block_k": 128,
            "split_k": 8,
            "num_warps": 4,
            "num_ctas": 1,
            "num_stages": 4,
            "max_nreg": null
          }
        },
        "2048": {
          "16": {
            "block_m": 32,
            "block_n": 16,
            "block_k": 128,
            "split_k": 8,
            "num_warps": 4,
            "num_ctas": 1,
            "num_stages": 4,
            "max_nreg": null
          }
        },
        "4096": {
          "16": {
            "block_m": 32,
            "block_n": 16,
            "block_k": 128,
            "split_k": 8,
            "num_warps": 4,
            "num_ctas": 1,
            "num_stages": 4,
            "max_nreg": null
          }
        },
        "8192": {
          "16": {
            "block_m": 32,
            "block_n": 16,
            "block_k": 128,
            "split_k": 8,
            "num_warps": 4,
            "num_ctas": 1,
            "num_stages": 2,
            "max_nreg": null
          }
        },
        "12288": {
          "16": {
            "block_m": 32,
            "block_n": 16,
            "block_k": 128,
            "split_k": 8,
            "num_warps": 4,
            "num_ctas": 1,
            "num_stages": 2,
            "max_nreg": null
          }
        },
        "16384": {
          "16": {
            "block_m": 32,
            "block_n": 16,
            "block_k": 128,
            "split_k": 8,
            "num_warps": 4,
            "num_ctas": 1,
            "num_stages": 2,
            "max_nreg": null
          }
        },
        "24576": {
          "16": {
            "block_m": 32,
            "block_n": 16,
            "block_k": 128,
            "split_k": 8,
            "num_warps": 4,
            "num_ctas": 1,
            "num_stages": 2,
            "max_nreg": null
          }
        },
        "32768": {
          "16": {
            "block_m": 32,
            "block_n": 16,
            "block_k": 128,
            "split_k": 8,
            "num_warps": 4,
            "num_ctas": 1,
            "num_stages": 2,
            "max_nreg": null
          }
        }
      },
      "4096": {
        "1024": {
          "16": {
            "block_m": 32,
            "block_n": 16,
            "block_k": 128,
            "split_k": 8,
            "num_warps": 4,
            "num_ctas": 1,
            "num_stages": 2,
            "max_nreg": null
          }
        },
        "2048": {
          "16": {
            "block_m": 32,
            "block_n": 16,
            "block_k": 64,
            "split_k": 8,
            "num_warps": 4,
            "num_ctas": 1,
            "num_stages": 2,
            "max_nreg": null
          }
        },
        "4096": {
          "16": {
            "block_m": 32,
            "block_n": 16,
            "block_k": 128,
            "split_k": 8,
            "num_warps": 4,
            "num_ctas": 1,
            "num_stages": 2,
            "max_nreg": null
          }
        },
        "8192": {
          "16": {
            "block_m": 32,
            "block_n": 16,
            "block_k": 128,
            "split_k": 8,
            "num_warps": 4,
            "num_ctas": 1,
            "num_stages": 2,
            "max_nreg": null
          }
        },
        "12288": {
          "16": {
            "block_m": 64,
            "block_n": 16,
            "block_k": 128,
            "split_k": 8,
            "num_warps": 8,
            "num_ctas": 1,
            "num_stages": 2,
            "max_nreg": null
          }
        },
        "16384": {
          "16": {
            "block_m": 32,
            "block_n": 16,
            "block_k": 128,
            "split_k": 8,
            "num_warps": 4,
            "num_ctas": 1,
            "num_stages": 2,
            "max_nreg": null
          }
        },
        "24576": {
          "16": {
            "block_m": 32,
            "block_n": 16,
            "block_k": 128,
            "split_k": 8,
            "num_warps": 4,
            "num_ctas": 1,
            "num_stages": 2,
            "max_nreg": null
          }
        },
        "32768": {
          "16": {
            "block_m": 32,
            "block_n": 16,
            "block_k": 128,
            "split_k": 8,
            "num_warps": 4,
            "num_ctas": 1,
            "num_stages": 2,
            "max_nreg": null
          }
        }
      },
      "5120": {
        "1024": {
          "16": {
            "block_m": 32,
            "block_n": 16,
            "block_k": 64,
            "split_k": 8,
            "num_warps": 4,
            "num_ctas": 1,
            "num_stages": 4,
            "max_nreg": null
          }
        },
        "2048": {
          "16": {
            "block_m": 32,
            "block_n": 16,
            "block_k": 64,
            "split_k": 8,
            "num_warps": 4,
            "num_ctas": 1,
            "num_stages": 4,
            "max_nreg": null
          }
        },
        "4096": {
          "16": {
            "block_m": 64,
            "block_n": 16,
            "block_k": 128,
            "split_k": 8,
            "num_warps": 8,
            "num_ctas": 1,
            "num_stages": 2,
            "max_nreg": null
          }
        },
        "8192": {
          "16": {
            "block_m": 64,
            "block_n": 16,
            "block_k": 128,
            "split_k": 8,
            "num_warps": 8,
            "num_ctas": 1,
            "num_stages": 2,
            "max_nreg": null
          }
        },
        "12288": {
          "16": {
            "block_m": 64,
            "block_n": 16,
            "block_k": 128,
            "split_k": 8,
            "num_warps": 8,
            "num_ctas": 1,
            "num_stages": 2,
            "max_nreg": null
          }
        },
        "16384": {
          "16": {
            "block_m": 64,
            "block_n": 16,
            "block_k": 64,
            "split_k": 8,
            "num_warps": 8,
            "num_ctas": 1,
            "num_stages": 4,
            "max_nreg": null
          }
        },
        "24576": {
          "16": {
            "block_m": 64,
            "block_n": 16,
            "block_k": 128,
            "split_k": 8,
            "num_warps": 8,
            "num_ctas": 1,
            "num_stages": 2,
            "max_nreg": null
          }
        },
        "32768": {
          "16": {
            "block_m": 64,
            "block_n": 16,
            "block_k": 128,
            "split_k": 8,
            "num_warps": 8,
            "num_ctas": 1,
            "num_stages": 2,
            "max_nreg": null
          }
        }
      },
      "6144": {
        "1024": {
          "16": {
            "block_m": 64,
            "block_n": 16,
            "block_k": 64,
            "split_k": 8,
            "num_warps": 8,
            "num_ctas": 1,
            "num_stages": 2,
            "max_nreg": null
          }
        },
        "2048": {
          "16": {
            "block_m": 64,
            "block_n": 16,
            "block_k": 64,
            "split_k": 8,
            "num_warps": 8,
            "num_ctas": 1,
            "num_stages": 4,
            "max_nreg": null
          }
        },
        "4096": {
          "16": {
            "block_m": 64,
            "block_n": 16,
            "block_k": 64,
            "split_k": 8,
            "num_warps": 4,
            "num_ctas": 1,
            "num_stages": 2,
            "max_nreg": null
          }
        },
        "8192": {
          "16": {
            "block_m": 64,
            "block_n": 16,
            "block_k": 64,
            "split_k": 8,
            "num_warps": 8,
            "num_ctas": 1,
            "num_stages": 2,
            "max_nreg": null
          }
        },
        "12288": {
          "16": {
            "block_m": 64,
            "block_n": 16,
            "block_k": 64,
            "split_k": 8,
            "num_warps": 8,
            "num_ctas": 1,
            "num_stages": 2,
            "max_nreg": null
          }
        },
        "16384": {
          "16": {
            "block_m": 64,
            "block_n": 16,
            "block_k": 64,
            "split_k": 8,
            "num_warps": 8,
            "num_ctas": 1,
            "num_stages": 2,
            "max_nreg": null
          }
        },
        "24576": {
          "16": {
            "block_m": 64,
            "block_n": 16,
            "block_k": 64,
            "split_k": 8,
            "num_warps": 4,
            "num_ctas": 1,
            "num_stages": 2,
            "max_nreg": null
          }
        },
        "32768": {
          "16": {
            "block_m": 64,
            "block_n": 16,
            "block_k": 64,
            "split_k": 8,
            "num_warps": 4,
            "num_ctas": 1,
            "num_stages": 2,
            "max_nreg": null
          }
        }
      },
      "7168": {
        "1024": {
          "16": {
            "block_m": 64,
            "block_n": 16,
            "block_k": 64,
            "split_k": 8,
            "num_warps": 8,
            "num_ctas": 1,
            "num_stages": 2,
            "max_nreg": null
          }
        },
        "2048": {
          "16": {
            "block_m": 32,
            "block_n": 16,
            "block_k": 128,
            "split_k": 8,
            "num_warps": 4,
            "num_ctas": 1,
            "num_stages": 2,
            "max_nreg": null
          }
        },
        "4096": {
          "16": {
            "block_m": 64,
            "block_n": 16,
            "block_k": 64,
            "split_k": 8,
            "num_warps": 8,
            "num_ctas": 1,
            "num_stages": 2,
            "max_nreg": null
          }
        },
        "8192": {
          "16": {
            "block_m": 64,
            "block_n": 16,
            "block_k": 64,
            "split_k": 8,
            "num_warps": 8,
            "num_ctas": 1,
            "num_stages": 2,
            "max_nreg": null
          }
        },
        "12288": {
          "16": {
            "block_m": 32,
            "block_n": 16,
            "block_k": 256,
            "split_k": 8,
            "num_warps": 4,
            "num_ctas": 1,
            "num_stages": 2,
            "max_nreg": null
          }
        },
        "16384": {
          "16": {
            "block_m": 32,
            "block_n": 16,
            "block_k": 128,
            "split_k": 8,
            "num_warps": 4,
            "num_ctas": 1,
            "num_stages": 2,
            "max_nreg": null
          }
        },
        "24576": {
          "16": {
            "block_m": 64,
            "block_n": 16,
            "block_k": 128,
            "split_k": 8,
            "num_warps": 8,
            "num_ctas": 1,
            "num_stages": 4,
            "max_nreg": null
          }
        },
        "32768": {
          "16": {
            "block_m": 64,
            "block_n": 16,
            "block_k": 128,
            "split_k": 8,
            "num_warps": 8,
            "num_ctas": 1,
            "num_stages": 4,
            "max_nreg": null
          }
        }
      },
      "8192": {
        "1024": {
          "16": {
            "block_m": 64,
            "block_n": 16,
            "block_k": 64,
            "split_k": 8,
            "num_warps": 8,
            "num_ctas": 1,
            "num_stages": 2,
            "max_nreg": null
          }
        },
        "2048": {
          "16": {
            "block_m": 64,
            "block_n": 16,
            "block_k": 64,
            "split_k": 8,
            "num_warps": 8,
            "num_ctas": 1,
            "num_stages": 2,
            "max_nreg": null
          }
        },
        "4096": {
          "16": {
            "block_m": 64,
            "block_n": 16,
            "block_k": 64,
            "split_k": 8,
            "num_warps": 8,
            "num_ctas": 1,
            "num_stages": 2,
            "max_nreg": null
          }
        },
        "8192": {
          "16": {
            "block_m": 64,
            "block_n": 16,
            "block_k": 64,
            "split_k": 8,
            "num_warps": 8,
            "num_ctas": 1,
            "num_stages": 2,
            "max_nreg": null
          }
        },
        "12288": {
          "16": {
            "block_m": 64,
            "block_n": 16,
            "block_k": 64,
            "split_k": 8,
            "num_warps": 8,
            "num_ctas": 1,
            "num_stages": 2,
            "max_nreg": null
          }
        },
        "16384": {
          "16": {
            "block_m": 32,
            "block_n": 16,
            "block_k": 128,
            "split_k": 8,
            "num_warps": 4,
            "num_ctas": 1,
            "num_stages": 2,
            "max_nreg": null
          }
        },
        "24576": {
          "16": {
            "block_m": 32,
            "block_n": 16,
            "block_k": 128,
            "split_k": 8,
            "num_warps": 4,
            "num_ctas": 1,
            "num_stages": 2,
            "max_nreg": null
          }
        },
        "32768": {
          "16": {
            "block_m": 32,
            "block_n": 16,
            "block_k": 128,
            "split_k": 8,
            "num_warps": 4,
            "num_ctas": 1,
            "num_stages": 2,
            "max_nreg": null
          }
        }
      }
    },
    "2": {
      "1": {
        "1024": {
          "16": {
            "block_m": 16,
            "block_n": 16,
            "block_k": 32,
            "split_k": 32,
            "num_warps": 8,
            "num_ctas": 1,
            "num_stages": 4,
            "max_nreg": null
          }
        },
        "2048": {
          "16": {
            "block_m": 16,
            "block_n": 16,
            "block_k": 32,
            "split_k": 64,
            "num_warps": 8,
            "num_ctas": 1,
            "num_stages": 2,
            "max_nreg": null
          }
        },
        "4096": {
          "16": {
            "block_m": 16,
            "block_n": 16,
            "block_k": 32,
            "split_k": 128,
            "num_warps": 8,
            "num_ctas": 1,
            "num_stages": 2,
            "max_nreg": null
          }
        },
        "8192": {
          "16": {
            "block_m": 16,
            "block_n": 16,
            "block_k": 64,
            "split_k": 128,
            "num_warps": 8,
            "num_ctas": 1,
            "num_stages": 2,
            "max_nreg": null
          }
        },
        "12288": {
          "16": {
            "block_m": 16,
            "block_n": 16,
            "block_k": 32,
            "split_k": 128,
            "num_warps": 8,
            "num_ctas": 1,
            "num_stages": 4,
            "max_nreg": null
          }
        },
        "16384": {
          "16": {
            "block_m": 16,
            "block_n": 16,
            "block_k": 64,
            "split_k": 128,
            "num_warps": 4,
            "num_ctas": 1,
            "num_stages": 4,
            "max_nreg": null
          }
        },
        "24576": {
          "16": {
            "block_m": 16,
            "block_n": 16,
            "block_k": 64,
            "split_k": 128,
            "num_warps": 4,
            "num_ctas": 1,
            "num_stages": 4,
            "max_nreg": null
          }
        },
        "32768": {
          "16": {
            "block_m": 16,
            "block_n": 16,
            "block_k": 128,
            "split_k": 128,
            "num_warps": 4,
            "num_ctas": 1,
            "num_stages": 4,
            "max_nreg": null
          }
        }
      },
      "16": {
        "1024": {
          "16": {
            "block_m": 16,
            "block_n": 16,
            "block_k": 32,
            "split_k": 32,
            "num_warps": 8,
            "num_ctas": 1,
            "num_stages": 4,
            "max_nreg": null
          }
        },
        "2048": {
          "16": {
            "block_m": 16,
            "block_n": 16,
            "block_k": 64,
            "split_k": 32,
            "num_warps": 8,
            "num_ctas": 1,
            "num_stages": 4,
            "max_nreg": null
          }
        },
        "4096": {
          "16": {
            "block_m": 16,
            "block_n": 16,
            "block_k": 64,
            "split_k": 64,
            "num_warps": 8,
            "num_ctas": 1,
            "num_stages": 4,
            "max_nreg": null
          }
        },
        "8192": {
          "16": {
            "block_m": 16,
            "block_n": 16,
            "block_k": 128,
            "split_k": 32,
            "num_warps": 8,
            "num_ctas": 1,
            "num_stages": 4,
            "max_nreg": null
          }
        },
        "12288": {
          "16": {
            "block_m": 16,
            "block_n": 16,
            "block_k": 64,
            "split_k": 64,
            "num_warps": 8,
            "num_ctas": 1,
            "num_stages": 4,
            "max_nreg": null
          }
        },
        "16384": {
          "16": {
            "block_m": 16,
            "block_n": 16,
            "block_k": 128,
            "split_k": 64,
            "num_warps": 4,
            "num_ctas": 1,
            "num_stages": 4,
            "max_nreg": null
          }
        },
        "24576": {
          "16": {
            "block_m": 16,
            "block_n": 16,
            "block_k": 128,
            "split_k": 64,
            "num_warps": 4,
            "num_ctas": 1,
            "num_stages": 4,
            "max_nreg": null
          }
        },
        "32768": {
          "16": {
            "block_m": 16,
            "block_n": 16,
            "block_k": 128,
            "split_k": 64,
            "num_warps": 4,
            "num_ctas": 1,
            "num_stages": 4,
            "max_nreg": null
          }
        }
      },
      "32": {
        "1024": {
          "16": {
            "block_m": 16,
            "block_n": 16,
            "block_k": 128,
            "split_k": 8,
            "num_warps": 4,
            "num_ctas": 1,
            "num_stages": 4,
            "max_nreg": null
          }
        },
        "2048": {
          "16": {
            "block_m": 16,
            "block_n": 16,
            "block_k": 32,
            "split_k": 64,
            "num_warps": 8,
            "num_ctas": 1,
            "num_stages": 2,
            "max_nreg": null
          }
        },
        "4096": {
          "16": {
            "block_m": 16,
            "block_n": 16,
            "block_k": 128,
            "split_k": 32,
            "num_warps": 8,
            "num_ctas": 1,
            "num_stages": 4,
            "max_nreg": null
          }
        },
        "8192": {
          "16": {
            "block_m": 16,
            "block_n": 16,
            "block_k": 256,
            "split_k": 32,
            "num_warps": 4,
            "num_ctas": 1,
            "num_stages": 4,
            "max_nreg": null
          }
        },
        "12288": {
          "16": {
            "block_m": 16,
            "block_n": 16,
            "block_k": 64,
            "split_k": 64,
            "num_warps": 4,
            "num_ctas": 1,
            "num_stages": 2,
            "max_nreg": null
          }
        },
        "16384": {
          "16": {
            "block_m": 16,
            "block_n": 16,
            "block_k": 128,
            "split_k": 64,
            "num_warps": 4,
            "num_ctas": 1,
            "num_stages": 4,
            "max_nreg": null
          }
        },
        "24576": {
          "16": {
            "block_m": 16,
            "block_n": 16,
            "block_k": 128,
            "split_k": 64,
            "num_warps": 4,
            "num_ctas": 1,
            "num_stages": 4,
            "max_nreg": null
          }
        },
        "32768": {
          "16": {
            "block_m": 16,
            "block_n": 16,
            "block_k": 128,
            "split_k": 64,
            "num_warps": 4,
            "num_ctas": 1,
            "num_stages": 4,
            "max_nreg": null
          }
        }
      },
      "64": {
        "1024": {
          "16": {
            "block_m": 32,
            "block_n": 16,
            "block_k": 128,
            "split_k": 8,
            "num_warps": 8,
            "num_ctas": 1,
            "num_stages": 4,
            "max_nreg": null
          }
        },
        "2048": {
          "16": {
            "block_m": 16,
            "block_n": 16,
            "block_k": 64,
            "split_k": 32,
            "num_warps": 8,
            "num_ctas": 1,
            "num_stages": 4,
            "max_nreg": null
          }
        },
        "4096": {
          "16": {
            "block_m": 16,
            "block_n": 16,
            "block_k": 128,
            "split_k": 32,
            "num_warps": 4,
            "num_ctas": 1,
            "num_stages": 2,
            "max_nreg": null
          }
        },
        "8192": {
          "16": {
            "block_m": 16,
            "block_n": 16,
            "block_k": 128,
            "split_k": 32,
            "num_warps": 4,
            "num_ctas": 1,
            "num_stages": 4,
            "max_nreg": null
          }
        },
        "12288": {
          "16": {
            "block_m": 16,
            "block_n": 16,
            "block_k": 64,
            "split_k": 64,
            "num_warps": 4,
            "num_ctas": 1,
            "num_stages": 4,
            "max_nreg": null
          }
        },
        "16384": {
          "16": {
            "block_m": 32,
            "block_n": 16,
            "block_k": 128,
            "split_k": 32,
            "num_warps": 8,
            "num_ctas": 1,
            "num_stages": 4,
            "max_nreg": null
          }
        },
        "24576": {
          "16": {
            "block_m": 32,
            "block_n": 16,
            "block_k": 64,
            "split_k": 64,
            "num_warps": 8,
            "num_ctas": 1,
            "num_stages": 4,
            "max_nreg": null
          }
        },
        "32768": {
          "16": {
            "block_m": 32,
            "block_n": 16,
            "block_k": 256,
            "split_k": 32,
            "num_warps": 4,
            "num_ctas": 1,
            "num_stages": 4,
            "max_nreg": null
          }
        }
      },
      "128": {
        "1024": {
          "16": {
            "block_m": 16,
            "block_n": 16,
            "block_k": 128,
            "split_k": 8,
            "num_warps": 8,
            "num_ctas": 1,
            "num_stages": 2,
            "max_nreg": null
          }
        },
        "2048": {
          "16": {
            "block_m": 16,
            "block_n": 16,
            "block_k": 256,
            "split_k": 8,
            "num_warps": 4,
            "num_ctas": 1,
            "num_stages": 4,
            "max_nreg": null
          }
        },
        "4096": {
          "16": {
            "block_m": 16,
            "block_n": 16,
            "block_k": 64,
            "split_k": 32,
            "num_warps": 4,
            "num_ctas": 1,
            "num_stages": 4,
            "max_nreg": null
          }
        },
        "8192": {
          "16": {
            "block_m": 16,
            "block_n": 16,
            "block_k": 64,
            "split_k": 32,
            "num_warps": 4,
            "num_ctas": 1,
            "num_stages": 4,
            "max_nreg": null
          }
        },
        "12288": {
          "16": {
            "block_m": 16,
            "block_n": 16,
            "block_k": 64,
            "split_k": 32,
            "num_warps": 4,
            "num_ctas": 1,
            "num_stages": 4,
            "max_nreg": null
          }
        },
        "16384": {
          "16": {
            "block_m": 16,
            "block_n": 16,
            "block_k": 64,
            "split_k": 32,
            "num_warps": 4,
            "num_ctas": 1,
            "num_stages": 4,
            "max_nreg": null
          }
        },
        "24576": {
          "16": {
            "block_m": 32,
            "block_n": 16,
            "block_k": 128,
            "split_k": 32,
            "num_warps": 4,
            "num_ctas": 1,
            "num_stages": 4,
            "max_nreg": null
          }
        },
        "32768": {
          "16": {
            "block_m": 32,
            "block_n": 16,
            "block_k": 128,
            "split_k": 32,
            "num_warps": 4,
            "num_ctas": 1,
            "num_stages": 2,
            "max_nreg": null
          }
        }
      },
      "192": {
        "1024": {
          "16": {
            "block_m": 32,
            "block_n": 16,
            "block_k": 64,
            "split_k": 8,
            "num_warps": 8,
            "num_ctas": 1,
            "num_stages": 4,
            "max_nreg": null
          }
        },
        "2048": {
          "16": {
            "block_m": 16,
            "block_n": 16,
            "block_k": 256,
            "split_k": 8,
            "num_warps": 4,
            "num_ctas": 1,
            "num_stages": 2,
            "max_nreg": null
          }
        },
        "4096": {
          "16": {
            "block_m": 16,
            "block_n": 16,
            "block_k": 256,
            "split_k": 8,
            "num_warps": 4,
            "num_ctas": 1,
            "num_stages": 4,
            "max_nreg": null
          }
        },
        "8192": {
          "16": {
            "block_m": 16,
            "block_n": 16,
            "block_k": 64,
            "split_k": 32,
            "num_warps": 4,
            "num_ctas": 1,
            "num_stages": 4,
            "max_nreg": null
          }
        },
        "12288": {
          "16": {
            "block_m": 32,
            "block_n": 16,
            "block_k": 128,
            "split_k": 32,
            "num_warps": 4,
            "num_ctas": 1,
            "num_stages": 4,
            "max_nreg": null
          }
        },
        "16384": {
          "16": {
            "block_m": 32,
            "block_n": 16,
            "block_k": 128,
            "split_k": 32,
            "num_warps": 4,
            "num_ctas": 1,
            "num_stages": 4,
            "max_nreg": null
          }
        },
        "24576": {
          "16": {
            "block_m": 32,
            "block_n": 16,
            "block_k": 128,
            "split_k": 32,
            "num_warps": 4,
            "num_ctas": 1,
            "num_stages": 4,
            "max_nreg": null
          }
        },
        "32768": {
          "16": {
            "block_m": 32,
            "block_n": 16,
            "block_k": 128,
            "split_k": 32,
            "num_warps": 4,
            "num_ctas": 1,
            "num_stages": 4,
            "max_nreg": null
          }
        }
      },
      "256": {
        "1024": {
          "16": {
            "block_m": 32,
            "block_n": 16,
            "block_k": 128,
            "split_k": 8,
            "num_warps": 8,
            "num_ctas": 1,
            "num_stages": 4,
            "max_nreg": null
          }
        },
        "2048": {
          "16": {
            "block_m": 16,
            "block_n": 16,
            "block_k": 128,
            "split_k": 8,
            "num_warps": 4,
            "num_ctas": 1,
            "num_stages": 4,
            "max_nreg": null
          }
        },
        "4096": {
          "16": {
            "block_m": 32,
            "block_n": 16,
            "block_k": 256,
            "split_k": 8,
            "num_warps": 4,
            "num_ctas": 1,
            "num_stages": 4,
            "max_nreg": null
          }
        },
        "8192": {
          "16": {
            "block_m": 32,
            "block_n": 16,
            "block_k": 64,
            "split_k": 32,
            "num_warps": 4,
            "num_ctas": 1,
            "num_stages": 4,
            "max_nreg": null
          }
        },
        "12288": {
          "16": {
            "block_m": 32,
            "block_n": 16,
            "block_k": 256,
            "split_k": 8,
            "num_warps": 4,
            "num_ctas": 1,
            "num_stages": 4,
            "max_nreg": null
          }
        },
        "16384": {
          "16": {
            "block_m": 64,
            "block_n": 16,
            "block_k": 512,
            "split_k": 8,
            "num_warps": 8,
            "num_ctas": 1,
            "num_stages": 2,
            "max_nreg": null
          }
        },
        "24576": {
          "16": {
            "block_m": 32,
            "block_n": 16,
            "block_k": 64,
            "split_k": 32,
            "num_warps": 4,
            "num_ctas": 1,
            "num_stages": 4,
            "max_nreg": null
          }
        },
        "32768": {
          "16": {
            "block_m": 64,
            "block_n": 16,
            "block_k": 128,
            "split_k": 32,
            "num_warps": 8,
            "num_ctas": 1,
            "num_stages": 4,
            "max_nreg": null
          }
        }
      },
      "320": {
        "1024": {
          "16": {
            "block_m": 16,
            "block_n": 16,
            "block_k": 128,
            "split_k": 8,
            "num_warps": 4,
            "num_ctas": 1,
            "num_stages": 4,
            "max_nreg": null
          }
        },
        "2048": {
          "16": {
            "block_m": 32,
            "block_n": 16,
            "block_k": 128,
            "split_k": 8,
            "num_warps": 8,
            "num_ctas": 1,
            "num_stages": 4,
            "max_nreg": null
          }
        },
        "4096": {
          "16": {
            "block_m": 64,
            "block_n": 16,
            "block_k": 512,
            "split_k": 8,
            "num_warps": 8,
            "num_ctas": 1,
            "num_stages": 2,
            "max_nreg": null
          }
        },
        "8192": {
          "16": {
            "block_m": 32,
            "block_n": 16,
            "block_k": 256,
            "split_k": 8,
            "num_warps": 4,
            "num_ctas": 1,
            "num_stages": 4,
            "max_nreg": null
          }
        },
        "12288": {
          "16": {
            "block_m": 64,
            "block_n": 16,
            "block_k": 512,
            "split_k": 8,
            "num_warps": 8,
            "num_ctas": 1,
            "num_stages": 2,
            "max_nreg": null
          }
        },
        "16384": {
          "16": {
            "block_m": 32,
            "block_n": 16,
            "block_k": 64,
            "split_k": 32,
            "num_warps": 4,
            "num_ctas": 1,
            "num_stages": 4,
            "max_nreg": null
          }
        },
        "24576": {
          "16": {
            "block_m": 32,
            "block_n": 16,
            "block_k": 64,
            "split_k": 32,
            "num_warps": 4,
            "num_ctas": 1,
            "num_stages": 4,
            "max_nreg": null
          }
        },
        "32768": {
          "16": {
            "block_m": 32,
            "block_n": 16,
            "block_k": 64,
            "split_k": 32,
            "num_warps": 4,
            "num_ctas": 1,
            "num_stages": 4,
            "max_nreg": null
          }
        }
      },
      "384": {
        "1024": {
          "16": {
            "block_m": 16,
            "block_n": 16,
            "block_k": 64,
            "split_k": 8,
            "num_warps": 4,
            "num_ctas": 1,
            "num_stages": 4,
            "max_nreg": null
          }
        },
        "2048": {
          "16": {
            "block_m": 32,
            "block_n": 16,
            "block_k": 128,
            "split_k": 8,
            "num_warps": 8,
            "num_ctas": 1,
            "num_stages": 4,
            "max_nreg": null
          }
        },
        "4096": {
          "16": {
            "block_m": 64,
            "block_n": 16,
            "block_k": 512,
            "split_k": 8,
            "num_warps": 8,
            "num_ctas": 1,
            "num_stages": 2,
            "max_nreg": null
          }
        },
        "8192": {
          "16": {
            "block_m": 64,
            "block_n": 16,
            "block_k": 512,
            "split_k": 8,
            "num_warps": 8,
            "num_ctas": 1,
            "num_stages": 2,
            "max_nreg": null
          }
        },
        "12288": {
          "16": {
            "block_m": 64,
            "block_n": 16,
            "block_k": 512,
            "split_k": 8,
            "num_warps": 8,
            "num_ctas": 1,
            "num_stages": 2,
            "max_nreg": null
          }
        },
        "16384": {
          "16": {
            "block_m": 64,
            "block_n": 16,
            "block_k": 512,
            "split_k": 8,
            "num_warps": 8,
            "num_ctas": 1,
            "num_stages": 2,
            "max_nreg": null
          }
        },
        "24576": {
          "16": {
            "block_m": 64,
            "block_n": 16,
            "block_k": 512,
            "split_k": 8,
            "num_warps": 8,
            "num_ctas": 1,
            "num_stages": 2,
            "max_nreg": null
          }
        },
        "32768": {
          "16": {
            "block_m": 32,
            "block_n": 16,
            "block_k": 256,
            "split_k": 8,
            "num_warps": 4,
            "num_ctas": 1,
            "num_stages": 4,
            "max_nreg": null
          }
        }
      },
      "448": {
        "1024": {
          "16": {
            "block_m": 16,
            "block_n": 16,
            "block_k": 64,
            "split_k": 8,
            "num_warps": 4,
            "num_ctas": 1,
            "num_stages": 2,
            "max_nreg": null
          }
        },
        "2048": {
          "16": {
            "block_m": 16,
            "block_n": 16,
            "block_k": 128,
            "split_k": 8,
            "num_warps": 4,
            "num_ctas": 1,
            "num_stages": 4,
            "max_nreg": null
          }
        },
        "4096": {
          "16": {
            "block_m": 64,
            "block_n": 16,
            "block_k": 512,
            "split_k": 8,
            "num_warps": 8,
            "num_ctas": 1,
            "num_stages": 2,
            "max_nreg": null
          }
        },
        "8192": {
          "16": {
            "block_m": 64,
            "block_n": 16,
            "block_k": 512,
            "split_k": 8,
            "num_warps": 8,
            "num_ctas": 1,
            "num_stages": 2,
            "max_nreg": null
          }
        },
        "12288": {
          "16": {
            "block_m": 64,
            "block_n": 16,
            "block_k": 512,
            "split_k": 8,
            "num_warps": 8,
            "num_ctas": 1,
            "num_stages": 2,
            "max_nreg": null
          }
        },
        "16384": {
          "16": {
            "block_m": 64,
            "block_n": 16,
            "block_k": 128,
            "split_k": 32,
            "num_warps": 4,
            "num_ctas": 1,
            "num_stages": 2,
            "max_nreg": null
          }
        },
        "24576": {
          "16": {
            "block_m": 32,
            "block_n": 16,
            "block_k": 256,
            "split_k": 8,
            "num_warps": 4,
            "num_ctas": 1,
            "num_stages": 4,
            "max_nreg": null
          }
        },
        "32768": {
          "16": {
            "block_m": 32,
            "block_n": 16,
            "block_k": 256,
            "split_k": 8,
            "num_warps": 4,
            "num_ctas": 1,
            "num_stages": 4,
            "max_nreg": null
          }
        }
      },
      "512": {
        "1024": {
          "16": {
            "block_m": 16,
            "block_n": 16,
            "block_k": 64,
            "split_k": 8,
            "num_warps": 4,
            "num_ctas": 1,
            "num_stages": 4,
            "max_nreg": null
          }
        },
        "2048": {
          "16": {
            "block_m": 16,
            "block_n": 16,
            "block_k": 64,
            "split_k": 8,
            "num_warps": 4,
            "num_ctas": 1,
            "num_stages": 4,
            "max_nreg": null
          }
        },
        "4096": {
          "16": {
            "block_m": 16,
            "block_n": 16,
            "block_k": 128,
            "split_k": 8,
            "num_warps": 4,
            "num_ctas": 1,
            "num_stages": 4,
            "max_nreg": null
          }
        },
        "8192": {
          "16": {
            "block_m": 32,
            "block_n": 16,
            "block_k": 128,
            "split_k": 8,
            "num_warps": 4,
            "num_ctas": 1,
            "num_stages": 4,
            "max_nreg": null
          }
        },
        "12288": {
          "16": {
            "block_m": 32,
            "block_n": 16,
            "block_k": 128,
            "split_k": 8,
            "num_warps": 4,
            "num_ctas": 1,
            "num_stages": 4,
            "max_nreg": null
          }
        },
        "16384": {
          "16": {
            "block_m": 64,
            "block_n": 16,
            "block_k": 128,
            "split_k": 32,
            "num_warps": 4,
            "num_ctas": 1,
            "num_stages": 2,
            "max_nreg": null
          }
        },
        "24576": {
          "16": {
            "block_m": 128,
            "block_n": 16,
            "block_k": 128,
            "split_k": 32,
            "num_warps": 8,
            "num_ctas": 1,
            "num_stages": 2,
            "max_nreg": null
          }
        },
        "32768": {
          "16": {
            "block_m": 64,
            "block_n": 16,
            "block_k": 128,
            "split_k": 32,
            "num_warps": 4,
            "num_ctas": 1,
            "num_stages": 2,
            "max_nreg": null
          }
        }
      },
      "640": {
        "1024": {
          "16": {
            "block_m": 16,
            "block_n": 16,
            "block_k": 64,
            "split_k": 8,
            "num_warps": 4,
            "num_ctas": 1,
            "num_stages": 4,
            "max_nreg": null
          }
        },
        "2048": {
          "16": {
            "block_m": 32,
            "block_n": 16,
            "block_k": 128,
            "split_k": 8,
            "num_warps": 4,
            "num_ctas": 1,
            "num_stages": 2,
            "max_nreg": null
          }
        },
        "4096": {
          "16": {
            "block_m": 32,
            "block_n": 16,
            "block_k": 128,
            "split_k": 8,
            "num_warps": 4,
            "num_ctas": 1,
            "num_stages": 2,
            "max_nreg": null
          }
        },
        "8192": {
          "16": {
            "block_m": 128,
            "block_n": 16,
            "block_k": 256,
            "split_k": 8,
            "num_warps": 8,
            "num_ctas": 1,
            "num_stages": 2,
            "max_nreg": null
          }
        },
        "12288": {
          "16": {
            "block_m": 32,
            "block_n": 16,
            "block_k": 128,
            "split_k": 8,
            "num_warps": 4,
            "num_ctas": 1,
            "num_stages": 4,
            "max_nreg": null
          }
        },
        "16384": {
          "16": {
            "block_m": 32,
            "block_n": 16,
            "block_k": 128,
            "split_k": 8,
            "num_warps": 4,
            "num_ctas": 1,
            "num_stages": 4,
            "max_nreg": null
          }
        },
        "24576": {
          "16": {
            "block_m": 32,
            "block_n": 16,
            "block_k": 128,
            "split_k": 8,
            "num_warps": 4,
            "num_ctas": 1,
            "num_stages": 4,
            "max_nreg": null
          }
        },
        "32768": {
          "16": {
            "block_m": 32,
            "block_n": 16,
            "block_k": 128,
            "split_k": 8,
            "num_warps": 4,
            "num_ctas": 1,
            "num_stages": 4,
            "max_nreg": null
          }
        }
      },
      "768": {
        "1024": {
          "16": {
            "block_m": 32,
            "block_n": 16,
            "block_k": 64,
            "split_k": 8,
            "num_warps": 8,
            "num_ctas": 1,
            "num_stages": 2,
            "max_nreg": null
          }
        },
        "2048": {
          "16": {
            "block_m": 16,
            "block_n": 16,
            "block_k": 64,
            "split_k": 8,
            "num_warps": 4,
            "num_ctas": 1,
            "num_stages": 4,
            "max_nreg": null
          }
        },
        "4096": {
          "16": {
            "block_m": 32,
            "block_n": 16,
            "block_k": 128,
            "split_k": 8,
            "num_warps": 4,
            "num_ctas": 1,
            "num_stages": 4,
            "max_nreg": null
          }
        },
        "8192": {
          "16": {
            "block_m": 32,
            "block_n": 16,
            "block_k": 128,
            "split_k": 8,
            "num_warps": 4,
            "num_ctas": 1,
            "num_stages": 4,
            "max_nreg": null
          }
        },
        "12288": {
          "16": {
            "block_m": 32,
            "block_n": 16,
            "block_k": 128,
            "split_k": 8,
            "num_warps": 4,
            "num_ctas": 1,
            "num_stages": 4,
            "max_nreg": null
          }
        },
        "16384": {
          "16": {
            "block_m": 32,
            "block_n": 16,
            "block_k": 128,
            "split_k": 8,
            "num_warps": 4,
            "num_ctas": 1,
            "num_stages": 4,
            "max_nreg": null
          }
        },
        "24576": {
          "16": {
            "block_m": 32,
            "block_n": 16,
            "block_k": 128,
            "split_k": 8,
            "num_warps": 4,
            "num_ctas": 1,
            "num_stages": 4,
            "max_nreg": null
          }
        },
        "32768": {
          "16": {
            "block_m": 32,
            "block_n": 16,
            "block_k": 128,
            "split_k": 8,
            "num_warps": 4,
            "num_ctas": 1,
            "num_stages": 4,
            "max_nreg": null
          }
        }
      },
      "896": {
        "1024": {
          "16": {
            "block_m": 32,
            "block_n": 16,
            "block_k": 64,
            "split_k": 8,
            "num_warps": 8,
            "num_ctas": 1,
            "num_stages": 4,
            "max_nreg": null
          }
        },
        "2048": {
          "16": {
            "block_m": 32,
            "block_n": 16,
            "block_k": 128,
            "split_k": 8,
            "num_warps": 4,
            "num_ctas": 1,
            "num_stages": 2,
            "max_nreg": null
          }
        },
        "4096": {
          "16": {
            "block_m": 32,
            "block_n": 16,
            "block_k": 128,
            "split_k": 8,
            "num_warps": 4,
            "num_ctas": 1,
            "num_stages": 4,
            "max_nreg": null
          }
        },
        "8192": {
          "16": {
            "block_m": 128,
            "block_n": 16,
            "block_k": 256,
            "split_k": 8,
            "num_warps": 8,
            "num_ctas": 1,
            "num_stages": 2,
            "max_nreg": null
          }
        },
        "12288": {
          "16": {
            "block_m": 32,
            "block_n": 16,
            "block_k": 128,
            "split_k": 8,
            "num_warps": 4,
            "num_ctas": 1,
            "num_stages": 4,
            "max_nreg": null
          }
        },
        "16384": {
          "16": {
            "block_m": 32,
            "block_n": 16,
            "block_k": 128,
            "split_k": 8,
            "num_warps": 4,
            "num_ctas": 1,
            "num_stages": 4,
            "max_nreg": null
          }
        },
        "24576": {
          "16": {
            "block_m": 32,
            "block_n": 16,
            "block_k": 128,
            "split_k": 8,
            "num_warps": 4,
            "num_ctas": 1,
            "num_stages": 4,
            "max_nreg": null
          }
        },
        "32768": {
          "16": {
            "block_m": 32,
            "block_n": 16,
            "block_k": 128,
            "split_k": 8,
            "num_warps": 4,
            "num_ctas": 1,
            "num_stages": 4,
            "max_nreg": null
          }
        }
      },
      "1024": {
        "1024": {
          "16": {
            "block_m": 64,
            "block_n": 16,
            "block_k": 128,
            "split_k": 8,
            "num_warps": 8,
            "num_ctas": 1,
            "num_stages": 2,
            "max_nreg": null
          }
        },
        "2048": {
          "16": {
            "block_m": 32,
            "block_n": 16,
            "block_k": 64,
            "split_k": 8,
            "num_warps": 4,
            "num_ctas": 1,
            "num_stages": 4,
            "max_nreg": null
          }
        },
        "4096": {
          "16": {
            "block_m": 64,
            "block_n": 16,
            "block_k": 128,
            "split_k": 8,
            "num_warps": 8,
            "num_ctas": 1,
            "num_stages": 2,
            "max_nreg": null
          }
        },
        "8192": {
          "16": {
            "block_m": 64,
            "block_n": 16,
            "block_k": 128,
            "split_k": 8,
            "num_warps": 8,
            "num_ctas": 1,
            "num_stages": 4,
            "max_nreg": null
          }
        },
        "12288": {
          "16": {
            "block_m": 64,
            "block_n": 16,
            "block_k": 128,
            "split_k": 8,
            "num_warps": 8,
            "num_ctas": 1,
            "num_stages": 4,
            "max_nreg": null
          }
        },
        "16384": {
          "16": {
            "block_m": 32,
            "block_n": 16,
            "block_k": 128,
            "split_k": 8,
            "num_warps": 4,
            "num_ctas": 1,
            "num_stages": 4,
            "max_nreg": null
          }
        },
        "24576": {
          "16": {
            "block_m": 64,
            "block_n": 16,
            "block_k": 32,
            "split_k": 32,
            "num_warps": 4,
            "num_ctas": 1,
            "num_stages": 4,
            "max_nreg": null
          }
        },
        "32768": {
          "16": {
            "block_m": 64,
            "block_n": 16,
            "block_k": 32,
            "split_k": 32,
            "num_warps": 4,
            "num_ctas": 1,
            "num_stages": 4,
            "max_nreg": null
          }
        }
      },
      "2048": {
        "1024": {
          "16": {
            "block_m": 64,
            "block_n": 16,
            "block_k": 64,
            "split_k": 8,
            "num_warps": 8,
            "num_ctas": 1,
            "num_stages": 4,
            "max_nreg": null
          }
        },
        "2048": {
          "16": {
            "block_m": 64,
            "block_n": 16,
            "block_k": 64,
            "split_k": 8,
            "num_warps": 8,
            "num_ctas": 1,
            "num_stages": 4,
            "max_nreg": null
          }
        },
        "4096": {
          "16": {
            "block_m": 128,
            "block_n": 16,
            "block_k": 128,
            "split_k": 8,
            "num_warps": 8,
            "num_ctas": 1,
            "num_stages": 2,
            "max_nreg": null
          }
        },
        "8192": {
          "16": {
            "block_m": 64,
            "block_n": 16,
            "block_k": 128,
            "split_k": 8,
            "num_warps": 4,
            "num_ctas": 1,
            "num_stages": 2,
            "max_nreg": null
          }
        },
        "12288": {
          "16": {
            "block_m": 64,
            "block_n": 16,
            "block_k": 64,
            "split_k": 8,
            "num_warps": 8,
            "num_ctas": 1,
            "num_stages": 4,
            "max_nreg": null
          }
        },
        "16384": {
          "16": {
            "block_m": 128,
            "block_n": 16,
            "block_k": 128,
            "split_k": 8,
            "num_warps": 4,
            "num_ctas": 1,
            "num_stages": 2,
            "max_nreg": null
          }
        },
        "24576": {
          "16": {
            "block_m": 128,
            "block_n": 16,
            "block_k": 128,
            "split_k": 8,
            "num_warps": 4,
            "num_ctas": 1,
            "num_stages": 2,
            "max_nreg": null
          }
        },
        "32768": {
          "16": {
            "block_m": 64,
            "block_n": 16,
            "block_k": 128,
            "split_k": 8,
            "num_warps": 4,
            "num_ctas": 1,
            "num_stages": 2,
            "max_nreg": null
          }
        }
      },
      "3072": {
        "1024": {
          "16": {
            "block_m": 64,
            "block_n": 16,
            "block_k": 64,
            "split_k": 8,
            "num_warps": 4,
            "num_ctas": 1,
            "num_stages": 2,
            "max_nreg": null
          }
        },
        "2048": {
          "16": {
            "block_m": 64,
            "block_n": 16,
            "block_k": 64,
            "split_k": 8,
            "num_warps": 4,
            "num_ctas": 1,
            "num_stages": 2,
            "max_nreg": null
          }
        },
        "4096": {
          "16": {
            "block_m": 64,
            "block_n": 16,
            "block_k": 64,
            "split_k": 8,
            "num_warps": 4,
            "num_ctas": 1,
            "num_stages": 2,
            "max_nreg": null
          }
        },
        "8192": {
          "16": {
            "block_m": 64,
            "block_n": 16,
            "block_k": 32,
            "split_k": 8,
            "num_warps": 4,
            "num_ctas": 1,
            "num_stages": 4,
            "max_nreg": null
          }
        },
        "12288": {
          "16": {
            "block_m": 64,
            "block_n": 16,
            "block_k": 32,
            "split_k": 8,
            "num_warps": 4,
            "num_ctas": 1,
            "num_stages": 4,
            "max_nreg": null
          }
        },
        "16384": {
          "16": {
            "block_m": 64,
            "block_n": 16,
            "block_k": 64,
            "split_k": 8,
            "num_warps": 4,
            "num_ctas": 1,
            "num_stages": 4,
            "max_nreg": null
          }
        },
        "24576": {
          "16": {
            "block_m": 64,
            "block_n": 16,
            "block_k": 64,
            "split_k": 8,
            "num_warps": 4,
            "num_ctas": 1,
            "num_stages": 4,
            "max_nreg": null
          }
        },
        "32768": {
          "16": {
            "block_m": 64,
            "block_n": 16,
            "block_k": 64,
            "split_k": 8,
            "num_warps": 4,
            "num_ctas": 1,
            "num_stages": 4,
            "max_nreg": null
          }
        }
      },
      "4096": {
        "1024": {
          "16": {
            "block_m": 64,
            "block_n": 16,
            "block_k": 64,
            "split_k": 8,
            "num_warps": 4,
            "num_ctas": 1,
            "num_stages": 2,
            "max_nreg": null
          }
        },
        "2048": {
          "16": {
            "block_m": 64,
            "block_n": 16,
            "block_k": 64,
            "split_k": 8,
            "num_warps": 4,
            "num_ctas": 1,
            "num_stages": 2,
            "max_nreg": null
          }
        },
        "4096": {
          "16": {
            "block_m": 64,
            "block_n": 16,
            "block_k": 64,
            "split_k": 8,
            "num_warps": 4,
            "num_ctas": 1,
            "num_stages": 2,
            "max_nreg": null
          }
        },
        "8192": {
          "16": {
            "block_m": 64,
            "block_n": 16,
            "block_k": 32,
            "split_k": 8,
            "num_warps": 4,
            "num_ctas": 1,
            "num_stages": 4,
            "max_nreg": null
          }
        },
        "12288": {
          "16": {
            "block_m": 64,
            "block_n": 16,
            "block_k": 32,
            "split_k": 8,
            "num_warps": 4,
            "num_ctas": 1,
            "num_stages": 4,
            "max_nreg": null
          }
        },
        "16384": {
          "16": {
            "block_m": 64,
            "block_n": 16,
            "block_k": 32,
            "split_k": 8,
            "num_warps": 4,
            "num_ctas": 1,
            "num_stages": 4,
            "max_nreg": null
          }
        },
        "24576": {
          "16": {
            "block_m": 64,
            "block_n": 16,
            "block_k": 32,
            "split_k": 8,
            "num_warps": 4,
            "num_ctas": 1,
            "num_stages": 4,
            "max_nreg": null
          }
        },
        "32768": {
          "16": {
            "block_m": 64,
            "block_n": 16,
            "block_k": 32,
            "split_k": 8,
            "num_warps": 4,
            "num_ctas": 1,
            "num_stages": 4,
            "max_nreg": null
          }
        }
      },
      "5120": {
        "1024": {
          "16": {
            "block_m": 64,
            "block_n": 16,
            "block_k": 32,
            "split_k": 8,
            "num_warps": 4,
            "num_ctas": 1,
            "num_stages": 2,
            "max_nreg": null
          }
        },
        "2048": {
          "16": {
            "block_m": 128,
            "block_n": 16,
            "block_k": 64,
            "split_k": 8,
            "num_warps": 8,
            "num_ctas": 1,
            "num_stages": 2,
            "max_nreg": null
          }
        },
        "4096": {
          "16": {
            "block_m": 64,
            "block_n": 16,
            "block_k": 32,
            "split_k": 8,
            "num_warps": 4,
            "num_ctas": 1,
            "num_stages": 4,
            "max_nreg": null
          }
        },
        "8192": {
          "16": {
            "block_m": 64,
            "block_n": 16,
            "block_k": 32,
            "split_k": 8,
            "num_warps": 4,
            "num_ctas": 1,
            "num_stages": 4,
            "max_nreg": null
          }
        },
        "12288": {
          "16": {
            "block_m": 64,
            "block_n": 16,
            "block_k": 32,
            "split_k": 8,
            "num_warps": 4,
            "num_ctas": 1,
            "num_stages": 4,
            "max_nreg": null
          }
        },
        "16384": {
          "16": {
            "block_m": 64,
            "block_n": 16,
            "block_k": 32,
            "split_k": 8,
            "num_warps": 4,
            "num_ctas": 1,
            "num_stages": 4,
            "max_nreg": null
          }
        },
        "24576": {
          "16": {
            "block_m": 64,
            "block_n": 16,
            "block_k": 32,
            "split_k": 8,
            "num_warps": 4,
            "num_ctas": 1,
            "num_stages": 4,
            "max_nreg": null
          }
        },
        "32768": {
          "16": {
            "block_m": 128,
            "block_n": 16,
            "block_k": 32,
            "split_k": 8,
            "num_warps": 8,
            "num_ctas": 1,
            "num_stages": 4,
            "max_nreg": null
          }
        }
      },
      "6144": {
        "1024": {
          "16": {
            "block_m": 128,
            "block_n": 16,
            "block_k": 32,
            "split_k": 8,
            "num_warps": 8,
            "num_ctas": 1,
            "num_stages": 4,
            "max_nreg": null
          }
        },
        "2048": {
          "16": {
            "block_m": 128,
            "block_n": 16,
            "block_k": 32,
            "split_k": 8,
            "num_warps": 8,
            "num_ctas": 1,
            "num_stages": 4,
            "max_nreg": null
          }
        },
        "4096": {
          "16": {
            "block_m": 128,
            "block_n": 16,
            "block_k": 64,
            "split_k": 8,
            "num_warps": 4,
            "num_ctas": 1,
            "num_stages": 2,
            "max_nreg": null
          }
        },
        "8192": {
          "16": {
            "block_m": 64,
            "block_n": 16,
            "block_k": 64,
            "split_k": 8,
            "num_warps": 4,
            "num_ctas": 1,
            "num_stages": 4,
            "max_nreg": null
          }
        },
        "12288": {
          "16": {
            "block_m": 64,
            "block_n": 16,
            "block_k": 64,
            "split_k": 8,
            "num_warps": 4,
            "num_ctas": 1,
            "num_stages": 4,
            "max_nreg": null
          }
        },
        "16384": {
          "16": {
            "block_m": 64,
            "block_n": 16,
            "block_k": 64,
            "split_k": 8,
            "num_warps": 4,
            "num_ctas": 1,
            "num_stages": 4,
            "max_nreg": null
          }
        },
        "24576": {
          "16": {
            "block_m": 64,
            "block_n": 16,
            "block_k": 64,
            "split_k": 8,
            "num_warps": 4,
            "num_ctas": 1,
            "num_stages": 4,
            "max_nreg": null
          }
        },
        "32768": {
          "16": {
            "block_m": 128,
            "block_n": 16,
            "block_k": 128,
            "split_k": 8,
            "num_warps": 4,
            "num_ctas": 1,
            "num_stages": 2,
            "max_nreg": null
          }
        }
      },
      "7168": {
        "1024": {
          "16": {
            "block_m": 128,
            "block_n": 16,
            "block_k": 32,
            "split_k": 8,
            "num_warps": 4,
            "num_ctas": 1,
            "num_stages": 2,
            "max_nreg": null
          }
        },
        "2048": {
          "16": {
            "block_m": 64,
            "block_n": 16,
            "block_k": 64,
            "split_k": 8,
            "num_warps": 4,
            "num_ctas": 1,
            "num_stages": 2,
            "max_nreg": null
          }
        },
        "4096": {
          "16": {
            "block_m": 128,
            "block_n": 16,
            "block_k": 32,
            "split_k": 8,
            "num_warps": 4,
            "num_ctas": 1,
            "num_stages": 2,
            "max_nreg": null
          }
        },
        "8192": {
          "16": {
            "block_m": 128,
            "block_n": 16,
            "block_k": 32,
            "split_k": 8,
            "num_warps": 4,
            "num_ctas": 1,
            "num_stages": 2,
            "max_nreg": null
          }
        },
        "12288": {
          "16": {
            "block_m": 128,
            "block_n": 16,
            "block_k": 32,
            "split_k": 8,
            "num_warps": 4,
            "num_ctas": 1,
            "num_stages": 2,
            "max_nreg": null
          }
        },
        "16384": {
          "16": {
            "block_m": 128,
            "block_n": 16,
            "block_k": 32,
            "split_k": 8,
            "num_warps": 4,
            "num_ctas": 1,
            "num_stages": 2,
            "max_nreg": null
          }
        },
        "24576": {
          "16": {
            "block_m": 128,
            "block_n": 16,
            "block_k": 32,
            "split_k": 8,
            "num_warps": 4,
            "num_ctas": 1,
            "num_stages": 2,
            "max_nreg": null
          }
        },
        "32768": {
          "16": {
            "block_m": 128,
            "block_n": 16,
            "block_k": 32,
            "split_k": 8,
            "num_warps": 4,
            "num_ctas": 1,
            "num_stages": 2,
            "max_nreg": null
          }
        }
      },
      "8192": {
        "1024": {
          "16": {
            "block_m": 128,
            "block_n": 16,
            "block_k": 32,
            "split_k": 8,
            "num_warps": 4,
            "num_ctas": 1,
            "num_stages": 2,
            "max_nreg": null
          }
        },
        "2048": {
          "16": {
            "block_m": 64,
            "block_n": 16,
            "block_k": 64,
            "split_k": 8,
            "num_warps": 4,
            "num_ctas": 1,
            "num_stages": 2,
            "max_nreg": null
          }
        },
        "4096": {
          "16": {
            "block_m": 128,
            "block_n": 16,
            "block_k": 32,
            "split_k": 8,
            "num_warps": 4,
            "num_ctas": 1,
            "num_stages": 2,
            "max_nreg": null
          }
        },
        "8192": {
          "16": {
            "block_m": 128,
            "block_n": 16,
            "block_k": 32,
            "split_k": 8,
            "num_warps": 4,
            "num_ctas": 1,
            "num_stages": 2,
            "max_nreg": null
          }
        },
        "12288": {
          "16": {
            "block_m": 256,
            "block_n": 16,
            "block_k": 32,
            "split_k": 8,
            "num_warps": 4,
            "num_ctas": 1,
            "num_stages": 2,
            "max_nreg": null
          }
        },
        "16384": {
          "16": {
            "block_m": 128,
            "block_n": 16,
            "block_k": 32,
            "split_k": 8,
            "num_warps": 4,
            "num_ctas": 1,
            "num_stages": 2,
            "max_nreg": null
          }
        },
        "24576": {
          "16": {
            "block_m": 128,
            "block_n": 16,
            "block_k": 32,
            "split_k": 8,
            "num_warps": 4,
            "num_ctas": 1,
            "num_stages": 2,
            "max_nreg": null
          }
        },
        "32768": {
          "16": {
            "block_m": 128,
            "block_n": 16,
            "block_k": 32,
            "split_k": 8,
            "num_warps": 4,
            "num_ctas": 1,
            "num_stages": 2,
            "max_nreg": null
          }
        }
      }
    },
    "3": {
      "1": {
        "1024": {
          "16": {
            "block_m": 16,
            "block_n": 16,
            "block_k": 32,
            "split_k": 32,
            "num_warps": 8,
            "num_ctas": 1,
            "num_stages": 2,
            "max_nreg": null
          }
        },
        "2048": {
          "16": {
            "block_m": 16,
            "block_n": 16,
            "block_k": 64,
            "split_k": 32,
            "num_warps": 8,
            "num_ctas": 1,
            "num_stages": 4,
            "max_nreg": null
          }
        },
        "4096": {
          "16": {
            "block_m": 16,
            "block_n": 16,
            "block_k": 64,
            "split_k": 64,
            "num_warps": 8,
            "num_ctas": 1,
            "num_stages": 4,
            "max_nreg": null
          }
        },
        "8192": {
          "16": {
            "block_m": 16,
            "block_n": 16,
            "block_k": 32,
            "split_k": 128,
            "num_warps": 8,
            "num_ctas": 1,
            "num_stages": 4,
            "max_nreg": null
          }
        },
        "12288": {
          "16": {
            "block_m": 16,
            "block_n": 16,
            "block_k": 32,
            "split_k": 128,
            "num_warps": 8,
            "num_ctas": 1,
            "num_stages": 4,
            "max_nreg": null
          }
        },
        "16384": {
          "16": {
            "block_m": 16,
            "block_n": 16,
            "block_k": 64,
            "split_k": 128,
            "num_warps": 4,
            "num_ctas": 1,
            "num_stages": 2,
            "max_nreg": null
          }
        },
        "24576": {
          "16": {
            "block_m": 16,
            "block_n": 16,
            "block_k": 64,
            "split_k": 128,
            "num_warps": 4,
            "num_ctas": 1,
            "num_stages": 2,
            "max_nreg": null
          }
        },
        "32768": {
          "16": {
            "block_m": 16,
            "block_n": 16,
            "block_k": 64,
            "split_k": 128,
            "num_warps": 4,
            "num_ctas": 1,
            "num_stages": 4,
            "max_nreg": null
          }
        }
      },
      "16": {
        "1024": {
          "16": {
            "block_m": 16,
            "block_n": 16,
            "block_k": 32,
            "split_k": 32,
            "num_warps": 8,
            "num_ctas": 1,
            "num_stages": 2,
            "max_nreg": null
          }
        },
        "2048": {
          "16": {
            "block_m": 16,
            "block_n": 16,
            "block_k": 64,
            "split_k": 32,
            "num_warps": 8,
            "num_ctas": 1,
            "num_stages": 4,
            "max_nreg": null
          }
        },
        "4096": {
          "16": {
            "block_m": 16,
            "block_n": 16,
            "block_k": 128,
            "split_k": 32,
            "num_warps": 4,
            "num_ctas": 1,
            "num_stages": 4,
            "max_nreg": null
          }
        },
        "8192": {
          "16": {
            "block_m": 16,
            "block_n": 16,
            "block_k": 64,
            "split_k": 64,
            "num_warps": 4,
            "num_ctas": 1,
            "num_stages": 4,
            "max_nreg": null
          }
        },
        "12288": {
          "16": {
            "block_m": 16,
            "block_n": 16,
            "block_k": 128,
            "split_k": 32,
            "num_warps": 4,
            "num_ctas": 1,
            "num_stages": 4,
            "max_nreg": null
          }
        },
        "16384": {
          "16": {
            "block_m": 16,
            "block_n": 16,
            "block_k": 64,
            "split_k": 64,
            "num_warps": 4,
            "num_ctas": 1,
            "num_stages": 4,
            "max_nreg": null
          }
        },
        "24576": {
          "16": {
            "block_m": 16,
            "block_n": 16,
            "block_k": 64,
            "split_k": 64,
            "num_warps": 4,
            "num_ctas": 1,
            "num_stages": 4,
            "max_nreg": null
          }
        },
        "32768": {
          "16": {
            "block_m": 16,
            "block_n": 16,
            "block_k": 64,
            "split_k": 64,
            "num_warps": 4,
            "num_ctas": 1,
            "num_stages": 4,
            "max_nreg": null
          }
        }
      },
      "32": {
        "1024": {
          "16": {
            "block_m": 32,
            "block_n": 16,
            "block_k": 32,
            "split_k": 32,
            "num_warps": 8,
            "num_ctas": 1,
            "num_stages": 2,
            "max_nreg": null
          }
        },
        "2048": {
          "16": {
            "block_m": 16,
            "block_n": 16,
            "block_k": 256,
            "split_k": 8,
            "num_warps": 8,
            "num_ctas": 1,
            "num_stages": 4,
            "max_nreg": null
          }
        },
        "4096": {
          "16": {
            "block_m": 16,
            "block_n": 16,
            "block_k": 64,
            "split_k": 32,
            "num_warps": 8,
            "num_ctas": 1,
            "num_stages": 2,
            "max_nreg": null
          }
        },
        "8192": {
          "16": {
            "block_m": 16,
            "block_n": 16,
            "block_k": 128,
            "split_k": 32,
            "num_warps": 4,
            "num_ctas": 1,
            "num_stages": 4,
            "max_nreg": null
          }
        },
        "12288": {
          "16": {
            "block_m": 16,
            "block_n": 16,
            "block_k": 128,
            "split_k": 32,
            "num_warps": 4,
            "num_ctas": 1,
            "num_stages": 4,
            "max_nreg": null
          }
        },
        "16384": {
          "16": {
            "block_m": 16,
            "block_n": 16,
            "block_k": 64,
            "split_k": 64,
            "num_warps": 4,
            "num_ctas": 1,
            "num_stages": 4,
            "max_nreg": null
          }
        },
        "24576": {
          "16": {
            "block_m": 16,
            "block_n": 16,
            "block_k": 64,
            "split_k": 64,
            "num_warps": 4,
            "num_ctas": 1,
