vllm/model_executor/layers/fused_moe/configs/E=128,N=768,device_name=AMD_Instinct_MI308X.json
{
    "triton_version": "3.4.0",
    "1": {
        "BLOCK_SIZE_M": 16,
        "BLOCK_SIZE_N": 32,
        "BLOCK_SIZE_K": 64,
        "GROUP_SIZE_M": 1,
        "num_warps": 2,
        "num_stages": 2,
        "waves_per_eu": 2,
        "matrix_instr_nonkdim": 16,
        "kpack": 1
    },
    "2": {
        "BLOCK_SIZE_M": 16,
        "BLOCK_SIZE_N": 32,
        "BLOCK_SIZE_K": 64,
        "GROUP_SIZE_M": 1,
        "num_warps": 2,
        "num_stages": 2,
        "waves_per_eu": 1,
        "matrix_instr_nonkdim": 16,
        "kpack": 2
    },
    "4": {
        "BLOCK_SIZE_M": 16,
        "BLOCK_SIZE_N": 64,
        "BLOCK_SIZE_K": 128,
        "GROUP_SIZE_M": 1,
        "num_warps": 4,
        "num_stages": 2,
        "waves_per_eu": 4,
        "matrix_instr_nonkdim": 16,
        "kpack": 2
    },
    "8": {
        "BLOCK_SIZE_M": 16,
        "BLOCK_SIZE_N": 16,
        "BLOCK_SIZE_K": 64,
        "GROUP_SIZE_M": 1,
        "num_warps": 1,
        "num_stages": 2,
        "waves_per_eu": 4,
        "matrix_instr_nonkdim": 16,
        "kpack": 2
    },

    "16": {
        "BLOCK_SIZE_M": 16,
        "BLOCK_SIZE_N": 64,
        "BLOCK_SIZE_K": 128,
        "GROUP_SIZE_M": 1,
        "num_warps": 4,
        "num_stages": 2,
        "waves_per_eu": 2,
        "matrix_instr_nonkdim": 16,
        "kpack": 2
    },
    "24": {
        "BLOCK_SIZE_M": 16,
        "BLOCK_SIZE_N": 32,
        "BLOCK_SIZE_K": 128,
        "GROUP_SIZE_M": 4,
        "num_warps": 2,
        "num_stages": 2,
        "waves_per_eu": 2,
        "matrix_instr_nonkdim": 16,
        "kpack": 2
    },
    "32": {
        "BLOCK_SIZE_M": 16,
        "BLOCK_SIZE_N": 64,
        "BLOCK_SIZE_K": 128,
        "GROUP_SIZE_M": 1,
        "num_warps": 4,
        "num_stages": 2,
        "waves_per_eu": 4,
        "matrix_instr_nonkdim": 16,
        "kpack": 2
    },
    "48": {
        "BLOCK_SIZE_M": 16,
        "BLOCK_SIZE_N": 64,
        "BLOCK_SIZE_K": 128,
        "GROUP_SIZE_M": 1,
        "num_warps": 4,
        "num_stages": 2,
        "waves_per_eu": 4,
        "matrix_instr_nonkdim": 16,
        "kpack": 2
    },
    "64": {
        "BLOCK_SIZE_M": 16,
        "BLOCK_SIZE_N": 64,
        "BLOCK_SIZE_K": 128,
        "GROUP_SIZE_M": 1,
        "num_warps": 4,
        "num_stages": 2,
        "waves_per_eu": 2,
        "matrix_instr_nonkdim": 16,
        "kpack": 2
    },
    "96": {
        "BLOCK_SIZE_M": 16,
        "BLOCK_SIZE_N": 64,
        "BLOCK_SIZE_K": 128,
        "GROUP_SIZE_M": 32,
        "num_warps": 4,
        "num_stages": 2,
        "waves_per_eu": 1,
        "matrix_instr_nonkdim": 16,
        "kpack": 2
    },
    "128": {
        "BLOCK_SIZE_M": 16,
        "BLOCK_SIZE_N": 32,
        "BLOCK_SIZE_K": 64,
        "GROUP_SIZE_M": 4,
        "num_warps": 2,
        "num_stages": 2,
        "waves_per_eu": 1,
        "matrix_instr_nonkdim": 16,
        "kpack": 1
    },
    "256": {
        "BLOCK_SIZE_M": 32,
        "BLOCK_SIZE_N": 32,
        "BLOCK_SIZE_K": 64,
        "GROUP_SIZE_M": 4,
        "num_warps": 2,
        "num_stages": 2,
        "waves_per_eu": 4,
        "matrix_instr_nonkdim": 16,
        "kpack": 2
    },
    "512": {
        "BLOCK_SIZE_M": 64,
        "BLOCK_SIZE_N": 64,
        "BLOCK_SIZE_K": 64,
        "GROUP_SIZE_M": 8,
        "num_warps": 4,
        "num_stages": 2,
        "waves_per_eu": 1,
        "matrix_instr_nonkdim": 16,
        "kpack": 2
    },
    "768": {
        "BLOCK_SIZE_M": 64,
        "BLOCK_SIZE_N": 64,
        "BLOCK_SIZE_K": 128,
        "GROUP_SIZE_M": 1,
        "num_warps": 4,
        "num_stages": 2,
        "waves_per_eu": 2,
        "matrix_instr_nonkdim": 16,
        "kpack": 2
    },
    "1024": {
        "BLOCK_SIZE_M": 64,
        "BLOCK_SIZE_N": 64,
        "BLOCK_SIZE_K": 64,
        "GROUP_SIZE_M": 1,
        "num_warps": 4,
        "num_stages": 2,
        "waves_per_eu": 4,
        "matrix_instr_nonkdim": 16,
        "kpack": 2
    },
    "1536": {
        "BLOCK_SIZE_M": 128,
        "BLOCK_SIZE_N": 128,
        "BLOCK_SIZE_K": 64,
        "GROUP_SIZE_M": 4,
        "num_warps": 4,
        "num_stages": 2,
        "waves_per_eu": 0,
        "matrix_instr_nonkdim": 16,
        "kpack": 1
    },
    "2048": {
        "BLOCK_SIZE_M": 128,
        "BLOCK_SIZE_N": 128,
        "BLOCK_SIZE_K": 64,
        "GROUP_SIZE_M": 1,
        "num_warps": 4,
        "num_stages": 2,
        "waves_per_eu": 0,
        "matrix_instr_nonkdim": 16,
        "kpack": 2
    },
    "3072": {
        "BLOCK_SIZE_M": 128,
        "BLOCK_SIZE_N": 128,
        "BLOCK_SIZE_K": 64,
        "GROUP_SIZE_M": 1,
        "num_warps": 4,
        "num_stages": 2,
        "waves_per_eu": 0,
        "matrix_instr_nonkdim": 16,
        "kpack": 2
    },
    "4096": {
        "BLOCK_SIZE_M": 128,
        "BLOCK_SIZE_N": 128,
        "BLOCK_SIZE_K": 64,
        "GROUP_SIZE_M": 1,
        "num_warps": 4,
        "num_stages": 2,
        "waves_per_eu": 0,
        "matrix_instr_nonkdim": 16,
        "kpack": 2
    }
}
