vllm/model_executor/layers/fused_moe/configs/E=128,N=384,device_name=AMD_Instinct_MI300X.json
{
    "1": {
        "BLOCK_SIZE_M": 16,
        "BLOCK_SIZE_N": 64,
        "BLOCK_SIZE_K": 128,
        "GROUP_SIZE_M": 1,
        "SPLIT_K": 1,
        "num_warps": 4,
        "num_stages": 2
    },
    "1024": {
        "BLOCK_SIZE_M": 128,
        "BLOCK_SIZE_N": 128,
        "BLOCK_SIZE_K": 64,
        "GROUP_SIZE_M": 8,
        "SPLIT_K": 1,
        "num_warps": 8,
        "num_stages": 2,
        "waves_per_eu": 0,
        "matrix_instr_nonkdim": 16,
        "kpack": 2
    },
    "8192": {
        "BLOCK_SIZE_M": 128,
        "BLOCK_SIZE_N": 128,
        "BLOCK_SIZE_K": 64,
        "GROUP_SIZE_M": 8,
        "SPLIT_K": 1,
        "num_warps": 8,
        "num_stages": 2,
        "waves_per_eu": 0,
        "matrix_instr_nonkdim": 16,
        "kpack": 2
    }
}
