vllm/model_executor/layers/fused_moe/configs/E=128,N=192,device_name=NVIDIA_GeForce_RTX_2080_Ti,dtype=int4_w4a16.json
{
  "1": {
    "BLOCK_SIZE_M": 16,
    "BLOCK_SIZE_N": 64,
    "BLOCK_SIZE_K": 64,
    "GROUP_SIZE_M": 1,
    "num_warps": 4,
    "num_stages": 2
  },
  "8": {
    "BLOCK_SIZE_M": 32,
    "BLOCK_SIZE_N": 64,
    "BLOCK_SIZE_K": 64,
    "GROUP_SIZE_M": 1,
    "num_warps": 4,
    "num_stages": 2
  },
  "16": {
    "BLOCK_SIZE_M": 64,
    "BLOCK_SIZE_N": 64,
    "BLOCK_SIZE_K": 64,
    "GROUP_SIZE_M": 1,
    "num_warps": 4,
    "num_stages": 2
  }
}