vllm/model_executor/layers/fused_moe/configs/E=256,N=256,device_name=AMD_Instinct_MI300X,dtype=fp8_w8a8,block_shape=[128,128].json
{
    "1": {
        "BLOCK_SIZE_M": 16,
<<<<<<< HEAD
        "BLOCK_SIZE_N": 32,
        "BLOCK_SIZE_K": 256,
        "GROUP_SIZE_M": 1,
        "num_warps": 4,
=======
        "BLOCK_SIZE_N": 128,
        "BLOCK_SIZE_K": 256,
        "GROUP_SIZE_M": 1,
        "num_warps": 8,
>>>>>>> origin/main
        "num_stages": 2,
        "waves_per_eu": 0
    },
    "2": {
<<<<<<< HEAD
        "BLOCK_SIZE_M": 32,
        "BLOCK_SIZE_N": 16,
        "BLOCK_SIZE_K": 256,
        "GROUP_SIZE_M": 1,
        "num_warps": 2,
=======
        "BLOCK_SIZE_M": 16,
        "BLOCK_SIZE_N": 128,
        "BLOCK_SIZE_K": 256,
        "GROUP_SIZE_M": 1,
        "num_warps": 8,
>>>>>>> origin/main
        "num_stages": 2,
        "waves_per_eu": 0
    },
    "4": {
        "BLOCK_SIZE_M": 16,
<<<<<<< HEAD
        "BLOCK_SIZE_N": 64,
        "BLOCK_SIZE_K": 256,
        "GROUP_SIZE_M": 1,
        "num_warps": 4,
=======
        "BLOCK_SIZE_N": 128,
        "BLOCK_SIZE_K": 256,
        "GROUP_SIZE_M": 1,
        "num_warps": 8,
>>>>>>> origin/main
        "num_stages": 2,
        "waves_per_eu": 0
    },
    "8": {
        "BLOCK_SIZE_M": 16,
        "BLOCK_SIZE_N": 128,
        "BLOCK_SIZE_K": 128,
        "GROUP_SIZE_M": 1,
<<<<<<< HEAD
        "num_warps": 4,
=======
        "num_warps": 8,
>>>>>>> origin/main
        "num_stages": 2,
        "waves_per_eu": 0
    },
    "16": {
        "BLOCK_SIZE_M": 16,
<<<<<<< HEAD
        "BLOCK_SIZE_N": 64,
        "BLOCK_SIZE_K": 128,
        "GROUP_SIZE_M": 4,
=======
        "BLOCK_SIZE_N": 128,
        "BLOCK_SIZE_K": 128,
        "GROUP_SIZE_M": 1,
>>>>>>> origin/main
        "num_warps": 2,
        "num_stages": 2,
        "waves_per_eu": 0
    },
    "24": {
        "BLOCK_SIZE_M": 16,
        "BLOCK_SIZE_N": 128,
        "BLOCK_SIZE_K": 128,
        "GROUP_SIZE_M": 1,
<<<<<<< HEAD
        "num_warps": 4,
=======
        "num_warps": 2,
>>>>>>> origin/main
        "num_stages": 2,
        "waves_per_eu": 0
    },
    "32": {
        "BLOCK_SIZE_M": 16,
<<<<<<< HEAD
        "BLOCK_SIZE_N": 64,
=======
        "BLOCK_SIZE_N": 128,
>>>>>>> origin/main
        "BLOCK_SIZE_K": 128,
        "GROUP_SIZE_M": 4,
        "num_warps": 2,
        "num_stages": 2,
        "waves_per_eu": 0
    },
    "48": {
        "BLOCK_SIZE_M": 16,
<<<<<<< HEAD
        "BLOCK_SIZE_N": 64,
=======
        "BLOCK_SIZE_N": 128,
>>>>>>> origin/main
        "BLOCK_SIZE_K": 128,
        "GROUP_SIZE_M": 4,
        "num_warps": 2,
        "num_stages": 2,
        "waves_per_eu": 0
    },
    "64": {
        "BLOCK_SIZE_M": 16,
<<<<<<< HEAD
        "BLOCK_SIZE_N": 64,
=======
        "BLOCK_SIZE_N": 128,
>>>>>>> origin/main
        "BLOCK_SIZE_K": 128,
        "GROUP_SIZE_M": 1,
        "num_warps": 2,
        "num_stages": 2,
        "waves_per_eu": 0
    },
    "96": {
        "BLOCK_SIZE_M": 16,
<<<<<<< HEAD
        "BLOCK_SIZE_N": 64,
=======
        "BLOCK_SIZE_N": 128,
        "BLOCK_SIZE_K": 128,
        "GROUP_SIZE_M": 8,
        "num_warps": 8,
        "num_stages": 2,
        "waves_per_eu": 0
    },
    "128": {
        "BLOCK_SIZE_M": 16,
        "BLOCK_SIZE_N": 128,
>>>>>>> origin/main
        "BLOCK_SIZE_K": 128,
        "GROUP_SIZE_M": 4,
        "num_warps": 4,
        "num_stages": 2,
        "waves_per_eu": 0
    },
<<<<<<< HEAD
    "128": {
        "BLOCK_SIZE_M": 16,
        "BLOCK_SIZE_N": 64,
        "BLOCK_SIZE_K": 256,
        "GROUP_SIZE_M": 1,
        "num_warps": 2,
        "num_stages": 2,
        "waves_per_eu": 0
    },
    "256": {
        "BLOCK_SIZE_M": 16,
        "BLOCK_SIZE_N": 64,
        "BLOCK_SIZE_K": 128,
        "GROUP_SIZE_M": 4,
=======
    "256": {
        "BLOCK_SIZE_M": 16,
        "BLOCK_SIZE_N": 128,
        "BLOCK_SIZE_K": 128,
        "GROUP_SIZE_M": 8,
>>>>>>> origin/main
        "num_warps": 4,
        "num_stages": 2,
        "waves_per_eu": 0
    },
    "512": {
        "BLOCK_SIZE_M": 32,
<<<<<<< HEAD
        "BLOCK_SIZE_N": 256,
        "BLOCK_SIZE_K": 128,
        "GROUP_SIZE_M": 8,
        "num_warps": 8,
=======
        "BLOCK_SIZE_N": 128,
        "BLOCK_SIZE_K": 128,
        "GROUP_SIZE_M": 8,
        "num_warps": 4,
>>>>>>> origin/main
        "num_stages": 2,
        "waves_per_eu": 0
    },
    "1024": {
        "BLOCK_SIZE_M": 64,
<<<<<<< HEAD
        "BLOCK_SIZE_N": 256,
        "BLOCK_SIZE_K": 128,
        "GROUP_SIZE_M": 8,
        "num_warps": 8,
=======
        "BLOCK_SIZE_N": 128,
        "BLOCK_SIZE_K": 128,
        "GROUP_SIZE_M": 8,
        "num_warps": 2,
        "num_stages": 2,
        "waves_per_eu": 0
    },
    "1536": {
        "BLOCK_SIZE_M": 64,
        "BLOCK_SIZE_N": 128,
        "BLOCK_SIZE_K": 128,
        "GROUP_SIZE_M": 4,
        "num_warps": 2,
        "num_stages": 2,
        "waves_per_eu": 0
    },
    "2048": {
        "BLOCK_SIZE_M": 128,
        "BLOCK_SIZE_N": 256,
        "BLOCK_SIZE_K": 128,
        "GROUP_SIZE_M": 8,
        "num_warps": 4,
        "num_stages": 2,
        "waves_per_eu": 0
    },
    "3072": {
        "BLOCK_SIZE_M": 128,
        "BLOCK_SIZE_N": 256,
        "BLOCK_SIZE_K": 128,
        "GROUP_SIZE_M": 8,
        "num_warps": 4,
        "num_stages": 2,
        "waves_per_eu": 0
    },
    "4096": {
        "BLOCK_SIZE_M": 128,
        "BLOCK_SIZE_N": 256,
        "BLOCK_SIZE_K": 128,
        "GROUP_SIZE_M": 4,
        "num_warps": 4,
>>>>>>> origin/main
        "num_stages": 2,
        "waves_per_eu": 0
    }
}
