vllm/model_executor/layers/fused_moe/configs/E=512,N=512,device_name=NVIDIA_GB10,dtype=fp8_w8a8.json
{
    "triton_version": "3.5.0",
    "1": {
        "BLOCK_SIZE_M": 16,
        "BLOCK_SIZE_N": 128,
        "BLOCK_SIZE_K": 64,
        "GROUP_SIZE_M": 1,
        "num_warps": 4,
        "num_stages": 5
    },
    "2": {
        "BLOCK_SIZE_M": 16,
        "BLOCK_SIZE_N": 128,
        "BLOCK_SIZE_K": 64,
        "GROUP_SIZE_M": 1,
        "num_warps": 4,
        "num_stages": 5
    },
    "4": {
        "BLOCK_SIZE_M": 16,
        "BLOCK_SIZE_N": 128,
        "BLOCK_SIZE_K": 64,
        "GROUP_SIZE_M": 1,
        "num_warps": 4,
        "num_stages": 4
    },
    "8": {
        "BLOCK_SIZE_M": 16,
        "BLOCK_SIZE_N": 128,
        "BLOCK_SIZE_K": 64,
        "GROUP_SIZE_M": 1,
        "num_warps": 4,
        "num_stages": 4
    },
    "16": {
        "BLOCK_SIZE_M": 16,
        "BLOCK_SIZE_N": 128,
        "BLOCK_SIZE_K": 128,
        "GROUP_SIZE_M": 1,
        "num_warps": 4,
        "num_stages": 4
    },
    "24": {
        "BLOCK_SIZE_M": 16,
        "BLOCK_SIZE_N": 128,
        "BLOCK_SIZE_K": 128,
        "GROUP_SIZE_M": 1,
        "num_warps": 4,
        "num_stages": 4
    },
    "32": {
        "BLOCK_SIZE_M": 16,
        "BLOCK_SIZE_N": 128,
        "BLOCK_SIZE_K": 128,
        "GROUP_SIZE_M": 8,
        "num_warps": 4,
        "num_stages": 5
    },
    "48": {
        "BLOCK_SIZE_M": 16,
        "BLOCK_SIZE_N": 128,
        "BLOCK_SIZE_K": 128,
        "GROUP_SIZE_M": 8,
        "num_warps": 4,
        "num_stages": 5
    },
    "64": {
        "BLOCK_SIZE_M": 16,
        "BLOCK_SIZE_N": 128,
        "BLOCK_SIZE_K": 128,
        "GROUP_SIZE_M": 16,
        "num_warps": 4,
        "num_stages": 5
    },
    "96": {
        "BLOCK_SIZE_M": 16,
        "BLOCK_SIZE_N": 128,
        "BLOCK_SIZE_K": 128,
        "GROUP_SIZE_M": 16,
        "num_warps": 4,
        "num_stages": 4
    },
    "128": {
        "BLOCK_SIZE_M": 16,
        "BLOCK_SIZE_N": 128,
        "BLOCK_SIZE_K": 128,
        "GROUP_SIZE_M": 16,
        "num_warps": 4,
        "num_stages": 5
    },
    "256": {
        "BLOCK_SIZE_M": 16,
        "BLOCK_SIZE_N": 128,
        "BLOCK_SIZE_K": 128,
        "GROUP_SIZE_M": 16,
        "num_warps": 4,
        "num_stages": 4
    },
    "512": {
        "BLOCK_SIZE_M": 16,
        "BLOCK_SIZE_N": 128,
        "BLOCK_SIZE_K": 128,
        "GROUP_SIZE_M": 16,
        "num_warps": 4,
        "num_stages": 4
    },
    "1024": {
        "BLOCK_SIZE_M": 32,
        "BLOCK_SIZE_N": 128,
        "BLOCK_SIZE_K": 128,
        "GROUP_SIZE_M": 16,
        "num_warps": 4,
        "num_stages": 4
    },
    "1536": {
        "BLOCK_SIZE_M": 32,
        "BLOCK_SIZE_N": 128,
        "BLOCK_SIZE_K": 128,
        "GROUP_SIZE_M": 16,
        "num_warps": 4,
        "num_stages": 5
    },
    "2048": {
        "BLOCK_SIZE_M": 32,
        "BLOCK_SIZE_N": 128,
        "BLOCK_SIZE_K": 128,
        "GROUP_SIZE_M": 16,
        "num_warps": 4,
        "num_stages": 5
    },
    "3072": {
        "BLOCK_SIZE_M": 32,
        "BLOCK_SIZE_N": 128,
        "BLOCK_SIZE_K": 128,
        "GROUP_SIZE_M": 16,
        "num_warps": 4,
        "num_stages": 5
    },
    "4096": {
        "BLOCK_SIZE_M": 32,
        "BLOCK_SIZE_N": 128,
        "BLOCK_SIZE_K": 128,
        "GROUP_SIZE_M": 16,
        "num_warps": 4,
        "num_stages": 5
    }
}
