vllm/model_executor/layers/fused_moe/configs/E=64,N=8960,device_name=NVIDIA_H100_80GB_HBM3,dtype=bf16.json
{
    "1": {
        "BLOCK_SIZE_M": 64,
        "BLOCK_SIZE_N": 128,
        "BLOCK_SIZE_K": 128,
        "GROUP_SIZE_M": 8,
        "num_warps": 8,
        "num_stages": 4
    },
    "2": {
        "BLOCK_SIZE_M": 32,
        "BLOCK_SIZE_N": 128,
        "BLOCK_SIZE_K": 64,
        "GROUP_SIZE_M": 16,
        "num_warps": 4,
        "num_stages": 2
    },
    "4": {
        "BLOCK_SIZE_M": 32,
        "BLOCK_SIZE_N": 256,
        "BLOCK_SIZE_K": 128,
        "GROUP_SIZE_M": 16,
        "num_warps": 4,
        "num_stages": 3
    },
    "8": {
        "BLOCK_SIZE_M": 128,
        "BLOCK_SIZE_N": 256,
        "BLOCK_SIZE_K": 64,
        "GROUP_SIZE_M": 16,
        "num_warps": 8,
        "num_stages": 2
    },
    "16": {
        "BLOCK_SIZE_M": 32,
        "BLOCK_SIZE_N": 64,
        "BLOCK_SIZE_K": 128,
        "GROUP_SIZE_M": 1,
        "num_warps": 4,
        "num_stages": 2
    },
    "32": {
        "BLOCK_SIZE_M": 128,
        "BLOCK_SIZE_N": 256,
        "BLOCK_SIZE_K": 64,
        "GROUP_SIZE_M": 8,
        "num_warps": 8,
        "num_stages": 4
    },
    "64": {
        "BLOCK_SIZE_M": 64,
        "BLOCK_SIZE_N": 128,
        "BLOCK_SIZE_K": 128,
        "GROUP_SIZE_M": 16,
        "num_warps": 8,
        "num_stages": 2
    },
    "128": {
        "BLOCK_SIZE_M": 32,
        "BLOCK_SIZE_N": 64,
        "BLOCK_SIZE_K": 256,
        "GROUP_SIZE_M": 16,
        "num_warps": 8,
        "num_stages": 3
    },
    "256": {
        "BLOCK_SIZE_M": 16,
        "BLOCK_SIZE_N": 128,
        "BLOCK_SIZE_K": 256,
        "GROUP_SIZE_M": 16,
        "num_warps": 8,
        "num_stages": 3
    },
    "512": {
        "BLOCK_SIZE_M": 16,
        "BLOCK_SIZE_N": 64,
        "BLOCK_SIZE_K": 128,
        "GROUP_SIZE_M": 1,
        "num_warps": 8,
        "num_stages": 2
    }
}
