vllm/model_executor/layers/fused_moe/configs/E=64,N=768,device_name=AMD_Radeon_AI_PRO_R9700,dtype=fp8_w8a8,block_shape=[128,128].json
{
    "triton_version": "3.5.1+rocm7.2.0.gita272dfa8",
    "1": {
        "BLOCK_SIZE_M": 16,
        "BLOCK_SIZE_N": 128,
        "BLOCK_SIZE_K": 256,
        "GROUP_SIZE_M": 1,
        "num_warps": 8,
        "num_stages": 2,
        "waves_per_eu": 0
    },
    "2": {
        "BLOCK_SIZE_M": 16,
        "BLOCK_SIZE_N": 128,
        "BLOCK_SIZE_K": 256,
        "GROUP_SIZE_M": 1,
        "num_warps": 8,
        "num_stages": 2,
        "waves_per_eu": 2
    },
    "4": {
        "BLOCK_SIZE_M": 16,
        "BLOCK_SIZE_N": 128,
        "BLOCK_SIZE_K": 256,
        "GROUP_SIZE_M": 1,
        "num_warps": 8,
        "num_stages": 2,
        "waves_per_eu": 1
    },
    "8": {
        "BLOCK_SIZE_M": 32,
        "BLOCK_SIZE_N": 128,
        "BLOCK_SIZE_K": 256,
        "GROUP_SIZE_M": 1,
        "num_warps": 8,
        "num_stages": 2,
        "waves_per_eu": 4
    },
    "16": {
        "BLOCK_SIZE_M": 16,
        "BLOCK_SIZE_N": 128,
        "BLOCK_SIZE_K": 256,
        "GROUP_SIZE_M": 8,
        "num_warps": 8,
        "num_stages": 2,
        "waves_per_eu": 0
    },
    "32": {
        "BLOCK_SIZE_M": 32,
        "BLOCK_SIZE_N": 128,
        "BLOCK_SIZE_K": 256,
        "GROUP_SIZE_M": 8,
        "num_warps": 8,
        "num_stages": 2,
        "waves_per_eu": 4
    }
}
