vllm/model_executor/layers/fused_moe/configs/E=96,N=704,device_name=Tesla_V100-SXM2-32GB,dtype=int4_w4a16.json
{
  "1": {
    "BLOCK_SIZE_M": 16,
    "BLOCK_SIZE_N": 64,
    "BLOCK_SIZE_K": 32,
    "GROUP_SIZE_M": 1,
    "SPLIT_K": 1,
    "num_warps": 4,
    "num_stages": 1
  },
  "2": {
    "BLOCK_SIZE_M": 16,
    "BLOCK_SIZE_N": 32,
    "BLOCK_SIZE_K": 32,
    "GROUP_SIZE_M": 1,
    "SPLIT_K": 1,
    "num_warps": 2,
    "num_stages": 1
  },
  "4": {
    "BLOCK_SIZE_M": 16,
    "BLOCK_SIZE_N": 32,
    "BLOCK_SIZE_K": 32,
    "GROUP_SIZE_M": 1,
    "SPLIT_K": 1,
    "num_warps": 2,
    "num_stages": 2
  },
  "8": {
    "BLOCK_SIZE_M": 16,
    "BLOCK_SIZE_N": 32,
    "BLOCK_SIZE_K": 32,
    "GROUP_SIZE_M": 1,
    "SPLIT_K": 1,
    "num_warps": 2,
    "num_stages": 2
  },
  "16": {
    "BLOCK_SIZE_M": 16,
    "BLOCK_SIZE_N": 32,
    "BLOCK_SIZE_K": 32,
    "GROUP_SIZE_M": 1,
    "SPLIT_K": 1,
    "num_warps": 2,
    "num_stages": 2
  },
  "24": {
    "BLOCK_SIZE_M": 16,
    "BLOCK_SIZE_N": 64,
    "BLOCK_SIZE_K": 64,
    "GROUP_SIZE_M": 1,
    "SPLIT_K": 1,
    "num_warps": 4,
    "num_stages": 2
  },
  "32": {
    "BLOCK_SIZE_M": 16,
    "BLOCK_SIZE_N": 32,
    "BLOCK_SIZE_K": 32,
    "GROUP_SIZE_M": 1,
    "SPLIT_K": 1,
    "num_warps": 2,
    "num_stages": 2
  },
  "48": {
    "BLOCK_SIZE_M": 32,
    "BLOCK_SIZE_N": 64,
    "BLOCK_SIZE_K": 64,
    "GROUP_SIZE_M": 1,
    "SPLIT_K": 1,
    "num_warps": 4,
    "num_stages": 2
  },
  "64": {
    "BLOCK_SIZE_M": 16,
    "BLOCK_SIZE_N": 32,
    "BLOCK_SIZE_K": 32,
    "GROUP_SIZE_M": 1,
    "SPLIT_K": 1,
    "num_warps": 2,
    "num_stages": 2
  },
  "96": {
    "BLOCK_SIZE_M": 32,
    "BLOCK_SIZE_N": 64,
    "BLOCK_SIZE_K": 64,
    "GROUP_SIZE_M": 1,
    "SPLIT_K": 1,
    "num_warps": 4,
    "num_stages": 2
  },
  "128": {
    "BLOCK_SIZE_M": 64,
    "BLOCK_SIZE_N": 64,
    "BLOCK_SIZE_K": 64,
    "GROUP_SIZE_M": 1,
    "SPLIT_K": 1,
    "num_warps": 4,
    "num_stages": 2
  },
  "256": {
    "BLOCK_SIZE_M": 64,
    "BLOCK_SIZE_N": 64,
    "BLOCK_SIZE_K": 64,
    "GROUP_SIZE_M": 1,
    "SPLIT_K": 1,
    "num_warps": 4,
    "num_stages": 2
  }
}
