vllm/model_executor/layers/mamba/ops/configs/selective_state_update/headdim=64,dstate=128,device_name=NVIDIA_Thor,cache_dtype=float32.json
{
    "triton_version": "3.7.0",
    "128": {
        "BLOCK_SIZE_M": 8,
        "num_warps": 1
    },
    "256": {
        "BLOCK_SIZE_M": 8,
        "num_warps": 1
    },
    "1024": {
        "BLOCK_SIZE_M": 8,
        "num_warps": 1
    },
    "2048": {
        "BLOCK_SIZE_M": 8,
        "num_warps": 8
    },
    "4096": {
        "BLOCK_SIZE_M": 32,
        "num_warps": 8
    },
    "8192": {
        "BLOCK_SIZE_M": 16,
        "num_warps": 8
    },
    "16384": {
        "BLOCK_SIZE_M": 32,
        "num_warps": 8
    },
    "32768": {
        "BLOCK_SIZE_M": 64,
        "num_warps": 8
    },
    "65536": {
        "BLOCK_SIZE_M": 32,
        "num_warps": 8
    },
    "131072": {
        "BLOCK_SIZE_M": 16,
        "num_warps": 8
    },
    "196608": {
        "BLOCK_SIZE_M": 16,
        "num_warps": 8
    },
    "262144": {
        "BLOCK_SIZE_M": 16,
        "num_warps": 8
    }
}