vllm/model_executor/layers/mamba/ops/configs/selective_state_update/headdim=64,dstate=128,device_name=NVIDIA_RTX_PRO_6000_Blackwell_Server_Edition,cache_dtype=float16.json
{
    "triton_version": "3.6.0",
    "8": {
        "BLOCK_SIZE_M": 4,
        "num_warps": 4
    },
    "16": {
        "BLOCK_SIZE_M": 4,
        "num_warps": 1
    },
    "32": {
        "BLOCK_SIZE_M": 4,
        "num_warps": 1
    },
    "64": {
        "BLOCK_SIZE_M": 8,
        "num_warps": 8
    },
    "128": {
        "BLOCK_SIZE_M": 16,
        "num_warps": 8
    },
    "256": {
        "BLOCK_SIZE_M": 16,
        "num_warps": 8
    },
    "512": {
        "BLOCK_SIZE_M": 16,
        "num_warps": 8
    },
    "1024": {
        "BLOCK_SIZE_M": 16,
        "num_warps": 8
    },
    "2048": {
        "BLOCK_SIZE_M": 16,
        "num_warps": 8
    },
    "4096": {
        "BLOCK_SIZE_M": 16,
        "num_warps": 8
    },
    "8192": {
        "BLOCK_SIZE_M": 32,
        "num_warps": 1
    },
    "12288": {
        "BLOCK_SIZE_M": 16,
        "num_warps": 1
    },
    "16384": {
        "BLOCK_SIZE_M": 32,
        "num_warps": 4
    },
    "24576": {
        "BLOCK_SIZE_M": 32,
        "num_warps": 4
    },
    "32768": {
        "BLOCK_SIZE_M": 4,
        "num_warps": 1
    },
    "49152": {
        "BLOCK_SIZE_M": 32,
        "num_warps": 2
    },
    "65536": {
        "BLOCK_SIZE_M": 32,
        "num_warps": 1
    },
    "98304": {
        "BLOCK_SIZE_M": 4,
        "num_warps": 1
    },
    "131072": {
        "BLOCK_SIZE_M": 4,
        "num_warps": 1
    },
    "196608": {
        "BLOCK_SIZE_M": 32,
        "num_warps": 1
    },
    "262144": {
        "BLOCK_SIZE_M": 16,
        "num_warps": 1
    }
}