vllm/model_executor/layers/quantization/utils/configs/N=8192,K=1024,device_name=NVIDIA_GB10,dtype=fp8_w8a8,block_shape=[128,128].json
{
    "1": {
        "BLOCK_SIZE_M": 16,
        "BLOCK_SIZE_N": 64,
        "BLOCK_SIZE_K": 64,
        "GROUP_SIZE_M": 1,
        "num_warps": 4,
        "num_stages": 2
    },
    "4": {
        "BLOCK_SIZE_M": 16,
        "BLOCK_SIZE_N": 64,
        "BLOCK_SIZE_K": 128,
        "GROUP_SIZE_M": 32,
        "num_warps": 4,
        "num_stages": 2
    },
    "8": {
        "BLOCK_SIZE_M": 16,
        "BLOCK_SIZE_N": 64,
        "BLOCK_SIZE_K": 64,
        "GROUP_SIZE_M": 16,
        "num_warps": 4,
        "num_stages": 2
    },
    "16": {
        "BLOCK_SIZE_M": 16,
        "BLOCK_SIZE_N": 64,
        "BLOCK_SIZE_K": 128,
        "GROUP_SIZE_M": 32,
        "num_warps": 4,
        "num_stages": 2
    },
    "32": {
        "BLOCK_SIZE_M": 32,
        "BLOCK_SIZE_N": 64,
        "BLOCK_SIZE_K": 128,
        "GROUP_SIZE_M": 16,
        "num_warps": 4,
        "num_stages": 2
    }
}
