vllm/model_executor/layers/mamba/configs/headdim=64,dstate=128,device_name=NVIDIA_B200,cache_dtype=float32.json
{
    "triton_version": "3.6.0",
    "8": {
        "BLOCK_SIZE_M": 4,
        "num_warps": 4
    },
    "16": {
        "BLOCK_SIZE_M": 16,
        "num_warps": 1
    },
    "24": {
        "BLOCK_SIZE_M": 4,
        "num_warps": 8
    },
    "32": {
        "BLOCK_SIZE_M": 32,
        "num_warps": 2
    },
    "48": {
        "BLOCK_SIZE_M": 16,
        "num_warps": 4
    },
    "64": {
        "BLOCK_SIZE_M": 4,
        "num_warps": 2
    },
    "96": {
        "BLOCK_SIZE_M": 8,
        "num_warps": 2
    },
    "128": {
        "BLOCK_SIZE_M": 16,
        "num_warps": 8
    },
    "192": {
        "BLOCK_SIZE_M": 4,
        "num_warps": 8
    },
    "256": {
        "BLOCK_SIZE_M": 4,
        "num_warps": 4
    },
    "384": {
        "BLOCK_SIZE_M": 16,
        "num_warps": 2
    },
    "512": {
        "BLOCK_SIZE_M": 8,
        "num_warps": 8
    },
    "768": {
        "BLOCK_SIZE_M": 4,
        "num_warps": 4
    },
    "1024": {
        "BLOCK_SIZE_M": 4,
        "num_warps": 2
    },
    "1536": {
        "BLOCK_SIZE_M": 4,
        "num_warps": 1
    },
    "2048": {
        "BLOCK_SIZE_M": 8,
        "num_warps": 8
    },
    "3072": {
        "BLOCK_SIZE_M": 16,
        "num_warps": 8
    },
    "4096": {
        "BLOCK_SIZE_M": 4,
        "num_warps": 1
    },
    "6144": {
        "BLOCK_SIZE_M": 4,
        "num_warps": 1
    },
    "8192": {
        "BLOCK_SIZE_M": 4,
        "num_warps": 1
    },
    "12288": {
        "BLOCK_SIZE_M": 4,
        "num_warps": 1
    },
    "16384": {
        "BLOCK_SIZE_M": 4,
        "num_warps": 1
    },
    "24576": {
        "BLOCK_SIZE_M": 4,
        "num_warps": 1
    },
    "32768": {
        "BLOCK_SIZE_M": 4,
        "num_warps": 1
    },
    "49152": {
        "BLOCK_SIZE_M": 4,
        "num_warps": 1
    },
    "65536": {
        "BLOCK_SIZE_M": 4,
        "num_warps": 1
    },
    "98304": {
        "BLOCK_SIZE_M": 4,
        "num_warps": 1
    },
    "131072": {
        "BLOCK_SIZE_M": 4,
        "num_warps": 1
    },
    "196608": {
        "BLOCK_SIZE_M": 4,
        "num_warps": 1
    },
    "262144": {
        "BLOCK_SIZE_M": 4,
        "num_warps": 1
    }
}
