vllm/model_executor/layers/fused_moe/configs/legacy_configs/E=16,N=3200,device_name=NVIDIA_H100_80GB_HBM3,dtype=fp8_w8a8.json
{
    "3328": {
        "BLOCK_SIZE_M": 64,
        "BLOCK_SIZE_N": 256,
        "BLOCK_SIZE_K": 64,
        "GROUP_SIZE_M": 16,
        "num_warps": 4,
        "num_stages": 2
    },
    "1024": {
        "BLOCK_SIZE_M": 64,
        "BLOCK_SIZE_N": 256,
        "BLOCK_SIZE_K": 32,
        "GROUP_SIZE_M": 32,
        "num_warps": 4,
        "num_stages": 4
    },
    "3072": {
        "BLOCK_SIZE_M": 64,
        "BLOCK_SIZE_N": 256,
        "BLOCK_SIZE_K": 64,
        "GROUP_SIZE_M": 32,
        "num_warps": 4,
        "num_stages": 2
    },
    "256": {
        "BLOCK_SIZE_M": 32,
        "BLOCK_SIZE_N": 256,
        "BLOCK_SIZE_K": 128,
        "GROUP_SIZE_M": 8,
        "num_warps": 4,
        "num_stages": 4
    },
    "768": {
        "BLOCK_SIZE_M": 128,
        "BLOCK_SIZE_N": 128,
        "BLOCK_SIZE_K": 64,
        "GROUP_SIZE_M": 8,
        "num_warps": 4,
        "num_stages": 4
    },
    "1792": {
        "BLOCK_SIZE_M": 128,
        "BLOCK_SIZE_N": 128,
        "BLOCK_SIZE_K": 64,
        "GROUP_SIZE_M": 16,
        "num_warps": 4,
        "num_stages": 4
    },
    "2560": {
        "BLOCK_SIZE_M": 64,
        "BLOCK_SIZE_N": 256,
        "BLOCK_SIZE_K": 64,
        "GROUP_SIZE_M": 32,
        "num_warps": 4,
        "num_stages": 2
    },
    "2816": {
        "BLOCK_SIZE_M": 128,
        "BLOCK_SIZE_N": 128,
        "BLOCK_SIZE_K": 64,
        "GROUP_SIZE_M": 16,
        "num_warps": 4,
        "num_stages": 4
    },
    "3584": {
        "BLOCK_SIZE_M": 64,
        "BLOCK_SIZE_N": 256,
        "BLOCK_SIZE_K": 64,
        "GROUP_SIZE_M": 32,
        "num_warps": 4,
        "num_stages": 2
    },
    "1536": {
        "BLOCK_SIZE_M": 64,
        "BLOCK_SIZE_N": 256,
        "BLOCK_SIZE_K": 64,
        "GROUP_SIZE_M": 64,
        "num_warps": 4,
        "num_stages": 2
    },
    "2048": {
        "BLOCK_SIZE_M": 64,
        "BLOCK_SIZE_N": 256,
        "BLOCK_SIZE_K": 64,
        "GROUP_SIZE_M": 64,
        "num_warps": 4,
        "num_stages": 2
    },
    "512": {
        "BLOCK_SIZE_M": 64,
        "BLOCK_SIZE_N": 256,
        "BLOCK_SIZE_K": 64,
        "GROUP_SIZE_M": 8,
        "num_warps": 4,
        "num_stages": 4
    },
    "3840": {
        "BLOCK_SIZE_M": 128,
        "BLOCK_SIZE_N": 128,
        "BLOCK_SIZE_K": 64,
        "GROUP_SIZE_M": 16,
        "num_warps": 4,
        "num_stages": 4
    },
    "1280": {
        "BLOCK_SIZE_M": 64,
        "BLOCK_SIZE_N": 256,
        "BLOCK_SIZE_K": 64,
        "GROUP_SIZE_M": 64,
        "num_warps": 4,
        "num_stages": 2
    },
    "2304": {
        "BLOCK_SIZE_M": 64,
        "BLOCK_SIZE_N": 256,
        "BLOCK_SIZE_K": 64,
        "GROUP_SIZE_M": 32,
        "num_warps": 4,
        "num_stages": 2
    },
    "4096": {
        "BLOCK_SIZE_M": 64,
        "BLOCK_SIZE_N": 256,
        "BLOCK_SIZE_K": 64,
        "GROUP_SIZE_M": 32,
        "num_warps": 4,
        "num_stages": 2
    }
}