vllm/model_executor/layers/mamba/configs/NVIDIA_GB10/dstate=64.json
{
    "1": {
        "BLOCK_SIZE_M": 32,
        "num_warps": 2
    },
    "2": {
        "BLOCK_SIZE_M": 8,
        "num_warps": 4
    },
    "4": {
        "BLOCK_SIZE_M": 32,
        "num_warps": 4
    },
    "8": {
        "BLOCK_SIZE_M": 16,
        "num_warps": 4
    },
    "16": {
        "BLOCK_SIZE_M": 16,
        "num_warps": 1
    },
    "32": {
        "BLOCK_SIZE_M": 32,
        "num_warps": 2
    },
    "64": {
        "BLOCK_SIZE_M": 8,
        "num_warps": 8
    },
    "128": {
        "BLOCK_SIZE_M": 8,
        "num_warps": 4
    },
    "256": {
        "BLOCK_SIZE_M": 8,
        "num_warps": 4
    },
    "512": {
        "BLOCK_SIZE_M": 32,
        "num_warps": 8
    },
    "1024": {
        "BLOCK_SIZE_M": 4,
        "num_warps": 4
    }
}